"Paper Title","Paper Link","Publication Year","Publication Type","Publication Title","Author Names","DOI","PDF Link","Abstract","TL;DR"
"More than the sea: Review of different approaches to seascapes reveals unique transdisciplinary conceptualizations and contributions of archaeology","https://scispace.com/paper/more-than-the-sea-review-of-different-approaches-to-5f43nj60wnzs","2024","Journal Article","The Journal of Island and Coastal Archaeology","Ian J. McNiven","10.1080/15564894.2024.2411686","","Seascapes mean different things to different people and disciplines. Scholarship over the past 30 years has seen conceptualizations of seascapes move beyond dictionary definitions of seascapes as marine vistas to nuanced understandings of seas variously emphasizing their biological and cultural dimensions. Biological approaches (conservation) focus on marine ecosystems and management aimed at minimizing human impacts with cultural values increasingly acknowledged as critical to the success of marine protected areas. Cultural approaches (heritage, history, anthropology, and archaeology) focus on the symbolic dimensions of seas as culturally constructed and linked to maritime peoples and maritime cultures and identity. Maritime historians have sought to reposition the sea from a backdrop to history to an active and agentive historical actor. Maritime anthropologists have focused on cosmological and cultural underpinnings of customary maritime tenure by small-scale coastal communities. Maritime archaeologists have expanded their research scope from shipwrecks such that seascapes include maritime infrastructure on land. While interdisciplinarity underpins cultural approaches to seascapes, the transdisciplinarity of anthropologically and historically informed archaeologies allows cross-cultural conceptualization of seascapes as extending from the sea (marine seascapes) across adjacent lands (terrestrial seascapes) and ritual engagement with the sea as a sentient and animate realm and cosmologically constructed spiritscape. Ontological notions of sentient seas and agentive seascapes invite future seascape scholarship to further explore more authentic bottom-up, emic, mariners' and sea peoples' epistemological positions centering on ""how seas think"" and ""who is the ocean."" Such notions and positions provide enormous scope for archaeologists to further explore the marine and terrestrial expressions of seascapes given that maritime peoples' social and spiritual relationships with sentient seas are mediated materially by rituals involving sites (e.g., shrines) and objects (e.g., votives) both in the sea and on land. ","This review synthesizes diverse approaches to seascapes, highlighting transdisciplinary conceptualizations that integrate biological, cultural, and ontological perspectives, emphasizing the sea's agency and the importance of emic, mariner-centered epistemologies in understanding seascapes as sentient realms."
"Part V Regional Perspectives on Global Ocean Governance, 11 The African Perspective on Global Ocean Governance","https://scispace.com/paper/part-v-regional-perspectives-on-global-ocean-governance-11-1ygi1v0mck","2018","Book","","Vrancken Patrick","10.1093/LAW/9780198824152.003.0011","","This chapter discusses issues of global ocean governance from an African perspective. It first provides an overview of the historical lack of engagement by Africa in the 400-year long evolution of the customary international law of the sea before considering its belated entry into the international negotiation process that yielded the 1982 United Nations Convention on the Law of the Sea (UNCLOS). It then describes the developing institutional framework for African ocean governance, focusing on the African Union and its areas of competence, along with the different African regional arrangements that have been established to address maritime issues ranging from natural environmental protection and sustainable marine resource development, to maritime transport safety and security. It also examines Africa's contribution to global ocean governance framework and concludes with an assessment of the Combined Exclusive Maritime Zone of Africa (CEMZA) proposal.","In this article, the authors discuss issues of global ocean governance from an African perspective, focusing on the African Union and its areas of competence, along with different African regional arrangements that have been established to address maritime issues ranging from natural environmental protection and sustainable marine resource development, to maritime transport safety and security."
"What representations for the Ocean?","https://scispace.com/paper/what-representations-for-the-ocean-3esymew5qi","2024","Journal Article","Hybrid","Alice Cuvelier","10.4000/hybrid.3937","","The conceptualisation of the Ocean as a resource and as a navigable surface, as old as it is persistent, is based on a utility relationship between humans on the one hand and a space, a territory, on the other. It is debatable if we are trying to account for a living relationship—understood as symbiotic—with the Ocean. It excludes the possibility of empathy with those who inhabit it: animals, plants, minerals, plastics, ecosystems, and so on. By seeking out the conceptualisations that support representations of those who populate the Ocean, the challenge is to identify what in the history of humans has led them to invisibilise entities that are essential to the survival of the biosphere. ","This paper reevaluates the human-Ocean relationship, questioning the utility-based conceptualization and seeking alternative representations that acknowledge the Ocean's inhabitants, including animals, plants, and ecosystems, to promote empathy and understanding of the biosphere's interconnectedness."
"Gender equity and collaborative care in Madagascar’s locally managed marine areas: reflections on the launch of a fisherwomen’s network","https://scispace.com/paper/gender-equity-and-collaborative-care-in-madagascars-locally-tgtrosnc","2023","Journal Article","Ecology and Society","Merrill S. A. Baker-Médard
Vatosoa Rakotondrazafy","10.5751/es-13959-280226","https://scispace.com/pdf/gender-equity-and-collaborative-care-in-madagascars-locally-tgtrosnc.pdf","Collaborative care refers to the collectively formed reciprocal relationships that emerge between the human and more-than-human world. Such care relations are more robust when individuals from different socioeconomic, gender, and political stratifications participate in decision making. This condition applies to gender equity in ocean conservation and fisheries governance practices. Despite their deep involvement in marine fisheries and their labor in sustainable fisheries management and marine conservation, women are often underrepresented in and overlooked by environmental management institutions. Highlighting the importance of gender to effective marine management underscores the need to reconfigure leadership in marine resource governance, and to reconsider how that leadership is understood. To investigate how gender affects community-based conservation, this paper explores marine management practices in Madagascar. Incorporating conversational method and auto-ethnography, we center the expertise and experience of Malagasy women leaders, who have been deeply involved with the foundation and management of a gender-inclusive community marine resource management network. This is especially relevant to Madagascar, where locally managed marine areas (LMMAs) have expanded dramatically in the last decade. Many of these LMMAs have explicitly focused on reconfiguring power relations between international conservation efforts and local resource user needs and values. Overall, the LMMA approach has improved local involvement in resource management decisions, yet areas of weakness remain. We argue that a more inclusive, and thus more effective, approach to governing marine commons requires a focus on the act of commoning: the process through which reciprocity, accountability, and collaborative care are developed within a community. To achieve whole-community governance, we advocate for allocating more resources toward such commoning practices and toward those who are most marginalized in current marine management. Madagascar’s evolving network of fisherwomen leaders provides key insights into how interventions for commoning in marine conservation can advance collaborative care of interdependent human-environment systems. ","In this article , the authors investigate how gender affects community-based conservation practices in Madagascar and propose a more inclusive and effective approach to governing marine commons requires a focus on the act of commoning: the process through which reciprocity, accountability, and collaborative care are developed within a community."
"Assembling ocean life: more-than-human entanglements in the Blue economy","https://scispace.com/paper/assembling-ocean-life-more-than-human-entanglements-in-the-4omrqyx5a2","2017","Journal Article","Dialogues in human geography","Christopher Bear","10.1177/2043820617691635","https://scispace.com/pdf/assembling-ocean-life-more-than-human-entanglements-in-the-4omrqyx5a2.pdf","While welcoming the intervention of Winders and Le Heron as opening up a space for critical – and practical – engagement with so-called ‘Blue Economy’ thinking, their employment of assemblage approaches could be extended. Doing so might produce a different conceptualisation of the blue economy, while concurrently establishing new challenges for blue economic practices. In this commentary, I focus on three key areas: 1) the ontological separation of land and sea and the conceptualisation of ‘marine space’; 2) the ‘liveliness’ of oceans; and 3) practical possibilities for Blue Economy policies to draw on and engage with ‘wet ontologies’. I argue that future geographical research on the Blue Economy would benefit from moving away from categorisations of the ‘ecological’ or ‘bio’ and towards a fuller engagement with the diversity of actants and forces that contribute to the emergence of new practices, policies and (de)territorialisations.","In this paper, the ontological separation of land and sea and the conceptualisation of ""marine space"" are discussed, as well as the liveliness of oceans and the practical possibilities for blue economy policies to draw on and engage with ""wet ontologies""."
"Reimagining Ocean Connections: Relationality and Care in Ocean Literacy","https://scispace.com/paper/reimagining-ocean-connections-relationality-and-care-in-1gcvo0rg1egg","2025","Journal Article","","Mana Tugend","10.1007/978-3-031-78062-2_6","","Abstract This chapter re-evaluates our relationship with the ocean, challenging traditional views that reduce it to a mere resource. It advocates for a shift towards ocean literacy, emphasizing the interconnectedness and interdependence between humans and the marine environment through the values of relationality and care. Relationality rejects Western dualisms, promoting a holistic perspective that sees humans and the ocean as deeply interconnected. Care highlights the ethical and emotional dimensions of this relationship, advocating for empathy and responsibility. By exploring these values through two pathways—connecting with each other and with the ocean—the chapter illustrates how integrating relationality and care can transform ocean governance. ","This chapter reimagines ocean connections by challenging traditional views, promoting ocean literacy through relationality and care, and advocating for a holistic, interconnected perspective that prioritizes empathy, responsibility, and emotional connection with the marine environment."
"Managing marine socio-ecological systems: picturing the future","https://scispace.com/paper/managing-marine-socio-ecological-systems-picturing-the-41qni0my5g","2017","Journal Article","Ices Journal of Marine Science","Olivier Thébaud
Jason S. Link
Bas Kohler
Marloes Kraan
Romain Lopez
Jan Jaap Poos
J. Schmidt
David Smith
David Smith","10.1093/ICESJMS/FSW252","","What do you get when a lawyer, a modeller, an economist, a social scientist and an ecologist talk about the ocean? Besides an interesting conversation, it is likely there will be some consideration of how to solve many of the problems facing marine ecosystems around the world. That is precisely what the MSEAS 2016 symposium on understanding marine socio-ecological systems aimed to do. From 30 May to 3 June in Brest, France, the symposium gathered over 230 participants from around the world and from multiple disciplines to discuss the challenge of explicitly considering the human component in producing synoptic assessments of marine social-ecological systems. The symposium fostered dynamic debates on the inter-disciplinary collaborations needed to support management of ongoing and anticipated growth in multiple ocean uses, with particular consideration of the triple bottom line of ecological, economic and social sustainability. Building on the illustrations produced by a professional cartoonist during the meeting, this graphic novel summarizes the key challenges ahead in understanding marine socio-ecological systems and draws a path for future research endeavours in this domain.","The MSEAS 2016 Symposium on understanding marine socio-ecological systems aimed to do. as mentioned in this paper summarizes the key challenges ahead in understanding marine eco-ecology systems and draws a path for future research endeavours in this domain."
"The ocean in excess: Towards a more-than-wet ontology:","https://scispace.com/paper/the-ocean-in-excess-towards-a-more-than-wet-ontology-2xxu9biv2a","2019","Journal Article","Dialogues in human geography","Kimberley Peters
Philip E. Steinberg","10.1177/2043820619872886","https://scispace.com/pdf/the-ocean-in-excess-towards-a-more-than-wet-ontology-2xxu9biv2a.pdf","This article builds upon previous assertions that the ocean provides a fertile environment for reconceptualising understandings of space, time, movement and experiences of being in a transformative...","In this article, the authors build upon previous assertions that the ocean provides a fertile environment for reconceptualising understandings of space, time, movement and experiences of being in a transformative..."
"The transformation of the oceans and the future of marine social science","https://scispace.com/paper/the-transformation-of-the-oceans-and-the-future-of-marine-tjj5e431yh","2018","Journal Article","Maritime Studies","Peter Arbo
Maaike Knol
Sebastian Linke
Kevin St. Martin","10.1007/S40152-018-0117-5","https://scispace.com/pdf/the-transformation-of-the-oceans-and-the-future-of-marine-tjj5e431yh.pdf","The oceans have become a juncture of great visions of blue growth as well as strong environmental concern. This paper discusses the essential role of the social sciences as the oceans increasingly emerge as a contested social arena. The marine social sciences have generated a vast knowledge about the development of fisheries and the implications of fisheries policies on coastal communities. We review this heritage and show that it makes the marine social sciences well qualified to address contemporary challenges raised by the increasing ambitions of exploiting and conserving the world’s oceans. However, with the current transformation of the oceans as sites of comprehensive industrialization, captured in the concept of blue growth, we argue that marine social scientists need to rethink their research objectives. This requires a reflection on the lessons learned from decades of engagement with fisheries and fisheries policy to understand and intervene in processes and practices of modernization, science-based management, and privatization of resources. We suggest how the marine social sciences can provide new knowledge and actively engage in current developments by studying emergent processes in the marine environment, and the institutions, practices, and discourses that shape them. The social sciences have a responsibility to contribute to growth and conservation issues, and are in the capacity to do so, through formulating governance alternatives, anticipating future trends, imagining desirable futures, and facilitating socially just processes and outcomes.","The marine social sciences have generated a vast knowledge about the development of fisheries and the implications of fisheries policies on coastal communities and are well qualified to address contemporary challenges raised by the increasing ambitions of exploiting and conserving the world's oceans as discussed by the authors."
"Governing the ocean in the Anthropocene era: area-based management as a tool to promote the socialisation of the law of the sea","https://scispace.com/paper/governing-the-ocean-in-the-anthropocene-era-area-based-3d26ybp3ja","2023","Book Chapter","","Vonintsoa Rafaly","10.4337/9781035314645.00010","","The Anthropocene is the geological turning point in the relationship between humans and nature. This new era is characterized by rapid, unprecedented and uncertain environmental challenges. It challenges fundamental principles of international law, especially the law of the sea. From States’ sovereignty over marine areas and resources and freedom of the sea to consideration of the oceans as a common concern, this study aims to draw a narrative on the socialization process under the law of the sea. It focuses on the development of area-based management tools (ABMTs) to illustrate the promotion of common interests, the development of cooperation and the empowerment of relevant stakeholders to tackle these new challenges. It builds on a theoretical and practical perspective. ","Governing the ocean in the Anthropocene era requires the promotion of the socialisation of the law of the sea through area-based management tools to address environmental challenges and promote common interests."
"Promoting Blue Resilience: Knowledge Systems Integration, Maritime Heritage, and Culture-based Climate Action in Coastal Communities","https://scispace.com/paper/promoting-blue-resilience-knowledge-systems-integration-vr183rhgr5c1","2025","Journal Article","","Marisa O. Ensor","10.5194/oos2025-16","","The significant role that Indigenous and local knowledge (ILK) and cultural maritime heritage (CMH) can play in coastal communities’ adaptation to climate change and ocean governance has received increased attention in recent years. ILK often encompasses a sophisticated understanding of the marine and coastal environment, its ecosystems, the impact of human activity, and the cultural significance associated with specific landscapes and seascapes. Based on this understanding, ILK holders have developed sustainable ways of managing marine and coastal resources and spaces, which have proven to be effective in safeguarding the ecological balance of their traditional land-ocean interfaces while adapting to a changing climate. Similarly, both tangible and intangible maritime heritage frame human interaction with coastal and marine environments and represent an invaluable resource to help coastal communities strengthen their adaptive capacity and inform their role as wise stewards of our ocean planet. Recognizing and incorporating ILK and CMH into marine spatial planning and climate adaptation can thus significantly enhance their effectiveness and ensure a balance between climate action, conservation goals, economic activities, and cultural preservation for a resilient ocean. Nevertheless, despite increasing interest in knowledge integration for ocean governance and coastal climate adaptation, efforts to do so remain fragmented and insufficient in practice. Power imbalances may perpetuate dominant forms of knowledge over others and obstruct efforts at knowledge co-production. Drawing on cross-disciplinary field research on coastal communities across the world, this presentation offers co-generated insights regarding knowledge systems integration into climate adaptation strategies that can protect coastal communities against increasing climate-driven risks while preserving their marine ecosystems and their natural and cultural heritage. I advocate a social learning (SL) approach understood as the joint and collaborative learning that occurs through stakeholders’ interactions in a process of collective discussion and the search for solutions to environmental problems. Evidence from my own and others’ fieldwork strongly suggests that SL is a fruitful approach to knowledge system integration incorporating ILK, CMH and Western science-based knowledge towards the promotion of “blue resilience” in coastal communities. ","This study advocates for integrating Indigenous and local knowledge, cultural maritime heritage, and Western science to enhance coastal communities' climate adaptation and ocean governance, promoting ""blue resilience"" through social learning and knowledge co-production."
"Empty oceans – humanizing ocean and seascapes for building transdisciplinary knowledge and practice","https://scispace.com/paper/empty-oceans-humanizing-ocean-and-seascapes-for-building-2ow7r2k3","2022","Book Chapter","","","10.4324/9781003311171-3","","The challenges of the contemporary environmental crisis and climatic emergency need for a radical change in the ways we inhabit this planet. A dialogical, diverse knowledge and multi-scalar integrative perspective is necessary to comprehend and to manage the complex socio-ecological problems of our time. It means deep challenges to our scientific practice and epistemology. We propose to analyse oceans and seas as landscapes that have been built through centuries of humans and humans-environment relations and open the space to power relations, asymmetries, discourses, and representations. This chapter provides theoretical and methodological tools to un-discipline the knowledge of the oceans and seas, territories where discourses and practices from earth and natural sciences predominate. ","In this paper , the authors propose to analyse oceans and seas as landscapes that have been built through centuries of humans and humans-environment relations and open the space to power relations, asymmetries, discourses, and representations."
"Aqueous logics: Towards a hydro feminism approach to sustainability","https://scispace.com/paper/aqueous-logics-towards-a-hydro-feminism-approach-to-xhc52tiy8n","2023","Journal Article","","Beatrice Maggipinto","10.21606/iasdr.2023.437","https://scispace.compdf/aqueous-logics-towards-a-hydro-feminism-approach-to-xhc52tiy8n.pdf","In the popular imagination, sustainability is often synonymous with environmentalism, but it encapsulates much more. While environmentalism and conservation are often a focal point of sustainability efforts, so too are the people who impact the environment through their actions and associated activism. In this paper, we examine the discourse on sustainability, nature conservation and climate change. We focus, in particular, on the relationship between humans and the seas, where three main topics entangle: eco-feminism, ocean conservation and well-being. This paper highlights its implications for research on sustainability, nature conservation and climate change by outlining an aqueous logic — a fluid way of seeing the world that is oriented toward mutual care and embodiment. ","Aqueous logics explores the relationship between humans and the seas, focusing on eco-feminism, ocean conservation and well-being."
