"Paper Title","Paper Link","Publication Year","Publication Type","Publication Title","Author Names","DOI","PDF Link","Abstract","TL;DR"
"Blue Urbanism","https://scispace.com/paper/blue-urbanism-vnjnxehus4","2024","Journal Article","International Journal of Environment, Architecture, and Societies","Gabriel Yit Vui Yong
Noor Hasharina Hassan","10.26418/ijeas.2024.4.01.23-36","","Coastal cities are most at risk to rising sea levels and increased precipitation. This is however the Climate Change Scenario forecasted for the humid tropical region in the IPCC’s Sixth Assessment report. As standard engineering (grey) solutions are prohibitive in many developing countries due to financial and technical limitations, this paper proposes an adaptive blue approach. It shares insights from Brunei, where the old capital was a city built over water. It also presents findings from a preliminary survey to gauge the public’s views on a set of blue urbanism proposals. The study found positive support for the proposals in general. In particular, there was strong support for: (i) incorporating ‘green’ features into the urban complex; (ii) more public spaces where people could learn about their cultural heritage; and (iii) participation in the life and management of the city. There is however (iv) less enthusiastic response to blue features. The paper discusses viability of the blue urbanism approach vis-à-vis cultural and contextual changes. The insights presented could be useful to other coastal cities in the region. ","Blue urbanism offers a viable approach for coastal cities facing rising sea levels and increased precipitation. It proposes incorporating green features, public spaces for cultural heritage learning, and participatory governance into urban development."
"Urban Marine Protected Areas and the Role of Blue Democracy Towards Healthy Coastal Cities","https://scispace.com/paper/urban-marine-protected-areas-and-the-role-of-blue-democracy-3jkkk0otrd","2023","Preprint","","Jeremy Anbleyth‐Evans
Simon J. Pittman
Aleke Stöfen-O′Brien","10.2139/ssrn.4516616","","Coastal cities produce the greatest intensity and diversity of environmental challenges to progress towards the UN Sustainable Development Goals and the Kunming-Montreal Global Biodiversity Framework. For centuries, cities have insufficiently recognised urban impacts to marine biodiversity and the importance of a clean, safe, and accessible ocean for human well-being. We conducted a global macro review of 200 coastal cities to identify injustice linked to marine pollution, the potential for local social mechanisms to address negative impacts and the occurrence of urban Marine Protected Areas (uMPAs). Using semi-structured interviews and participatory mapping, we develop three case studies (Chile, Panama and the United Kingdom) examine the influence of blue democracy on success in urban marine conservation and integrated planning in Chile, Panama and the United Kingdom. We highlight the challenges and enabling conditions for new participatory marine democratic systems to evolve at the urban-MPA planning nexus. Our global analysis reveals that only 7% of MPAs are within 1 km of urban centres with most MPAs situated far from cities where cumulative human impacts and conflict are typically less severe. Integrated urban-ocean planning is rare and MPAs are typically not considered as tools specifically to address water quality and access issues. Positive examples exist where urban communities have driven initiatives to strive towards conservation and to protect the marine environment from urban impacts. By exploring marine conservation through the framework of marine democracy we highlight how different assemblages of the public, social movements, environmental groups, and governance come together to realise positive socio-ecological outcomes. We highlight socio-political barriers and the importance of the empowerment of local urban communities in decisions. The transition to healthier blue democracy through new cultures of restorative reciprocity can develop through the implementation of uMPAs. We call for urgent action from cities worldwide to respond to their responsibility to provide healthy coastal environments for people and planet. ","Urban Marine Protected Areas and the Role of Blue Democracy Towards Healthy Coastal Cities TLDR: Cities have insufficiently recognized their impacts on marine biodiversity and the importance of a clean, safe, and accessible ocean for human well-being. Only 7% of MPAs are within 1 km of urban centres and integrated urban-ocean planning is rare. There is a need for urgent action from cities worldwide to respond to their responsibility to provide healthy coastal environments for people and planet."
"City seascapes","https://scispace.com/paper/city-seascapes-1n4jmh0i","2022","Book Chapter","","Maik Arnold","10.4324/9780429273452-22","","We live on the blue planet and to an increasing extent on the urban planet. Yet there is relatively little effort to connect these agendas. This chapter explores the vision and practice of Ocean Cities: cities that prioritize connections to the marine realm, recognizing the importance of ocean environments to health, wellbeing and meaningful urban life, but also an ethical obligation to work on behalf of marine life and environments. This chapter tackles some of the important planning and policy implications of Ocean Cities, including the many different ways to foster connections and connectedness: for instance, through physical design and planning that connect to water and through creative initiatives to make the marine world more visible in cities. ","In this paper , the authors explore the vision and practice of Ocean Cities: cities that prioritize connections to the marine realm, recognizing the importance of ocean environments to health, wellbeing and meaningful urban life, but also an ethical obligation to work on behalf of marine life and environments."
"The new blue: Built-up seascapes create new maritime relations","https://scispace.com/paper/the-new-blue-built-up-seascapes-create-new-maritime-2k8t5a5c9zdm","2025","Journal Article","Open access government","Jessica Hjerpe Olausson
Daniel Richardsson
Richard Hawkins
Torsten Linders","10.56367/oag-045-11057","","The new blue: Built-up seascapes create new maritime relations Four representatives of the research programme, Mistra Co-Creating Better Blue, discuss maritime innovation in the context of a dawning new era for human presence and activities at sea. We humans are builders. The most densely populated and most intensively exploited areas are built-up landscapes, where wood, stone, concrete and steel constructions dominate. But the situation has been fundamentally different at sea for centuries and millennia. Here, human activities and presence have been almost exclusively associated with boats and ships, which, over time, have grown in size and capacity in line with our technological development. ","Researchers from Mistra Co-Creating Better Blue discuss maritime innovation in the context of a new era of human presence at sea, highlighting the shift from traditional boat-based activities to built-up seascapes and their impact on maritime relations."
"Reorientasi Pembangunan Pesisir melalui Keadilan Biru: Studi Kasus Komunitas Nelayan di Kenjeran, Surabaya","https://scispace.com/paper/reorientasi-pembangunan-pesisir-melalui-keadilan-biru-studi-xhx70ugu4v9a","2025","Journal Article","JSPH (Jurnal Sosiologi Pendidikan Humanis)","Wardatul Adawiah
Khalid Syaifullah
Nur'aini Inayah","10.17977/um021v10i12025p113-132","","The blue economy approach is increasingly being defined and developed as a sustainable development strategy for coastal areas, helping structural adaptation that integrates ecological sustainability. However, without considering the dimension of social justice, the implementation of the blue economy has the potential to perpetuate long-standing inequalities in coastal areas. The blue justice approach emerges as a normative correction emphasising the importance of fair distribution of benefits, recognition of coastal communities' rights and local knowledge, and meaningful participation in decision-making. This study was conducted among the Fishing Community in the Kenjeran Coastal Area, Surabaya, using a qualitative approach with in-depth interviews and observations. This study found that the fishing community in Kenjeran is now facing serious challenges in terms of socio-ecological justice. Inequality in access to marine space, marginalisation of local knowledge, and low community involvement in the planning process reinforce the vulnerability of coastal communities to climate change and large-scale coastal development. The implementation of a blue economy focused exclusively on growth risks exacerbating the structural injustices that have long burdened vulnerable groups such as small-scale fishermen and coastal women. Therefore, integrating a blue justice approach is urgent to ensure that coastal development is not only ecologically sustainable but also socially just, institutionally participatory, and culturally contextual.","This study in Kenjeran, Surabaya, highlights the need for a blue justice approach to address socio-ecological injustices faced by coastal communities, emphasizing fair distribution of benefits, recognition of local knowledge, and meaningful participation in decision-making."
"Coastal Communities, Leisure and Wellbeing: Advancing a Trans-Disciplinary Agenda for Understanding Ocean-Human Relationships in Aotearoa New Zealand.","https://scispace.com/paper/coastal-communities-leisure-and-wellbeing-advancing-a-trans-4udggpab1b","2021","Journal Article","International Journal of Environmental Research and Public Health","Belinda Wheaton
Jordan Waiti
Rebecca Olive
Robin Kearns","10.3390/IJERPH18020450","https://www.mdpi.com/1660-4601/18/2/450/pdf","Commentators are advocating for research to better understand relationships between healthy coastal ecosystems and human wellbeing. Doing so requires inter- and transdisciplinary approaches across humanities, arts, social sciences, and science and technology disciplines. These approaches include culturally diverse knowledge systems, such as indigenous ones, that locate sustainable use of and relationships to marine ecosystems. This paper contributes to this agenda through a case-study of relationships between coastal ecosystems and human wellbeing in Aotearoa New Zealand. This article highlights interconnected cultural and wellbeing benefits of, and socio-ecological relationships between, these coastal ecosystems drawing on a case study of one ocean-based, ‘immersive’ leisure activity, surfing. Further, it examines how these relationships impact human physical, emotional and spiritual wellbeing, and the wellbeing of communities and ecosystems. The research illustrates that surfing creates strong bonds between practitioners and coastal places, linking the health of marine environments and people. We demonstrate the value of a transdisciplinary place-based approach that integrates research across the humanities and social sciences and engages with Indigenous knowledge (Mātauranga Māori). This argument for multicultural co-learning shows the value of Western and Māori vantage points for how we understand coastal blue spaces. Indigenous perspectives, we conclude, deepen appreciation, as well as equity considerations, of how we understand place, wellbeing, and long-term sustainable relationships with marine ecosystems.","In this article, a case study of relationships between coastal ecosystems and human wellbeing in Aotearoa New Zealand is presented, highlighting interconnected cultural and wellbeing benefits of, and socio-ecological relationships between, these coastal ecosystems drawing on a case-study of one ocean-based, ""immersive"" leisure activity, surfing."
"Supporting places left to the sea: A place-based research agenda for regional coastal transformations in the blue economy","https://scispace.com/paper/supporting-places-left-to-the-sea-a-place-based-research-307kdr31of","2023","Journal Article","Progress in environmental geography","Jack L. Harris
Benjamin S Thompson","10.1177/27539687231212672","","The blue economy purportedly involves equitable and sustainable development across a range of ocean sectors spanning fisheries, aquaculture, tourism, shipping, seabed mining, oil and gas extraction, and renewable energy. Here, we argue that blue economy scholarship and policy gives insufficient attention to coastal regions – and the cities, towns, and villages within – that depend on these sectors. Rather than prioritising the profitability of corporations and expansion of industry, we advise actors to consider three transformative processes that are (re)shaping coastal regions. First, are techno-industrial processes for which we draw on the fourth industrial revolution literature, highlighting that coastal regions must adapt to rapidly changing technological innovations or risk facing decline. Second, are socio-cultural processes for which we draw on the left-behind places literature, which exemplifies spatial inequalities from declining and deindustrialised coastal regions. Third, are physical-environmental processes, highlighting geographically variable opportunities and challenges around natural resources, marine biodiversity, and climate change in coastal regions. We then promote place-based policymaking as a multi-level and participatory mode of managing these transformations. Finally, we present a blue economy research agenda to help navigate these transformative processes, and enable place-based solutions. The article intersects with broader literatures around ocean governance and sustainable transformations.","The blue economy neglects coastal regions and their communities. To address this, the article proposes a place-based research agenda focusing on techno-industrial, socio-cultural, and physical-environmental processes. It advocates for place-based policymaking and a research agenda to navigate transformative processes and enable place-based solutions."
"Planet Ocean, a World of Cities: A Journey Around the Shores of the Anthropocene","https://scispace.com/paper/planet-ocean-a-world-of-cities-a-journey-around-the-shores-16pfq3fx48","2019","Book Chapter","","Voula P. Mega","10.1007/978-3-319-93680-2_1","","Oceans and cities are the most extraordinary public goods on this ageing, increasingly complex, uncertain and interlinked urbanising blue planet in the Anthropocene era. This chapter examines the megatrends which can impact the future of cities and seas as vibrant and vital dynamic places of changes and exchanges, in the aftermath of HABITAT III, the entry into force of the Paris Agreement, and the “Our Oceans, Our Future” high-level United Nations (UN) Conference. HABITAT III (Quito, October 2016), which convened for only the third time in 40 years, gave cities a dignified central place in the 2030 Sustainable Development Agenda, whereas the UN high-level conference “Our Oceans, Our Future” (New York, 5–9 June 2017) concluded with a Call for Action for the implementation of the SDG14, and the UN declared that 2021–2030 will be the decade of ocean science for sustainable development. The interconnected human ecosystems have had, and can continue to have, a major role in creating and distributing wealth and well-being in alliance with an inclusive regenerated blue planet. Strong sustainability asks not only for the total capital, composed of natural and physical, human, social, cultural and political, financial, built and digital capital, to be preserved, but for each of its components to be strengthened and transmitted to future generations. If any of the treasurable forms of capital is unsustainably managed, benefits are eroded and progress towards achieving the sustainable development goals (SDGs) is undermined.","In this article, the authors examine the megatrends which can impact the future of cities and seas as vibrant and vital dynamic places of changes and exchanges, in the aftermath of HABITAT III, the entry into force of the Paris Agreement, and the “Our Oceans, Our Future” high-level United Nations (UN) Conference."
"Maritimacies and Nature-Culture Collectives as Inputs for a Sustainable Blue Economy on the East Coast of Uruguay","https://scispace.com/paper/maritimacies-and-nature-culture-collectives-as-inputs-for-a-7a0vpnnyhvtv","2024","Journal Article","Latin American Perspectives","Leticia D’Ambrosio Camarero","10.1177/0094582x241284570","","The research for this article examines the characteristics of the marine-coastal environment from the perspectives of a range of social actors. Knowledge of maritimacies can serve as an input for management of marine-coastal environments that takes into account the diverse types of humanity found there, by emphasizing that these processes are not just physical and ecological, but also social, economic, cultural, and historical. An ethnographic methodology allows for mapping the perspectives of social actors, their points of view, and different ways of life. The result was a systemization of maritimacies, which can contribute to thinking about and building a sustainable Blue Economy that recognizes and involves those who inhabit the coast and the sea in Uruguay by considering the heterogeneity and complexity of their social networks. ","This study examines maritimacies and nature-culture collectives on Uruguay's East Coast, using ethnography to map social actors' perspectives and develop a systemized framework for a sustainable Blue Economy that acknowledges coastal inhabitants' heterogeneity and complexity."
"A Blue Urban Agenda: Adapting to Climate Change in the Coastal Cities of Caribbean and Pacific Small Island Developing States","https://scispace.com/paper/a-blue-urban-agenda-adapting-to-climate-change-in-the-1l1l1ew9gg","2017","Report","","Michelle Mycoo
Michael G. Donovan","10.18235/0000690","","Over the past two decades, national and local governments in Caribbean and Pacific Small Island Development States have partnered with the donor community to implement over $55 billion in development programs, many of which focused on climate change adaptation The coastal cities of the Caribbean and Pacific SIDS are among the world's most vulnerable cities to rising sea levels and coastal erosion Currently 20% of the population of these countries, or 42 million people, live in low elevation coastal zones that are prone to flooding Despite the financial burden of adapting to rising sea levels and natural hazards, SIDS are leveraging opportunities to minimize these effects through an emerging Blue Urban Agenda 
This research evaluates the lessons learnt from urban coastal adaptation programs in SIDS and provides several policy recommendations to comprehensively address city resiliency to climate change An institutional mapping of donors active in coastal adaptation in SIDS and a review of more than 50 donor-funded projects highlights the most effective coastal adaptation programs Comparisons are provided between the Caribbean and Pacific SIDS on climate change, urban development, housing, and access to climate funds This book provides a way forward to embark on a Blue Urban Agenda that is sensitive to the unique characteristics of SIDS and their commitments in the Small Island Developing States Accelerated Modalities of Action (Samoa Pathway) resolution, COP21, the Sustainable Development Goals, and Habitat III","In this paper, the authors evaluate the lessons learnt from urban coastal adaptation programs in SIDS and provide several policy recommendations to comprehensively address city resiliency to climate change and provide a way forward to embark on a Blue Urban Agenda that is sensitive to the unique characteristics of SIDS."
"Securing Maritime Identities: The New Practices of Maritime Cultural Heritage","https://scispace.com/paper/securing-maritime-identities-the-new-practices-of-maritime-r5m77jr1","2022","Book Chapter","","Roman Grinblat","10.4324/9781003001324-26","","Over the past 50 years, many of the planet's coastal areas have come under strong pressure, mainly due to urban growth resulting from tourism. This has led to an added problem in the conservation of maritime heritage, which is already complicated by the low resistance of materials to the marine environment and the decline of traditional activities such as small-scale fishing and coastal shipping. However, in recent years many coastal communities have responded to this situation by reconstructing securing maritime identities through innovative cultural heritage practices. This chapter highlights the close connection that is found between the tangible and the intangible in maritime heritage. It also focuses on the importance of considering the context in which maritime heritage was created in the past and is created today. ","In this article , the authors highlight the close connection that is found between the tangible and the intangible in maritime heritage and focus on the importance of considering the context in which maritime heritage was created in the past and is created today."
"Cultural Mapping and the Sustainability of Coastalscapes: A Conceptual Approach","https://scispace.com/paper/cultural-mapping-and-the-sustainability-of-coastalscapes-a-jeycwodx9oyc","2025","Journal Article","European Journal of Geography","Daniel Oliveira
Zara Teixeira
Mônica Mesquita","10.48088/ejg.d.oli.16.2.156.168","","Coastal regions, plentiful in ecological and economic value, have long been hubs for human settlement, recreation, and tourism. However, the growing threats of global climate change and urbanisation are endangering the sustainability of these vital coastalscapes. With nearly two-thirds of the global population living in coastal areas, there is an urgent need for innovative management strategies. This paper explores the critical role of local spatial knowledge, incorporating diverse cultural aspects such as memories, experiences, and oral traditions, to address the challenges confronting these regions. Cultural Mapping (CM) is introduced as a dynamic methodology – transcultural and transdisciplinary – facilitating creative representations of coastalscapes and serving as a vital tool for understanding the complex, reciprocal relationships between people, more-than-human entities, and places. CM reveals the deep-rooted connections that shape coastal communities’ identities and sustainability practices by documenting intangible cultural resources and capturing the emotional and sensory dimensions of coastal environments. Drawing on the pioneering work of Pam Hall (2013) and incorporating insights from an in-depth scholarly literature review, this paper underscores the potential of CM to transform both research practices and policymaking. It offers a new lens for sustainability in coastal regions, paving the way for future studies and innovative, community-driven management strategies that engage a diversity of knowledge systems in addressing pressing environmental challenges. ","This paper introduces Cultural Mapping as a transdisciplinary methodology to address sustainability challenges in coastal regions, leveraging local spatial knowledge, memories, and oral traditions to understand complex relationships between people, environments, and places, and inform innovative management strategies."
"Identità marittima e rigenerazione urbana per lo sviluppo sostenibile delle città di mare","https://scispace.com/paper/identita-marittima-e-rigenerazione-urbana-per-lo-sviluppo-4wnl2in8h5","2013","","","Massimo Clemente","10.6092/2284-4732/2459","https://scispace.com/pdf/identita-marittima-e-rigenerazione-urbana-per-lo-sviluppo-4wnl2in8h5.pdf","Le citta di mare sono state oggetto di studi e approfondimenti durante gli ultimi cinquanta anni, anche se molto spesso con riferimento limitato al recupero delle aree portuali dismesse e alla riqualificazione dei waterfront urbani. Il gruppo di ricerca Citta e Architettura del Consiglio Nazionale delle Ricerche, dal2009, ha sviluppato un percorso di ricerca fondato su un diverso approccio al tema: guardare le citta “dal mare” per rinnovare culturalmente e metodologicamente la pianificazione e la progettazione urbana nelle aree urbane costiere. La visione marittima ha permesso una rivisitazione dei processi di recupero del waterfront. L’obiettivo e definire metodologie e strategie innovative per valorizzare l’identita marittima come strumento chiave per la rigenerazione urbana sostenibile della citta di mare.","In this paper, Citta di mare è considered as strumento chiave per rinnovare culturalmente e metodologicamente la pianificazione e la progettazione urbana nelle aree urbane costiere."
