"Paper Title","Paper Link","Publication Year","Publication Type","Publication Title","Author Names","DOI","PDF Link","Abstract","Relevant Excerpt"
"Aportaciones y lagunas de la política marítima integrada para atajar la vulnerabilidad de los mares y océanos frente al avance del crecimiento azul.","https://scispace.com/paper/aportaciones-y-lagunas-de-la-politica-maritima-integrada-10kzn0bd59","2021","Journal Article","","Ana María Aldaz Casanova","10.6018/BIODERECHO.468111","https://scispace.com/pdf/aportaciones-y-lagunas-de-la-politica-maritima-integrada-10kzn0bd59.pdf","This paper addresses the integrated maritime policy designed by the European Union to compare it against the criteria of sustainability that the Union has self-imposed. The aim is to test its effectiveness and usefulness in achieving the imperative environmental quality objectives of the seas and oceans.","biodiversidad marina, la degradación de hábitats, el incremento de la acidificación de los mares y océanos, la acumulación de basura y plásticos y el aumento de la temperatura del mar . II. INICIATIVAS DE CRECIMIENTO AZUL Y POLÍTICA MARÍTIMA INTEGRADA EN LA UE:
 Ante estas evidencias, en cumplimiento de las prerrogativas autoimpuestas en pos de la sostenibilidad y de los compromisos internacionales adoptados para su cumplimiento  , la https://www.wwf.es/informate/biblioteca_wwf/?55320/Informe-Planeta-Vivo-2020. También en ""Blue Growth. Scenarios and drivers for Sustainable Growth from the Oceans, Seas and Coasts. Final Report"". Disponible en ECORYS 2012. https://ec.europa.eu/maritimeaffairs/publications/blue-growth-scenarios-and-drivers-sustainablegrowth-oceans-seas-and-coasts_en 13 ""The potential of the blue economy"", World Bank Group, 2017. Para el Banco Mundial el concepto ""economía azul"" incorpora tanto la promoción de un crecimiento económico como la inclusión social y la preservación y mejora Unión Europea aprobó, en el marco del VI programa de Acción Comunitaria en materia de Medio Ambiente y estrategia temática para el medio marino 19 , la Directiva Marco sobre Estrategia Marina (DMEM) 20 , que recogía como fin primordial la consecución de ""un buen estado medioambiental del medio marino"" a más tardar en el año 2020 y para cuyo cumplimiento se puso en marcha la Política Marítima Integrada 21 , orientada hacia la economía azul desde la consideración de la interdependencia de todos los sectores de la economía marina 22 y con miras a su máximo aprovechamiento, con la limitación de la sostenibilidad que imperaba como criterio condicionante. II. INICIATIVAS DE CRECIMIENTO AZUL Y POLÍTICA MARÍTIMA INTEGRADA EN LA UE:
 Así, en el entorno de la Unión y con la vista siempre puesta en la meta del progreso económico tangible, se han sugerido inicialmente ""cinco cadenas de valor"" potenciales para el crecimiento y el empleo en la economía azul: la energía azul en todos sus ámbitos 23 , la acuicultura, el turismo marítimo, costero y de cruceros, los recursos minerales marinos y la biotecnología azul 24 y para abordar este potencial y optimizar resultados económicos sin que se vea perjudicado el objetivo de calidad de los y el condicionante de la sostenibilidad, la Unión ha diseñado una estrategia que aborda diversas políticas transversales en las que la búsqueda y el intercambio de información constituyen eje pivotante y pieza clave."
"Blind spots in visions of a “blue economy” could undermine the ocean's contribution to eliminating hunger and malnutrition","https://scispace.com/paper/blind-spots-in-visions-of-a-blue-economy-could-undermine-the-279j3htlq6","2021","Journal Article","","Anna K Farmery
Edward H. Allison
Neil L. Andrew
Max Troell
Max Troell
Michelle Voyer
Brooke M Campbell
Hampus Eriksson
Hampus Eriksson
Michael Fabinyi
Andrew M. Song
Dirk J. Steenbergen","10.1016/J.ONEEAR.2020.12.002","https://scispace.com/pdf/blind-spots-in-visions-of-a-blue-economy-could-undermine-the-279j3htlq6.pdf","Summary Increasing the production of food from the ocean is seen as a pathway toward more sustainable and healthier human diets. Yet this potential is being overshadowed by competing uses of ocean resources in an accelerating “blue economy.” The current emphasis on production growth, rather than equitable distribution of benefits, has created three unexamined or flawed assumptions that growth in the blue economy will lead to growth in “blue food” production, increased production will inevitably lead to improved food and nutrition security, and mariculture production will replace marine capture fisheries. In this perspective, we argue that if research and policies are pursued without addressing these “blind spots,” blue food contributions to reducing hunger and malnutrition, and to meeting the Sustainable Development Goals, will be limited. Taking a broader food-system approach beyond production to also considering food access, affordability, and consumption will refocus the blue food agenda on making production and consumption more equitable and sustainable while increasing access for those who need it most.","dominant global seafood narrative. These directions include developing greater understanding of the potential impacts of competing blue economy sectors on food availability and access, applying a food-system approach to blue food planning and action, and supporting fisheries for food, culture, and livelihoods. BLIND SPOTS IN VISIONS OF A BLUE ECONOMY:
 Blue economy growth will support blue food activities Producing food from the ocean is cited as an objective in many national and global plans and visions of a blue economy;  however, food-related activities are rarely prioritized in blue economy narratives or related marine spatial planning exercises. For example, food production from mariculture and fisheries and other food-system considerations, such as distribution, access, affordability, and consumption, were articulated in relatively few of the voluntary commitments relating to the blue economy that were made at recent high-profile international ocean futures platforms (Figure ). In addition, capture fisheries were completely omitted from the European Commission's strategy for achieving growth in the blue economy in favor of the energy production, aquaculture, shipping, marine biotechnology, mining, and tourism sectors.  Over 30% of commitments made as part of the UN Oceans conference listed SDG 2 as a relevant goal, yet only 10% included specific reference to improving food security outcomes, and 10% considered aspects of food distribution along value chains. Food distribution considerations were evident in less than 2% of Sustainable Blue Economy conference commitments and less than 5% of Our Oceans commitments. Nutrition was mentioned in less than 2% of voluntary commitments made as part of the UN Oceans and Our Oceans conferences and not at all as part of the Sustainable Blue Economy commitments. Only one blue economy commitment across all conferences mentioned affordability of blue food. Of 179 commitments to improve mariculture across all conferences, 14% also mentioned contributing to food security, 6% mentioned value chain considerations, and 4% mentioned nutrition. BLIND SPOTS IN VISIONS OF A BLUE ECONOMY:
 The prioritization of competing blue economy sectors over blue food has resulted in a lack of comprehensive consideration of the ways in which these sectors interact with the availability of, and access to, seafood in blue economy planning. As the blue economy grows, food production must compete with expanding ports, tourism, mining, energy, and conservation sectors for ocean space  (Figure ). Development of some of these sectors is important for meeting the UN SDGs, including ensuring access to renewable energy (SDG 7) and sustainable use of the ocean (SDG 14); however, development is also likely to result in impacts on ocean ecosystems, such as physical damage to habitats, waste discharge, oil spills, and noise pollution; see, for example, Chin and Hari 30 and Simpson et al.  Further degradation of wild-capture fisheries as a result of these, and related climate change impacts, will potentially reduce the yield of capture fisheries, the result of which will directly contribute to micronutrient deficiencies for 845 million people.  The effects of intersectoral encroachments on fishing and farming areas in the coastal space have compromised access rights for many small-scale fishers.  Whereas these effects have largely been overlooked,  they are imperative in understanding the loss of social and economic benefits for this largest group of ocean users. As the blue economy grows, coastal environments may industrialize in a maritime equivalent of the terrestrial conversion of farms to urban and industrial"
"Closing the blue loops","https://scispace.com/paper/closing-the-blue-loops-26bxxdft2jw6","2024","Journal Article","","Siri Granum Carson
Sveinung Sægrov
Richard Sempéré
Pentti Kujala","10.2861/61100qa","https://scispace.compdf/closing-the-blue-loops-26bxxdft2jw6.pdf","","both from valued goods and services and from reduced water-related risks. Executive summary: However, as the sector requires longterm commitment and many of the benefits are not easily monetised, the viable business models and defined revenue streams associated to investments remain limited . Executive summary:
 Europe is in a comparatively favourable position, since most European countries would only need to invest 0.5% of their national GDP in order to deliver sustainable water management, while in other countries this can exceed 4% of GDP . Executive summary:
 This notwithstanding, European investments in water management is not increasing to the extent that could be expected, indicating a lack of visibility for the innovations and their business potential , despite increasing public attention to the key role of the sector. Executive summary:
 Recognising the need to focus explicitly on the mounting sustainability challenges connected with waters, such as increasing water scarcity and flood risks, the European Economic and Social Committee in 2023 launched the EU Blue Deal to raise awareness of the importance of addressing water as a priority at European Scale . Executive summary:
 The size of the global ocean economy was in 2010 estimated at USD 1.5 trillion, or 2.5% of global gross value . Executive summary:
 Pre-covid, the OECD projected a significant acceleration in economic activity in the ocean, with a conservative estimate of a doubling in size of the gross value of oceanbased industries by 2030, to around 3 trillion USD . Executive summary:
 Employment in ocean industries as a whole was estimated to more than double by 2030, reaching a number of over 40 million, and significantly outpacing the overall growth rate of the global workforce. Executive summary:
 While the pandemic slowed the pace of the projected blue growth, especially in areas like coastal tourism and maritime transport, the pace is currently picking up. Executive summary:
 In Europe, the blue economy, including both traditional sectors (transport, ports, naval industry, fishing, aquaculture and tourism) and the emerging domains, (marine energy, renewable energies, blue technology, desalination, robotics, cable) directly provides at least 4.5 million jobs, in addition to the numerous indirect and sub-contracted forms of employments, and generates a turnover of 600 billion euros in Europe  The Blueinvest report from 2024 shows that the volume of disclosed investments in the European blue economy is three times larger than it was ten years ago, indicating a strong growth pattern for the sector. Executive summary:
 However, the same report reveals a limited average level of maturity of the blue economy sector overall, indicating a need for targeted efforts to unlock the potential of the European blue economy . Executive summary:
 The ocean and its resources are indispensable to addressing global challenges by delivering food, jobs, energy, raw material and the prospects of economic growth. Meanwhile, the ocean is under severe stress from overexploitation, pollution, declining biodiversity and climate change. Executive summary:
 Any acceleration of economic activity in the ocean will therefore have to take place in support of the global sustainability goals and with a holistic ocean management as a basis . Executive summary:
 A study from 2021 maps the main barriers preventing adequate financing of a sustainable ocean economy at a global level, including a weak enabling environment for attracting sustainable ocean finance, insufficient public and private investment in the ocean economy, and the relatively high-risk profile of ocean economic sectors ."
"Tourism centres efficiency as spatial unites for applying blue economy approach: A case study of the Southern Red Sea region, Egypt","https://scispace.com/paper/tourism-centres-efficiency-as-spatial-unites-for-applying-2dy8c77k","2022","Journal Article","PLOS ONE","Moaaz Kabil
Ebtehal Ahmed AbdAlmoity
K. Csoban
L. David","10.1371/journal.pone.0268047","https://scispace.com/pdf/tourism-centres-efficiency-as-spatial-unites-for-applying-2dy8c77k.pdf","This study aims to assess and analyse the efficiency of the tourism centres in the Southern Red Sea region, Egypt to apply coastal tourism development through the blue economy perspective. According to this aim, the study used two efficiency methods: Data Envelopment Analysis (DEA) and Free Disposal Hull (FDH). A total of 29 tourism centres were selected to conduct the DEA and FDH methods. These efficiency methods (DEA-FDH) used inputs and outputs variables to estimate the efficiency of the tourism centres. The selected inputs were the length of the shoreline (km), area (ha), tourism investments (million EGP), quality of coral reefs, numbers of hotels, and tourism accommodation capacity. While the outputs were employees’ number and tourists’ number. The results indicate that, generally, the tourism centres in the Southern Red Sea region of Egypt showed high-efficiency scores, which reflects their good preparedness to implement the various coastal tourism development strategies from the blue economy perspective. The tourism centres in the Safaga-Quseir tourism sector were the most efficient ones, regardless of the efficiency models used. While the tourist centres representing the Ras Banas tourism sector were the least efficient centres in the whole sample (29 tourism centres).","ocean energy, bioeconomy, offshore wind energy, and coastal & environmental protection, and (c) Enabler Sectors: such as shared infrastructure, sustainable use of the sea, maritime spatial planning, maritime security marine data, and common skills . Introduction:
 Among the various previous mentioned blue economy sectors, this study focused on the coastal tourism sector. Generally, the coastal tourism sector is one of the oldest, utmost importance, and fast-growing segments of the tourism industry . Indeed, coastal tourism participated with a large proportion of the GDP of many countries, and it is expected that it alone will represent up to 26% of all ocean-related economic activities in the 2030 . Additionally, compared to other blue economy sectors, the coastal tourism sector contributes about 83% of the gross value added (GVA) and it produces nearly 79% of the total blue economy job opportunities . Furthermore, coastal tourism is a fragile and seasonal sector, which makes it vulnerable and sensitive to various environmental, social, and economic shocks . For example, during the COVID-19 pandemic, the tourism industry was suffered from catastrophic economic losses as a consequence of the shutdown. According to the OCED, international tourism dropped by 80% in 2020 because of this crisis . Introduction:
 Here the blue economy plays an important role in enhancing and supporting the coastal tourism sector by focusing on achieving sustainability principles and increasing its resilience in facing various challenges such as climate change. The perspective of the coastal tourism sector in light of the blue economy approach was introduced through a set of key messages/ principles such as financing sustainable coastal tourism strategies and actors, enhancing stakeholder participation in the coastal tourism development process, creating and growing new coastal tourism markets, protecting coastal areas and ecosystems from coastal tourism activities infrastructure, activating sustainability governance, harnessing the potential of urban communities and settlements to benefit from coastal tourism, enhancing the efficiency of coastal tourism resources, increase reliance on sustainable decision making in the coastal tourism sector, promoting the private sector role in coastal tourism, and decrease natural resources damage and the aesthetic value of these resources . Introduction:
 Despite the great paid international and regional attention to the blue economy as an approach seeking to achieve sustainable development using ocean resources, most of the academic production in this scientific area was merely initiatives and policies at the international or national levels, with limited strategies and implementation plans which effected on the true viability of applying the blue economy approach. Especially in the coastal tourism sector, which is the largest sector of the blue economy in size, but also the most affected sectors by the COVID economic crisis, and its recovery path is described as a ""very lagged"" . Introduction:
 Therefore, we need to overcome these barriers to witness the fruits of implementing the blue economy concept. Especially with the fact that coastal tourism appears as the considered the least blue economy sectors have been covered in articles and scientific researches, despite the vivid coastal tourism importance sharing of the gross value added (GVA) and providing job opportunities ."
"Blue Economy, Blue Growth, Social Equity and Small-scale Fisheries: A Global and National Level Review","https://scispace.com/paper/blue-economy-blue-growth-social-equity-and-small-scale-f1omx1he","2023","Journal Article","Studies in social science research","Jewel Das","10.22158/sssr.v4n1p38","https://scispace.com/pdf/blue-economy-blue-growth-social-equity-and-small-scale-f1omx1he.pdf","One of the most promising economic arenas in the coming decades is the ocean and there are currently numerous initiatives to the ‘blue economy’ discourse that revolves around the argument that small-scale fishers’ livelihoods require greater attention. To synthesize current scientific knowledge and address prevailing research gaps surrounding this discourse, I conduct a scoping review of global literature on the blue economy, blue growth, social equity, and Small-Scale Fisheries (SSF) analyse different international policy papers and national-level blue economy plans. To explore the need for further research, this review focuses on how different aspects of the blue economy risks lead to inequity in the pursuit of ocean sustainability. Based on the initial content analysis, I identify evidence for undermining social equity and justice related to the ocean and find that social equity is often overlooked in national-level blue economy and blue growth initiatives. This overlooking leads to or accelerates processes of coastal and ocean grabbing, displacement, dispossession, and exclusion which strongly impact the livelihoods of marginalized coastal communities, particularly, small-scale fishers in various parts of the world. The collected evidence suggests that there is a missing link between international policy deliberations and national-level implementation plans in the blue economy context. Numerous studies claim that critical re-thinking of policies is required to ensure the sustainability of blue economy trajectories. Unchecked economic growth in the ocean as in other realms can reinforce inequities and unjust and inequitable resource distribution patterns. To pre-empt, mitigate, and resolve likely conflicts, deeper insights are needed to address the impacts of the blue economy and blue growth on coastal livelihoods. I suggest investigating the causes of conflict and further research on how governance responds to sustain small-scale fisheries while embracing the blue economy and blue growth agendas.","coastal and ocean economic policies, the proper translation of these objectives is not visible in the national-level BE and BG plans. A recent study on Commonwealth countries also finds a similar mismatch between international BE policy objectives and national-level conceptualization and implementation. The missing link between BE discourses and their implementation:
 I offer some thoughts on the research gap and way forward directions in this review. The scientific literature on BE substantially emphasizes economic growth in the coastal and marine space; there has been expressly less consideration of social equity framing. Future research and policies need to focus on bringing explicit social justice to research on BE risks such as displacement, grabbing, inequitable distribution, fairness, blue justice, etc. Equally, following international policies and consideration of priorities, the national-level blue economy policy framework needs to pay more attention to the coastal communities in terms of social and distributional impacts of equity and justice in the ocean. I recommend studying global drivers and proximal causes of social injustice, including policies, political, and local responses toward the resilience of the global coastal communities."
"Evaluating Performance of Portuguese Marine Spatial Planning","https://scispace.com/paper/evaluating-performance-of-portuguese-marine-spatial-planning-3nfomb006b","2017","Dissertation","","Maria Adelaide Ferreira","","https://scispace.com/pdf/evaluating-performance-of-portuguese-marine-spatial-planning-3nfomb006b.pdf","",".4.) Each coastal member state was also obligated to produce a monitoring programme for an assessment of, and estimate of distance from and progress to, GES, and programmes of measures in order to achieve or maintain GES in their marine waters. . MSP in Europe:
 1) biological diversity maintained 2) non-indigenous species at levels that do not adversely alter ecosystems 3) populations of commercially exploited (shell)fish within safe biological limits 4) all elements of marine food webs at normal abundance and diversity and at levels capable of ensuring the long-term abundance of the species and the retention of their full reproductive capacity 5) human-induced eutrophication minimised 6) Sea-floor integrity (structure and functions of the ecosystems are safeguarded and benthic ecosystems not adversely affected) 7) Permanent alteration of hydrographical conditions does not adversely affect marine ecosystem 8) Concentrations of contaminants within safe levels 9) Contaminants in fish and other seafood for human consumption within safe levels 10) marine litter non detrimental to the coastal and marine environment Meanwhile, in 2012, a Communication on Blue Growth was put forward by the EC. It was described as the maritime dimension of the Europe 2020 strategy 11 , and, more precisely, as ""an initiative to harness the untapped potential of Europe's Oceans, seas and coasts for jobs and growth"" (EC, 2012 p.2), and aimed to drive forward the IMP, helping ""to steer the EU out of its current economic crisis"" by promoting the blue economy (ibid., p3). It was envisaged as being able to ""contribute to the EU's international competitiveness, resource efficiency, job creation and new sources of growth whilst safeguarding biodiversity and protecting the marine environment, thus preserving the services that healthy and resilient marine and coastal ecosystems provide"" (ibid.). In addition to traditional sectors of the blue economy deemed crucial for value and jobs (shipbuilding and ship repair, cargo and ferry transport, fisheries, and offshore oil and gas) five new focus areas were identified: blue energy (marine renewable energies such as offshore wind, tidal, wave, and ocean thermal energy conversion); aquaculture; tourism (maritime, coastal, and cruise); marine mineral resources; and blue biotechnology (medicines, industrial enzymes). MSP in Europe:
 Lastly, in 2014, a directive establishing a framework for MSP was ""aimed at promoting the sustainable growth of maritime economies, the sustainable development of marine areas, and the sustainable use of marine resources"" (OJEU, 2014, p. L257/139). The directive formally defined ""maritime spatial planning"" as ""a process by which the relevant Member State's authorities analyse and organise human activities in marine areas to achieve ecological, economic and social objectives"" (ibid., p. L257/140). Article 5 of the directive defined the objectives of MSP to be considered by Member States: ""to consider economic, social and environmental aspects to support sustainable development and growth in the maritime sector, applying an ecosystem-based approach, and to promote the coexistence of relevant activities and uses"" aiming to contribute ""to the sustainable"
