"Paper Title","Paper Link","Publication Year","Publication Type","Publication Title","Author Names","DOI","PDF Link","Abstract","Relevant Excerpt"
"Organization of Maritime Passenger Ports","https://scispace.com/paper/organization-of-maritime-passenger-ports-3eav7m5s80","2006","","","Alen Jugović
Vlado Mezak
Slavko Lončar","","https://scispace.com/pdf/organization-of-maritime-passenger-ports-3eav7m5s80.pdf","Summary In order to study the efficiency of a port as well as of the entire port system within a maritime state, it is best to observe the port as a multi-layered entity and to examine both the external and internal factors affecting port’s activity within its immediate as well as wider environment, to examine its business operation, results and more or less strong conjunction of its business operation micro and macro aspects. In the contemporary carriage of passengers by sea, distinction should be made between passenger liner service and cruising or tourist shipping service. While the distinction between these two categories has always been present, significant changes have been introduced recently in the organization of maritime passenger ports, with passenger terminals’ sophisticated design and organization representing the prerequisite for optimal operation and development of passenger liner shipping as well as cruising. In an effort to meet the increasingly demanding requirements of owners and passengers, ports are required to be constantly upgrading the level of services offered and to pursue even more adaptable and more flexible organizational structure. Ports have been facing constant changes which are reflected in upgrading of port facilities, new organization of work and management, promotional activities, implementation of information systems, introduction of new services etc.","Title: Organization of Maritime Passenger Ports Authors: Alen Jugović,Vlado Mezak,Gordana Nikolić Keywords: maritime passenger port, organization, management, cruises, ferry, home port, port of call"
"Complex Gateways. Labour and Urban History of Maritime Port Cities: The Northern Adriatic in a Comparative Perspective","https://scispace.com/paper/complex-gateways-labour-and-urban-history-of-maritime-port-2bgi0lu8","2023","Journal Article","","","10.26493/978-961-293-191-9","https://scispace.com/pdf/complex-gateways-labour-and-urban-history-of-maritime-port-2bgi0lu8.pdf","","found at the very beginning of the modern debate on free ports (Giulia Delogu), suggesting that precisely the overlay of responsibilities can be one of the most important (and understudied) components of the complexity inherent in these kind of studies. University of Milano Bicocca, Department of Economics, Management and Statistics:
 As already said, almost all the chapters deal with the analysis of the relationship between the port and its surrounding environment in the broader sense, even from the cultural point of view (Janine Schemmer). Every time, and independently, all authors have highlighted the multilevel interdependencies linking (but also bounding) ports and their socioeconomic environment, well beyond the usual roles assigned to ports as providers of working positions, services, utilities, and so on. New issues have been pointed out: how can seaports play a role in the construction of consensus towards the established order, of symbolic values to the advantage of the entire port-city nexus, of new instruments for controlling social marginality, at the local level, or even of means of pressure and direction of foreign policy. University of Milano Bicocca, Department of Economics, Management and Statistics:
 The evidence we have studied suggests that the human factor is largely undervalued and that some adjustments are in order. The cases presented in this book have the aim of bringing out a research perspective closer than usual to the real life of operating city-port systems. From this perspective, we think we can say that port performances rely on more than one equilibrium (technosocial, institutional, financial, environmental, human, and others) in such a complex way that an equally elaborate set of analytical tools must be arranged and made operational, in order that this research topic may be appropriately studied. Introduction:
 Each port is confronted with different operational problems, posed by its harbour, traffic features, economic policies established by the government with jurisdiction over the port, or by other structural factors that are likely to change with time. During the early modern age, following the commercial revolution that had taken place two centuries earlier and the subsequent changes in maritime transport, as well as in the circulation of goods and capital, wide swaths of Western Europe underwent sweeping economic and social changes. The population was growing, albeit slowly, and becoming increasingly concentrated in urban areas. At the same time, the volume and variety of traded products were growing, while the network of maritime traffic was expanding to include the New World. Some scholars have described this new scenario as the first globalization age . In this context, the Mediterranean, while lying far from the new transoceanic routes, actually managed not to become a peripheral sea. Rather, it became a dynamic region, where each port was an integral part of a more extensive merchant network, with Atlantic ports playing the leading role. Mediterranean port cities, with their vitality and dense network of economic relations, became network hubs with significant traffic flows reaching out from the sea into the mainland."
"Port marketing as manifestation of sustainable marketing in a B2B context","https://scispace.com/paper/port-marketing-as-manifestation-of-sustainable-marketing-in-3wgdsje3df","2019","Journal Article","Journal of Business & Industrial Marketing","Alexandre Lavissière
Tibor Mandják
Julian Hofmann
Laurent Fedi","10.1108/JBIM-12-2018-0409","https://scispace.com/pdf/port-marketing-as-manifestation-of-sustainable-marketing-in-3wgdsje3df.pdf","Previous literature dealing with sustainable marketing in a B2B context is mostly limited to spot measures on an environmental, economic or social layer. Thus, the purpose of this paper is to exemplify how seaports as powerful economic business networks can facilitate multi-layered sustainability.,The authors integrate multiple case studies to pursue an inductive research approach to derive general patterns based on empirical observations.,Operationalizing the concept of a port community enables the authors to show how seaports not only facilitate multi-layered sustainability but also mutually interact. Hence, port sustainability can be achieved through and by a port community.,The conceptualization of the interplay between port community and multi-layered sustainability contributes to the business and industrial marketing literature in general and to the yet hitherto scarce port marketing literature in particular. Future research should go beyond this initial conceptualization by gathering further empirical research.,The study outlines how strengthening interactions among port management stakeholders (i.e. business and non-business actors such as port authorities and policymakers) might lead to higher economic success and societal welfare by pooling yet hitherto independent resources.,To the best of the authors’ knowledge, this is the first study to define how the concept of a holistic port community can facilitate sustainability acted out on its three pillars and how both concepts interact.","tactics in which actors are trying to push for their own economic interests. We notice however, there are also actors who represent other actors, such as the UMEP, and these actors are trying to push for the interest of a group of actors. Analysis:
 In the second phase, the actors start to work together and consolidate their relationships around the need for an efficient regulation implementation. The implementation is too complex to be a simple optimization of the linear supply chain. It requires physical and informational management of flows. Analysis:
 Around the information flow, the actors will start to build a network strategy, for the good of the system rather than only the individual actors. The PCS in that case is a representation of this network that is sharing knowledge to build an information system that binds them together. Analysis:
 Actors are, in this process, consolidating a port community that is interestingly represented by the PCS. This network, or port community, is not only the PA, or the internal actors of the port, but a wider community of actors that are not necessarily based in the port (headquarters, subsidiaries or agents), directly related to the container handling (logisticians) or physical flows-driven. The port community is therefore a much wider concept than the port supply chain. Discussion:
 Following the logic of inductive research , the final step is to identify general patterns based on the detailed description of the cases. These patterns help us to answer our two research questions initially raised and consequently to highlight the positive structural role of the port community The relationship between port community and sustainability:
 Based on ports being extensive business networks, we conceptualize a port community as follows: a port community is an extensive business network interpreted at a geographically specified point encompassing a multitude of economic and non-economic actors, evolved relationships between them and physical and organizational resources involved. The basic social performance or output of a port community as an extensive network is to ensure the interconnection of maritime and land activities. In addition, in an extensive network, the behavior of the actors cannot be separated from the network. However, the actors still have some degrees of freedom in their managerial decisions. Hence, it is important to point out that this (social) goal only means that it is the performance of the port network as a whole, but which does not mean that the individual members of the port community do not primarily follow their own goals. The port community is not merely an externality including different components such as civil society, territory and environment where conflicts occur . The port community is a network structure and it merely expresses that the members of the port community coexist and depend on each other in different depth. Of course, this does not exclude the possibility of conscious and organized cooperation, as we have seen in the case of the San Pedro Bay ports. The relationship between port community and sustainability:
 We have discussed different examples of the evolution of ports towards a more sustainable development which is in fact beyond isolated actions of individual[1] actors such as PAs in the case of San Pedro Bay ports, PAs and unions (UMEP) in the case of Le Havre or as the mining company in the case of Ehoala Port. Actors of the port network have strong dyadic as well as triadic relationships leading towards an extensive network. Moreover, we identified a temporal pattern. The involvement of different actors in the port environment is increasing from a single actor to the whole network of involved actors."
"Les petits ports dans le systéme portuaire européen a L’Âge Moderne: (XVIe.-XVIIIe. Siécles)","https://scispace.com/paper/les-petits-ports-dans-le-systeme-portuaire-europeen-a-l-age-33zemq61du","2008","Journal Article","História - Revista da Faculdade de Letras da Universidade do Porto","Amélia Polónia","","https://scispace.com/pdf/les-petits-ports-dans-le-systeme-portuaire-europeen-a-l-age-33zemq61du.pdf","Cet article suivra deux angles d’analyse: un plutot theorique, a travers lequel nous essayerons de reflechir sur les classifications des ports et la definition de hierarchies portuaires; l’autre plutot pratique, a travers lequel nous nous proposons developper un etude de cas: celui de Vila do Conde, un petit port du NW du Portugal. A partir de cette etude on essayera de discuter la question de l’importance ou insignifiance des petits ports dans les dynamiques Europeennes a l’epoque moderne. On presente dans cette discussion quelques concepts operatives, tels que celui de systeme portuaire, hierarchie portuaire et complementarites interportuaires.","l'application du concept de système portuaire dans un niveau régional, national ou international. Les paroles de Gordon Jackson synthétisent des approches pertinent sur cette matière: ""I am still not clear how we should deal with the subject of Port Systems, and particularly international systems. What is a 'Port System'? Indeed, what is a 'System'? The Standard Oxford English Dictionary offers three definitions: (a) 'An organized or connected group of objects' which British ports were certainly not. Apart from a very brief period after WWII nobody has ever tried to organize British ports. (b)''A whole composed of parts in orderly arrangement according to a plan', which again is laughable in the British context; and (c) 'A set of things connected, or interdependent, so as to form a complex unity', a definition which might just reflect reality. […] My own studies of port development over time would certainly support only the last definition"". JACKSON, 2007: 22-23. Concepts et modèles théoriques:
 Quand on prend la bibliographie spécifique sur les ports, plutôt l'anglo saxonne, on se dépare avec quelques concepts centrales, qu'il faut examiner et discuter pour mieux situer notre position sur la question en débat. Je me réfère a des concepts comme celui de système portuaire, hiérarchies portuaires et complémentarités portuaires -tous fondamentaux pour mieux comprendre les relations complexes qui se développent dans les réseaux portuaires, soit-elles nationales, européennes ou intercontinentales. D'après le concept de système portuaire, un port est considéré en toute sa complexité: humaine, social, urbaine, logistique, administrative et économique. Le concept souligne aussi le besoin d'évaluer les accomplissements et les taux de croissance des ports singuliers dans un complexe de ports, dans lequel il se positionne comme un élément essentiel du système . LES PETITS PORTS DANS LE SYSTÉME PORTUAIRE EUROPÉEN A L'ÂGE MODERNE:
 -le modèle d'administration portuaire: est il un port administré par le gouvernement central, une compagnie adjudicataire, le gouvernement provincial ou bien par des privés? (Ces catégories se présentent comme plus pertinentes dans l'époque contemporaine); -la nature du commerce: c'est plutôt un commerce d'importation, d'exportation ou bien un mouvement rédistributive de marchandises? LES PETITS PORTS DANS LE SYSTÉME PORTUAIRE EUROPÉEN A L'ÂGE MODERNE:
 -les indicateurs démographiques, dépendant de leur statu comme villes capitales, ports métropolitains, sièges régionaux ou ports marginaux du point de vue administrative; LES PETITS PORTS DANS LE SYSTÉME PORTUAIRE EUROPÉEN A L'ÂGE MODERNE:
 -la tonnage des vaisseaux qui peuvent accéder a chaque port; -la quantité de capital mobilisé"
"Labor Market Dynamics in the Maritime Industry. Sea Agglomerations","https://scispace.com/paper/labor-market-dynamics-in-the-maritime-industry-sea-2u7r8bo7ob","2019","Proceedings Article","","Simona Mina","10.18662/LUMPROC.165","https://scispace.com/pdf/labor-market-dynamics-in-the-maritime-industry-sea-2u7r8bo7ob.pdf","One of the hypotheses of the present study is that the trend in human resources in maritime organizations in the European system is declining and the number of European sailors is decreasing steadily. Despite the efforts made by some governments in the Member States of the European Union, the policies aimed at reducing the decline in the labour market of the maritime industry in Europe, the number of European sailors is continuing to decline. The present scientific opinion joins the efforts of the institutions to find the reasons why the evolution of the human resources in the European maritime organizations is descending.A second hypothesis of the study is linked to the EU's desire to implement effective policies in supporting the entire maritime conglomerate in the long run, with the review and modification of all previously implemented policies. The paper examines the possible types of subsidies granted by Member States to shipping companies and ship owners and how this financial support will lie in the degree of engagement and activation of seafarers domiciled in the EU, within the maritime labour market.","citizens, but not French, and 15% of them are not European citizens. These figures are in line with statistics on maritime organizations operating in port activities and on board passenger ships, container transport and offshore activities, the majority of They being French citizens . Conclusions:
 The dynamics of staff in Europe's maritime organizations and the preparation and recruitment of human resources represented the main topic for the European Maritime Workers ' Federation (abbreviated ETF). These issues have been debated intensely by the ETF and the European Ship owners' Organization (ECSA). Thus, the ETF is the most dedicated European organization carrying out projects of this kind aimed at supporting the European social dialogue process and, in essence, implementing work programs in the field of training and recruitment of staff in Maritime organizations. Data on seafarers working in European maritime organizations should be available in correspondence with the following topics: Conclusions:
 • The annual number of officers entering and leaving the maritime organizations, as well as the number of sailors prepared, in order to clearly determine the number of sailors who will enter the maritime organizations in the future, but also to determine how many of those who are in Preparatory process will find jobs in maritime organizations; • The number of STCW certificates issued annually according to rank, function and specialization, making a clear distinction between candidates residing in the EU and those who are not domiciled in the EU, this being a good indicator of the maritime labor market; • ""The creation of forms of human resources census within maritime organizations, which may be biannual, can be achieved with the support of the crewing agencies, establishing the number of sailors on board ships Registered under the flag of a Member State but also on board vessels owned by European firms but having vessels registered under the foreign flag"" . This census should collect information on age, the function of Nationalization and the income of sailors. This would clearly define the level of labor demand in maritime organizations for sailors residing in Europe, but also for those coming from other areas. • Conducting studies on career progression should be realized. These studies must be carried out randomly in union states, discovering whether there are areas for narrowing the possibility of advancing the career, but also how the maritime labor market interacts with other areas Adjacent to Port Agglomerations . Conclusions:
 In this respect, it recommends the creation of a consistent database, allowing the development of recommendations to be addressed specifically to organizations/agencies. These organizations/agencies could, in turn, provide vital data on the situation of employment and dynamics of maritime personnel."
"Maritime Policy Design Framework with ESG Performance Approach: Case of Estonia","https://scispace.com/paper/maritime-policy-design-framework-with-esg-performance-1xeg83s9","2022","Journal Article","Economies","Kaidi Nõmmela
Kati Kõrbe Kaare","10.3390/economies10040088","https://scispace.com/pdf/maritime-policy-design-framework-with-esg-performance-1xeg83s9.pdf","In policy-making, the design of a policy is considered to be one of the most significant steps. A well designed policy will be able to solve sectoral problems across stakeholders as well as support the competitive development of the entire economy. Enterprises of the maritime sector have been influenced by environmental, social, and governance (ESG) changes with the push coming from financiers, insurers, regulators, and customers. To meet the ESG challenges and utilize the benefits ahead, they need to be addressed in the new policy design processes. The specificities of a maritime sector as well as science-based policy-making framework are the fundamentals of successful maritime policy development. Estonia is located on the eastern border of the EU, and has always aimed to be a maritime state. National maritime policy has been adopted (2012–2020) and currently, the Estonian Transport and Mobility Master Plan incorporates maritime aspects. Actors of the maritime sector have remained dissatisfied and advocate the reinstatement and redevelopment of Estonian maritime policy. The aim of this study was to present a framework for the design of maritime policy that uses maritime economics, ESG performance goals, and policy design analyses as inputs. As a result, a maritime policy design framework is proposed.","the basis of nationally mandatory annual reports, but other information is generally sensitive . Although the collection of reliable data is time consuming (e.g., through interviews and surveys) and thus prevents effective policy-making , this pillar is fundamental for successful maritime policy design. The Maritime Policy Design Framework:
 The operational pillar ensures that the policy takes into account the capacity and resources of public authorities and private sector to implement the policy. As focused and independent public administration is crucial for successful maritime policy design ), the analysis of the design operational pillar helps to ensure this. The operational pillar includes administrative, financial, technological, and legal capacity, and the level of knowledge and skills of the public and private sectors. In addition, the operational pillar can be analyzed at three levels: individual (institution or company), organizational (public or economic sector), and systemic (the entire region or country) ). In the maritime sector, there are often core companies around which other smaller companies are concentrated. In this case, the operational capability must be assessed both within the group and individually. The Maritime Policy Design Framework:
 In the maritime sector, the marine resources are generally in the public domain and the management is the responsibility of governmental entities rather than private entrepreneurs . The maritime sector is a traditional industry that operates in a coastal country without major interventions, but each economic field often needs a policy intervention to overcome challenges, especially in light of strict environmental requirements. Additionally, as the maritime sector is governed not only by national but also by supranational organizations , the political aspect is vital for successful policy design. In the political pillar, the policy-makers should analyze and evaluate the design from the perspective of the political situation in a country. In the maritime sector, the lack of political interest can be a major obstacle in policy implementation. The Maritime Policy Design Framework:
 People living in coastal areas are commonly included in maritime sector economic development. In addition to the employment in the sector, traditions and practices in coastal areas make up an important part of the maritime sector's welfare. Therefore, maritime policy has the ability to connect the coastal and maritime area to national needs . A successful policy design should always include a wider public pillar with an analysis of perspectives of coastal habitants and their living conditions in a country or a region. Coastal residents should be involved in policy-making given that they are directly or indirectly involved in potential outcomes. The Maritime Policy Design Framework:
 Taking into account that the maritime sector is an international economic field, as the last pillar, a policy design should analyze the steps from the perspective of an international status. As the world's seas are open to all, the maritime sector is governed by international laws and conventions , which must also be taken into account in local policy-making. In the EU, the EU Structural Funds can also have an important influence on policy design (Van de Voorde and Verhoeven 2016; Northern Ireland Executive 2016). In addition, the geopolitical environment should also be analyzed when designing a policy. Unlocking geopolitical potential is essential for a strong maritime state . The following table ) indicates the proposed maritime policy design framework and shows some examples of the possible content."
