"Paper Title","Paper Link","Publication Year","Publication Type","Publication Title","Author Names","DOI","PDF Link","Abstract","Relevant Excerpt"
"Rethinking sustainability towards a regenerative economy","https://scispace.com/paper/rethinking-sustainability-towards-a-regenerative-economy-3shrgisj","2022","Journal Article","","Qunhua Tang","10.1080/17535069.2022.2072613","https://scispace.com/pdf/rethinking-sustainability-towards-a-regenerative-economy-3shrgisj.pdf","","surpassing EUR half a trillion a year. Now this growth even accelerates in many more sub-sectors . At the same time, even higher growth is possible in a few more sectors and subsectors which were in the focus of the strategy. Introduction:
 The process is driven in two ways. On one side, a wave of smart specialization strategies at regional and urban level is under way, in many cases incorporating the restorative economy elements. On the other side, changes just happened even without the respective strategies in the blue economy structure and challenge the established sectors. Introduction:
 Those sectors include the coastal tourism, marine living resources, marine nonliving resources, port activities, shipbuilding and repair and maritime transport. The field research partly is accumulated on the results of the IRISI ('Indexing the Regional Innovative Levels in the Sectors of the Economy -scenario for the identified in the ISSS four priority thematic areas for smart specialization and their positioning towards the circular economy') project financed under the Bulgarian National Scientific Fund. Each of them concerns the issues of the restorative economy either in urban development and changes in the special planning of the industrial sites related to the blue economy, and in regional aspects with the interactions of the other sectors and elements of the infrastructure serving the sustainable urban development. Introduction:
 The aim of this chapter of the book is to identify the main challenges of the smart specialization strategies at the urban and regional level incorporating the blue growth elements that are met towards the restorative economy frames. The Blue Economy Problems Outline:
 Unlike the introduction of most terminologies in the business practice today the blue economy terminology was initially tracked in the mid-90s, when the Belgian businessman and futurist Gunter Pauli  was asked by the United Nations to think about innovative business models of the future. For the last decade most efforts and achievements are related with the documents introduced by the European Union institutions  before it became a focus of researchers. According to the Commission (2009), the blue economy includes economic activities that are marine based and marine related. The marine-based activities include those undertaken in the ocean, sea and coastal areas, such as capture fisheries and aquaculture, offshore oil and gas, offshore wind energy, ocean energy, desalination, shipping and marine transport, and marine and coastal tourism. The marine-related activities use products and/or produce products and services from the ocean and marine-based activities; for example, seafood processing, marine biotechnology, shipbuilding and repair, port activities, equipment. The Blue Economy Problems Outline:
 The blue economy-established sectors include the marine living resources, marine extraction of non-living resources, maritime transport, port activities, shipbuilding and repair and coastal tourism. While those activities are mostly traditional and profitable, a real challenge is to match them with the logic of the restorative economy and the sustainability achievements. Besides the established sectors in the blue economy, some emerging (a focus in the next section under the blue growth) and innovative sectors bring new opportunities for investment and hold huge potential for the future development of coastal communities . While there are still many challenges to be faced, this chapter makes a step in assessing the potential of the seas and coasts in leading to sustainable economic growth and seeks to support the development of management policies that will ensure it goes in the regenerative economy direction. Hence, the importance of discussing the need to maintain healthy oceans that help preserve and increase the natural capital from which ecosystem services are produced."
"The Future of Fisheries Co-Management in the Context of the Sustainable Blue Economy and the Green Deal: There Is No Green without Blue","https://scispace.com/paper/the-future-of-fisheries-co-management-in-the-context-of-the-1avw08i9","2023","Journal Article","Sustainability","Stella Kyvelou
Dimitrios G. Ierapetritis
Michalis Chiotinis","10.3390/su15107784","https://scispace.com/pdf/the-future-of-fisheries-co-management-in-the-context-of-the-1avw08i9.pdf","Appropriate governance structures are extremely important for fishery-dependent communities in developing integrated territorial development strategies and an adaptive capacity for change, including a climate one. This paper assesses to what extent fishery co-management schemes (e.g., fishery LAGs, being regional/local governance instruments in fishing communities) are strengthening sustainability. The latter includes improving energy efficiency, promoting renewable energy sources (RES), coping with the climate crisis, minimizing environmental impacts, and promoting a sustainable blue economy. For detecting the policy aspects of aligning climate neutrality and a sustainable blue economy, the research lens focuses on the Greek Fisheries Local Action Groups (FLAGs), given that these are mostly located in coastal/marine and insular territories with significant blue growth potential. To map and assess their capacity and efficiency in pursuing Green Deal objectives, a co-development process with FLAG managers was put in place. The results and findings of this process reveal the scarcity of sustainability and blue-economy-related strategies. The key conclusion is that a transition to a post-carbon blue economy on a local level requires an understanding of the evolutionary dynamics of fishery co-management schemes. The latter, being multi-sectoral structures, may boost dialogue and cooperation to harmonize local development strategies and EU policies. Maritime spatial planning (MSP), as an evolutionary governance process itself, can be a driver for making FLAGs evolve and strengthen commonization, blue justice, and equity for fishers.","communities, driven by the low economic performance of the fishing industry, were proven to be hard to reverse. However, the spill-over effect of innovation, best practice, and expertise has generated or untapped the territorial potentials in areas confronted with comparable constraints . A Bit of FLAGs History in Greece:
 Nowadays, within a well-structured multi-level governance framework, there is still a great potential for FLAGs to open up to new activities, such as a sustainable blue economy. By incorporating several stakeholders into their corporate scheme, they can involve and mobilize the entire local community in the region to implement the Green Deal strategy in the European periphery. Sustainable blue economy targets will most probably give fishers a key role in the corporate structure of each FLAG and make their representation stronger, inclusive, and substantial. In the following Figure , the FLAGs participating in the current co-development process are displayed. A Bit of FLAGs History in Greece:
 It is noteworthy that, in May 2021, a renewed approach to a sustainable blue economy in the EU was seen, in order to achieve the objectives of the European Green Deal (EGD). The aim of the EU Sustainable Blue Economy Strategy  is to embed it into the transition envisioned by the Green Deal and the EU Recovery Plan. A Bit of FLAGs History in Greece:
 The strategy appeals for a shift from ""blue growth"" , to a ""sustainable blue economy""  that deems the maritime industry, the environment, and the economy to be inherently linked. It aspires to replace ""unchecked expansion"" with ""clean, climate-proof and sustainable activities that tread lightly on the marine environment"". Therefore, blue sectors (such as fisheries, aquaculture, coastal tourism, maritime transport, port activities, and ship building) are called to reduce their impact on the environment and contribute to healthy seas and the sustainable use of blue resources. More specifically, the new agenda for a sustainable blue economy aims to achieve the objectives of climate neutrality, zero pollution, the promotion of offshore renewable energies (incl. floating wind, thermal, wave, and tidal energy), the decarbonization of maritime transport, the greening of ports that may operate as energy hubs, pollution reduction, and the switch to a circular economy, together with nature and biodiversity conservation increasing fish stocks and the preservation of landscapes. A Bit of FLAGs History in Greece:
 Table  below illustrates the alignment agenda of a sustainable blue economy with EGD. The agenda underlines ""maritime spatial management"" based on a consultation with all the maritime stakeholders, with the aim of stimulating cooperative exchanges in favor of the sustainable use of marine space (see Table   It is noteworthy that, in May 2021, a renewed approach to a sustainable blue economy in the EU was seen, in order to achieve the objectives of the European Green Deal (EGD). The aim of the EU Sustainable Blue Economy Strategy  is to embed it into the transition envisioned by the Green Deal and the EU Recovery Plan."
"The Blue Growth Smart Specialization Challenges Towards the Restorative Economy","https://scispace.com/paper/the-blue-growth-smart-specialization-challenges-towards-the-4ye9dssxst","2021","Book Chapter","","Milen Baltov","10.1007/978-3-030-71819-0_15","https://scispace.com/pdf/the-blue-growth-smart-specialization-challenges-towards-the-4ye9dssxst.pdf","The ‘blue economy’ embraces more than five million jobs and the gross added value in the second decade of this century is surpassing EUR half a trillion a year. Now when this growth even accelerates in many more sub-sectors the process goes driven in two ways. On one side, a wave of smart specialization strategies at regional and urban level is under way, in many cases incorporating the restorative economy elements. On the other side, changes just happened even without the respective strategies in the blue economy structure and challenge the established sectors. The purpose of this chapter of the book is to identify the main challenges of the smart specialization strategies at urban and regional level incorporating the blue growth elements that are met towards the restorative economy frames. The methods used are a literature and key policy documents review and some secondary data analysis over performed by the European Commission contractor investigation with reference to a project performed in the sector. As a conclusion the recommendation for sectoral specialization of the coastal areas and its cities’ economy in accordance with the innovative potential for blue growth was outlined, with the understanding it might be fragile due to the unsustainable economic activities in the seas.","Title: The Blue Growth Smart Specialization Challenges Towards the Restorative Economy Authors: Milen Baltov (Corresponding Author) Keywords: Blue economy sectors, Restorative economy, Blue growth, Smart specialization, Innovation Introduction:
 Traditionally, the businesses associated with sea are important for the European economies and what matters more in the last decade proved to be a potential for growth and innovation. The achievement of the last Europe 2020 strategy for growth goals was substantially due to the maritime sector's improvements and innovations. Blue growth is the long-term strategy to support sustainable growth in the marine and maritime sectors as a whole. The 'blue economy' embraces more than five million jobs and the gross added value in the second decade of this century is surpassing EUR half a trillion a year. Now this growth even accelerates in many more sub-sectors . At the same time, even higher growth is possible in a few more sectors and subsectors which were in the focus of the strategy. Introduction:
 The process is driven in two ways. On one side, a wave of smart specialization strategies at regional and urban level is under way, in many cases incorporating the restorative economy elements. On the other side, changes just happened even without the respective strategies in the blue economy structure and challenge the established sectors. Introduction:
 Those sectors include the coastal tourism, marine living resources, marine nonliving resources, port activities, shipbuilding and repair and maritime transport. The field research partly is accumulated on the results of the IRISI ('Indexing the Regional Innovative Levels in the Sectors of the Economy -scenario for the identified in the ISSS four priority thematic areas for smart specialization and their positioning towards the circular economy') project financed under the Bulgarian National Scientific Fund. Each of them concerns the issues of the restorative economy either in urban development and changes in the special planning of the industrial sites related to the blue economy, and in regional aspects with the interactions of the other sectors and elements of the infrastructure serving the sustainable urban development. Introduction:
 The aim of this chapter of the book is to identify the main challenges of the smart specialization strategies at the urban and regional level incorporating the blue growth elements that are met towards the restorative economy frames. The Blue Economy Problems Outline:
 Unlike the introduction of most terminologies in the business practice today the blue economy terminology was initially tracked in the mid-90s, when the Belgian businessman and futurist Gunter Pauli  was asked by the United Nations to think about innovative business models of the future. For the last decade most efforts and achievements are related with the documents introduced by the European Union institutions  before it became a focus of researchers. According to the Commission (2009), the blue economy includes economic activities that are marine based and marine related. The marine-based activities include those undertaken in the ocean, sea and coastal areas, such as capture fisheries and aquaculture, offshore oil and gas, offshore wind energy, ocean energy, desalination, shipping and marine transport, and marine and coastal tourism. The marine-related activities use products and/or produce products and services from the ocean and marine-based activities; for example, seafood processing, marine biotechnology, shipbuilding and repair, port activities, equipment."
"Assembling a Blue Economy moment? Geographic engagement with globalizing biological-economic relations in multi-use marine environments:","https://scispace.com/paper/assembling-a-blue-economy-moment-geographic-engagement-with-t984ppwqdq","2017","Journal Article","Dialogues in human geography","Gordon M. Winder
Richard Le Heron","10.1177/2043820617691643","https://scispace.com/pdf/assembling-a-blue-economy-moment-geographic-engagement-with-t984ppwqdq.pdf","In the 2010s, the ‘Blue Economy’ has been widely advocated by a spectrum of interests as a strategy to save the world’s oceans and water. This article explores what the Blue Economy moment is and how geographers can engage with it. It acknowledges recent efforts by geographers to understand Blue Economy but goes further by outlining the European Union’s Blue Economy programmes and by discussing these in relation to recent agenda setting in marine science. We argue that in spite of apparent convergence on this goal, the Blue Economy imaginary disciplines disparate knowledge for economic projects, when the planetary reality is that every economic project is axiomatically a biological project, with some economic aspects. In this context, the article outlines how assemblage thinking could be relevant to a human geography engagement with Blue Economy and what this could like, and how a relational conception of Blue Economy helps advance understanding. Finally, we discuss the difficulties and potential for huma...","China, the United States, Indonesia and SIDS, but the EU's established policy framework allows us to highlight economic and scientific implications of the assembling work being done there under the Blue Economy rubric: It is in fact an economy that is being planned. Introduction:
 Acknowledging the diverse contexts in which the Blue Economy is at work, we then consider issues germane to developing an assemblage approach aimed at foregrounding biological and economic relationalities in Blue Economy initiatives and thinking. This is followed by a conceptual schematic of Blue Economy activities that, in breaking with scientific knowledge production traditions, aids relational thinking on reterritorializing human and nonhuman entanglements in coasts, seas and oceans. Finally, we shift from descriptive scoping and conceptual concerns to an example of the assembling of a Blue Economy research initiative, advocated by New Zealand human geographers in that country's science funding framework. This section outlines challenges that can arise when human geographers engage with other experts, investors, stakeholders and government over a new generation of ocean issues associated with Blue Economy, admittedly under one neoliberal governance regime. Introduction:
 Our main aim is to energize a dialogue on how to engage with Blue Economy initiatives. We argue that by considering the Blue Economy as diverse investment institutional projects, each assembling specific gazes on the oceans, geographers can pinpoint how each initiative addresses bioeconomic relations, what ethical and political challenges of dealing with ocean space they entail and how bioeconomic relations can be made differently under Blue Economy relations. We contend that it is through this kind of approach that geographers will be able to offer and engage in multiple strands of intellectual leadership in the complex spaces being imagined under the Blue Economy rubric. An emergent Blue Economy:
 Blue Economy has emerged in diverse discourses and contexts, and therefore, it is not easy to define what the term means. By documenting and discussing activities, events and actors using this term, we offer a mapping of the emerging Blue Economy. The term has currency within United Nations (UN) circles , appears in EU, Chinese government, and other institutional settings, and has been adopted and promoted by a range of commercial, expert and scientific actors. Thus, we conceive of the term as a rubric around which constellations of actors assemble for diverse purposes and in specific contexts. It is important to note that our mapping cannot be definitive, though it illustrates both the diverse interpretations and contestations of the term, and specific assemblying work around the term."
"Malta’s EU presidency : a study in a small state presidency of the Council of the EU","https://scispace.com/paper/malta-s-eu-presidency-a-study-in-a-small-state-presidency-of-2xrp7eu7yi","2018","Book","","Mark Harwood
Stefano Moncada
Roderick Pace","","https://scispace.com/pdf/malta-s-eu-presidency-a-study-in-a-small-state-presidency-of-2xrp7eu7yi.pdf","Editors: Mark Harwood | Stefano Moncada | Roderick Pace Malta assumed the Presidency of the Council of the EU in January 2017 with a list of priorities ranging from migration to social inclusion, security to the single market. In addition to the challenge the Presidency represents for any Member State, small states are particularly ‘stretched’ in meeting the myriad commitments the presidency involves. Therefore, from the outset, Malta’s Presidency represented a challenge for the Government and Public Service. In addition, Malta was also faced with several ‘external’ challenges beyond its control but which had the potential to complicate its task at the helm of the Council, including elections in key member states, the formal launch of the BREXIT process and the inauguration of the Trump administration in America; as Malta entered 2017 it truly found itself in the proverbial ‘eye of the storm’. After completing its Presidency the consensus in Malta and abroad was that the EU’s smallest state had scored highly in delivering on its priorities and that it had been a success. This book represents the first academic assessment of the Presidency and reflects the Institute for European Studies’ commitment to contributing to the body of academic knowledge on Malta and the European Union. M ata’s EU Pesid ency","(are) derived from maritime activities without threatening the integrity of the resource base: the sea itself."" The second objective which was closely linked to the first was to secure ""the ecological, economic and social sustainability of the European fishing and aquaculture industry"". :
 The current EU Commissioner for the Environment, Maritime Affairs and Fisheries (2014-2019), Karmenu Vella, summarizes his priorities in an antonymic way which however show continuity with the efforts of his predecessors: protecting Europe's environment while maintaining competitiveness; creating sustainable jobs while safeguarding resources; implementing the new Common Fisheries Policy and ""leading the task with the EU's global partners, of defining the management and governance of (our) planet's oceans."" 279 However, beyond this, there is a point to be made that physical geography can mould the political culture of a state in a certain way so that certain forms of behaviour tend to recur. The fact that Malta is an island explains its maritime ""bent"". But it also shows that to a greater extent than is immediately apparent, that its political culture has been conditioned by this fact of its physical geography which may explain policy continuity in the maritime sector. The Blue Economy:
 The Blue Economy has become the cornerstone of EU maritime policy and not surprisingly the concept has also been gaining interest in research and academic analysis, though it has not so far made perceptible inroads. The definitions of Blue Growth vary a lot, according to what they include and leave out, but a familial resemblance has already emerged that safeguards its integrity, namely that the diverse definitions have not rendered the concept vague, ambiguous and useless as an analytical tool. Peter Ehlers said that the Blue Economy covers ""the traditional maritime industry: maritime transportation as the core of maritime industry, including port services and shipbuilding, as well as fisheries, and also the exploitation of oil and gas from the seas. These sectors are still gaining in importance."" 280 However, he also highlights the European Commission's identification of five newer areas of activities that hold a lot of promise for further growth of the Blue Economy, namely aquaculture, coastal and maritime tourism (blue tourism) marine biotechnology (blue biotechnology), ocean energy (blue energy) and Seabed mining. Many of these are already key important contributors to Malta's economy, with tourism alone contributing just under 15% to Malta's GDP in 2017, and 26% if the indirect and induced effects are taken into account.  The Blue Economy is predicted to continue expanding in the next 15 years. However, it should not be assumed that it will generate only positives. The Blue Economy:
 There are bound to be unintended consequences, as well as costs. Many of the sectors have reciprocal negative effects: the development of offshore activities affects maritime transport, coastal development restricts coastal fishing; acqua culture, coastal and marine tourism, marine renewable energy and recreational fisheries compete for limited coastal space. In a word, the development of the Blue Economy can further stress the Mediterranean ecosystem and the outcome of these developments cannot be predicted with precision. 282 With a rapidly expanding population around the Mediterranean coast and the effects of climate change the pressures can only increase. The other problem is that when confronting Mediterranean challenges, the EU cannot operate alone but must secure the active  Ehlers, 2016."
