"Paper Title","Paper Link","Publication Year","Publication Type","Publication Title","Author Names","DOI","PDF Link","Abstract","TL;DR"
"Sociological Aspects of Seafarers? Life and Work and Management Styles in Shipping","https://scispace.com/paper/sociological-aspects-of-seafarers-life-and-work-and-2wploiyqtc","2015","Journal Article","International Journal of Economics and Management Sciences","Andrija NenadiÄ
Dra en JašiÄ
Aleks
ra KrajnoviÄ","10.4172/2162-6359.1000237","","This scientific paper provides a systematic analysis of sociological relationships in the area of seafaring as well as management styles in maritime shipping industry, with particular emphasis on the specific features involved in the vocation of a seafarer. The research was carried out on a sample of seafarers attending training courses at Faculty of Maritime Studies in Split. Separation from family, friends and familiar environment represents one of the essential features of the seafarers’ life that are discussed in the paper. Another important sociological factor of the seafarers’ specific profession is their workplace, i.e. the ship.","In this article, a systematic analysis of sociological relationships in the area of seafaring as well as management styles in maritime shipping industry, with particular emphasis on the specific features involved in the vocation of a seafarer is presented."
"Maritime labour : contributions to the history of work at sea, 1500-2000","https://scispace.com/paper/maritime-labour-contributions-to-the-history-of-work-at-sea-2m1ybbhb99","2007","","","Richard Gorski","","","Maritime Labour - 2[-]Table of contents - 6[-]Introduction - 8[-]Six cross-sections of the Dutch maritime labour market: A preliminary reconstruction and its implications(1610-1850) - 14[-]On maritime labour and maritime labour markets in Germany, 1700-1900 - 44[-]Swedish naval personnel in the merchant marine and in foreign naval service in the eighteenth century - 62[-]Quantifying British seafarers, 1789-1828 - 84[-]'But for the loves of the fishes': Maritime labour and ecological culture in nineteenth-century Newfoundland - 106[-]The Shipping Federation and the free labour movement: A comparative study of waterfront and maritime industrial relations, c.1889-1891 - 130[-]Health and safety aboard British merchant ships: The case of first aid instruction, 1881-1908 - 156[-]British merchant marine engineer licensing, 1865-1925 - 186[-]Transatlantic fishers: New England and British trawlermen, 1960-1972 - 220[-]Masters and chiefs: Enabling globalization, 1975-1995 - 236[-]About the contributors - 259","In this article, a preliminary reconstruction of the Dutch maritime labour market and its implications is presented, along with a comparative study of waterfront and maritime industrial relations, c.1889-1891."
"Maritime Labour","https://scispace.com/paper/maritime-labour-8j1llwcsrmx3","","","","Frank Broeze","10.5949/liverpool/9780973007336.003.0008","","This chapter examines the social impact that containerisation - and the drastic topographical and economic changes to the shipping industry - had upon the livliehoods of maritime labourers. It explores the challenges and consequences of new technologies faced by labourers and maritime communities within the shipping industrythe drastic shifts in skillsets necessary for maritime labourers in order to keep up with technological development; and the reduction of labour force within the shipping industry. The chapter is divided into sections as follows: Seafarers; Flags of Convenience; Training; Down-sizing and Multi-skilling; Safety and Accidents at Sea; Port Workers; Decimation of the Work Force; Social Consequences of Containerism; Industrial Conflicts and Port Workers’ Unions; The International Transport Workers’ Federation; and Resugent Militancy and Political Protest. It concludes by suggesting the only way forward is to approach modernisation, globalisation, and privatisation with a humane outlook.","This chapter examines the social impact of containerisation on maritime labourers, exploring challenges, consequences, and drastic shifts in skillsets, labour force reduction, and social consequences, concluding with a need for a humane approach to modernisation and globalisation."
"The global seafarer: living and working conditions in a globalized industry","https://scispace.com/paper/the-global-seafarer-living-and-working-conditions-in-a-35s8fw3sld","2004","Book","","Tony Alderton
Michael Bloor
Erol Kahveci
Tony Lane
Helen Sampson
Michelle Thomas
Nik Winchester
Bin Wu
Minghua Zhao","","","This volume offers a systematic account of the effects of globalization on the shipping industry and seafarers' lives. The seafarers' labour market is changing rapidly and this study discusses the challenges encountered in recruitment practices, trade unions and collective bargaining, as well as training, certification and fraudulent certification. Wages, contracts, and tours of duty are also investigated, and the book includes in-depth treatment of seafarer safety and hazard exposure.

Innovations such as automated engine rooms and the global maritime distress and safety system, the internationalization of ship registrations, multinational crewing and reductions in crewing levels, and the rise in ship management companies have had a profound effect on seafarers' living and working conditions. This perceptive book examines these and future issues for regulation and enforcement.","In this article, a systematic account of the effects of globalization on the shipping industry and seafarers' lives is presented, including the challenges encountered in recruitment practices, trade unions and collective bargaining, as well as training, certification and fraudulent certification."
"The Other Car Workers: Work, Organisation and Technology in the Maritime Car Carrier Industry","https://scispace.com/paper/the-other-car-workers-work-organisation-and-technology-in-1bwl3reifl","2006","Book","","Erol Kahveci
Theo Nichols","","","About 60 million vehicles are produced each year, of which eight million are shipped by deep-sea and millions more by short-sea routes. This makes the maritime car carrier sector an integral part of car manufacturing's supply chain. Yet the sector has been entirely neglected by social scientists. Switching attention from the frequently researched car assembly-line worker, this book documents the dramatic new developments that have taken place in the industry both in production systems, technology, organisational infrastructure and not least, in terms of working life. It examines the maritime car carrier sector with respect to changes in cost structure and dynamics; in ownership, freight, labour and other markets; in technological innovation and ship design; and in relation to car manufacturers, ship management companies and crewing agents. Alongside a political economy of the industry, chapter and verse is provided on the work and lives of the seafarers who make up its global labour force, many of them from low-wage countries. It is seen that in terms of their work-life balance and in other respects they endure conditions that have no land-based equivalents.","In this article, the authors examine the maritime car carrier sector with respect to changes in cost structure and dynamics; in ownership, freight, labour and other markets; in technological innovation and ship design; and in relation to car manufacturers, ship management companies and crewing agents."
"The Other Car Workers: Work, Organisation and Technology in the Maritime Car Carrier Industry","https://scispace.com/paper/the-other-car-workers-work-organisation-and-technology-in-djhlcfu0ypnk","","","","E. Kahveci
T. Nichols","10.1177/030981680909800115","","About 60 million vehicles are produced each year, of which eight million are shipped by deep-sea and millions more by short-sea routes. This makes the maritime car carrier sector an integral part of car manufacturing's supply chain. Yet the sector has been entirely neglected by social scientists. Switching attention from the frequently researched car assembly-line worker, this book documents the dramatic new developments that have taken place in the industry both in production systems, technology, organisational infrastructure and not least, in terms of working life. It examines the maritime car carrier sector with respect to changes in cost structure and dynamics; in ownership, freight, labour and other markets; in technological innovation and ship design; and in relation to car manufacturers, ship management companies and crewing agents. Alongside a political economy of the industry, chapter and verse is provided on the work and lives of the seafarers who make up its global labour force, many of them from low-wage countries. It is seen that in terms of their work-life balance and in other respects they endure conditions that have no land-based equivalents.","This book examines the neglected maritime car carrier industry, documenting changes in production, technology, and working life, and highlighting the challenging conditions faced by seafarers, who endure unique work-life balance issues and low-wage conditions."
"The Rhythms of Shipboard Life: Work, Hierarchy, Occupational Culture and Multinational Crews","https://scispace.com/paper/the-rhythms-of-shipboard-life-work-hierarchy-occupational-4ytt31nffb","2021","Book Chapter","","Helen Sampson","10.1007/978-3-030-49825-2_8","https://scispace.com/pdf/the-rhythms-of-shipboard-life-work-hierarchy-occupational-4ytt31nffb.pdf","Several words repeatedly crop up when you ask a seafarer working in the international cargo fleet to describe a life at sea: ‘boring’, is one; ‘lonely’ is another; and the word ‘sacrifice’ is used very frequently as well. Most contemporary seafarers are recruited from developing economies where well-paid opportunities for work ashore are scarce and, if they can be found at all, are only available to highly skilled or qualified personnel. As a result, the money that can be earned at sea by both officers and ratings is often unparalleled and this encourages people to seek work as a seafarer when they are young. It also keeps many of them coming back to sea as they get older (as described so vividly by Baum-Talmor in Chap. 5) despite having come to grips with some of the rather unglamorous aspects of the job.","Several words repeatedly crop up when you ask a seafarer working in the international cargo fleet to describe a life at sea: ""boring"" is one; ""lonely"" is another; and the word ""sacrifice"" is used very frequently as well."
"Supply Nets: The Logistics of Seafarer Abandonment","https://scispace.com/paper/supply-nets-the-logistics-of-seafarer-abandonment-18wowmyr0k","2024","Journal Article","Antipode","Jacob Bolton","10.1111/anti.13038","","Abstract This paper studies the infrastructural and organisational forms that facilitate labour exploitation within maritime logistics. My entry point is the rising wave of seafarer abandonments, which I approach not as isolated incidents of mismanagement but as an intensification of the flexibilising tendencies underpinning contemporary capitalism. I trace the recent history of these dynamics, examining their effect on shipping labour. I then investigate some of the specific legal and economic mechanics of shipping, focusing on debt, insurance, and bordering. Using supply chain mapping software, I study supply systems in a way that centres labour rather than the commodities being moved. I close by claiming that abandonments are not an accident, but an inevitable endpoint of a system designed to precaritise labour while protecting shipowners’ profits. Against this, I sketch out a new way of conceiving of supply chains—as supply nets, matrices of interconnected lines, prone to becoming tangled. ","Seafarer abandonments are a systemic issue rooted in the flexibilising tendencies of contemporary capitalism and the design of supply chains that prioritize shipowners' profits over the well-being of seafarers."
"The Maritime Labour Convention 2006: A Frozen Revolution in the Realisation of Social Justice for Seafarers","https://scispace.com/paper/the-maritime-labour-convention-2006-a-frozen-revolution-in-40ry82kcg7","2013","","","Lloyd Cameron","","https://scispace.com/pdf/the-maritime-labour-convention-2006-a-frozen-revolution-in-40ry82kcg7.pdf","Realising social justice has been one of the central goals of the International Labour Organisation since its inception. Yet today the unique environment and dangers associated with working at sea make the world’s 1.2 million seafarers a particularly vulnerable group, both in terms of their physical safety and mental wellbeing, and concerning the realisation of social justice.

Social justice is a somewhat abstract term, taken to refer to the “fair” balance of power and benefits between different groups in society. Central to this notion of “fairness” is the respect for liberties and human dignity. However, international maritime law has traditionally focused on political and economic considerations rather than the social needs of the seafarer. This problem has been exacerbated by the advent of globalisation and an increasing tendency within the industry for shipowners to seek out flags of convenience, allowing them to legitimately subvert the international labour standards developed by the ILO with the intention of cutting operational costs. Seafarers have become commodified, seen as objects of the industry rather than subjects of the law who are entitled to rights and protections.

This thesis examines how the innovations contained in the 2006 Maritime Labour Convention are likely to combat these problems and influence the realisation of social justice for seafarers when they come into effect in August 2013.

While not revolutionising the content of the rights and protections afforded to seafarers during the course of their employment, this thesis identifies several innovations concerning implementation and enforcement where the MLC has broken new ground and looks set to revolutionise the realisation of social justice for seafarers.

Consolidation of the previous plethora of maritime labour conventions into a single instrument seems set to increase the accessibility and understanding of rights for seafarers while also providing a focal point through which to incorporate maritime labour considerations into international maritime law – achieving so-called “Fourth Pillar” status for the MLC. In addition, a global legal space for maritime labour rights looks set to be created, working within the jurisdictional framework already established by maritime labour law to strive towards the universalization of seafarers’ rights and foster the ability to human rights forum shop to gain access to justice. Finally, the MLC has provided, for the first time, a legal foundation backed by an enforcement mechanism embedded in competition norms for corporate social responsibility, turning the flag of convenience system on its head and seeking to hand the competitive advantages to those shipping companies who respect and adhere to international labour standards.

The thesis concludes by reflecting recognising that the MLC has therefore made considerable strides towards the substantive realisation of social justice but tempers this by acknowledging the need to monitor and evaluate how these provisions are interpreted and applied in practice when the Convention comes into effect.","In this paper, the authors examine how the innovations contained in the 2006 Maritime Labour Convention are likely to combat these problems and influence the realisation of social justice for seafarers when they come into effect in August 2013."
"Lives in Peril: Profit or Safety in the Global Maritime Industry?","https://scispace.com/paper/lives-in-peril-profit-or-safety-in-the-global-maritime-3bd3gpjlue","2013","Book","","David Walters
Nicholas J. Bailey","","","Lives in Peril demonstrates how and why seafarers are a vulnerable group of workers. It argues they are made so by the organisation and structure of their employment; the prioritisation of profit over safety by the actors that engage and control their labour; the limits of enforcement of the regulatory framework that is in place to protect them; and by their weakness as collective actors in relation to capital. The consequences of this vulnerability are seen in data on their occupationally-related morbidity and mortality - evidence that probably only represents a partial picture of the actual extent of the physical, mental and emotional harm resulting from work at sea. This volume's central argument is that this situation is likely to remain broadly unchanged as long as global maritime governance and regulation remains in thrall to the neo-liberal economic and political arguments that drive globalisation, and fails to enforce regulatory standards more robustly.","Lives in Peril as discussed by the authors argues seafarers are a vulnerable group of workers, made so by the organisation and structure of their employment, the prioritisation of profit over safety by the actors that engage and control their labour; the limits of enforcement of the regulatory framework that is in place to protect them; and their weakness as collective actors in relation to capital."
"Crews of convenience from the South West Pacific: the 'German' sailors of Kiribati","https://scispace.com/paper/crews-of-convenience-from-the-south-west-pacific-the-german-5cmc7cm53r","2001","Journal Article","New Zealand journal of industrial relations","Richard Morris
Thomas Klikauer","","","Discusses the employment of Kiribati seafarers on German owned and flagged shipping. Examines the origins of the German shipping industry sponsored training and recruitment programmes on the Kiribati atolls. Assesses the implications of the creation of a manorial 'internal' labour market for German container shipping in the South West Pacific. Looks at the impact of labour participation in the international shipping industry on the former fisherfolk of Kiribati. Relates the experience of the Kiribati seafarers to the general 'flag of convenience' and 'crews of convenience' phenomenon, arguably the central issue in the current industrial and social study of global merchant shipping.","In this paper, the employment of Kiribati seafarers on German owned and flagged shipping is discussed and the origins of the German shipping industry sponsored training and recruitment programs on the Kiribata atolls."
"Forgotten keyworkers: the experiences of British seafarers during the COVID-19 pandemic","https://scispace.com/paper/forgotten-keyworkers-the-experiences-of-british-seafarers-2z6a848v","2022","Journal Article","Economic and Labour Relations Review","Helen Devereux
Emma Jane Kirsty Wadsworth","10.1177/10353046221079136","","During the COVID-19 pandemic the UK Government designated seafarers as keyworkers. This article explores their experiences in an industry operating under international legislation designed to ensure and maintain their employment and working conditions. Three hundred and fifty-two British seafarers completed an online questionnaire. The findings revealed two key themes: the erosion of the terms and conditions of those who work at sea, and the differing experiences of those who were precariously employed on single voyage contracts in comparison to those in permanent employment. In contrast with precariously employed individuals, more seafarers with permanent contracts were joining the vessel as normal and fewer were not being paid having been unable to join a ship as scheduled. In a similar vein, fewer permanently employed seafarers were adversely financially impacted during the pandemic. The article concludes that those with the weakest employment relationships have experienced the greatest challenges as a result of the COVID-19 pandemic–a scenario which was possible as a result of the limited enforcement of the regulatory framework intended to protect those who work at sea.","In this paper , the authors explored seafarers' experiences in an industry operating under international legislation designed to ensure and maintain their employment and working conditions during the COVID-19 pandemic."
"An analytical review of the treatment of seafarers under the current milieu of the international law relating to maritime labour and human rights","https://scispace.com/paper/an-analytical-review-of-the-treatment-of-seafarers-under-the-1ps8xpqmrz","2009","","","Maria R. S. B. Hubilla","","https://scispace.com/pdf/an-analytical-review-of-the-treatment-of-seafarers-under-the-1ps8xpqmrz.pdf","Title of Dissertation : An Analytical Review of the Treatment of Seafarers Under the Current Milieu of the International Law Relating to Maritime Labour and Human Rights Degree : Master of Science (MSc) The humane treatment of seafarers has been a long standing issue synchronic with the evolution of seafaring. Their categorisation as a special group of maritime workers was borne out of the distinctive nature of their work on board the ship. The far reaching expanse of the sea made them isolated and inaccessible from the protection of a legal system that normally cease or change at every border of a territorial State. This is where the seafarer’s human rights and welfare becomes vulnerable, in the face of legal complexities and uncertainties. Having in mind the disadvantaged position of the lowest members in the shipping society, and the rampant violation of their rights brought about by the rising trend in the criminalisation of seafarers in the event of maritime accident, denial of shore leave and abandonment of seafarers, various international laws and legal instruments were formulated and instituted by the different international bodies and entities to address the above stated problems. This paper will, therefore, undertake a critical analysis of the different legal regimes that are relevant to the rights of seafarers, for the purpose of determining their efficacy in protecting the rights and interests of the seafarers. This is in the light of the fact that among the numerous international instruments existing today, nothing ever dealt specifically at protecting the seafarer’s human rights and welfare while at the same time the violation and disregard of their fundamental rights continue. The inevitable effect from the unrelenting ill-treatment of seafarers is being manifested by the occurring shortage of ship officers and the waning interest in the seafaring career which will undoubtedly hamper the efficiency of the world’s fleet that is being manned and operated through the unrivalled skills of the seafarers.","In this article, an analytical review of the treatment of seafarers under the current Milieu of the International Law Relating to Maritime Labour and Human Rights is presented, for the purpose of determining their efficacy in protecting the rights and interests of the seafarers."
"The Seafarers' Urban World: A Critical Review:","https://scispace.com/paper/the-seafarers-urban-world-a-critical-review-3woeygji43","2013","Journal Article","The International Journal of Maritime History","Robert Lee","10.1177/084387141302500103","","This paper addresses some of the outstanding issues relating to our perception
of the seafarer’s urban world. It reassesses the stereotypical image of Jack
ashore, particularly in relation to drink and crime, as well as the perception
and experience of the urban environment; locates seafarers within their family,
kin and communal networks; explores the linkages between maritime and
shore-based employment; and analyzes the extent and significance of welfare
support in mediating the experience of the urban world. It also places the
analysis of the seafarer’s shore-based experiences within a wider conceptual
and methodological framework rather than accepting at face value the normative
accounts found in the work of some maritime historians and which continue
to mould and structure popular opinion.","In this paper, the authors address some of the outstanding issues relating to our perception of seafarers' urban world and place the seafarer's shore-based experiences within a wider conceptual and methodological framework rather than accepting at face value the normative account of some maritime historians."
