"Paper Title","Paper Link","Publication Year","Publication Type","Publication Title","Author Names","DOI","PDF Link","Abstract","TL;DR"
"The ‘Right Place’ for Sharks in the South Pacific: Marine Spatial Planning in a More-Than-Human Ocean","https://scispace.com/paper/the-right-place-for-sharks-in-the-south-pacific-marine-kngdumc1","2022","Journal Article","Planning Practice and Research","Juliette Kon Kam King
Léa Riera","10.1080/02697459.2022.2035918","","ABSTRACT This article questions the contours of marine spatial planning and its application to non-humans while also paying attention to the role of the latter in structuring marine spaces and activities. Through two case studies focusing on sharks-oriented ecotourism in Fiji and sharks risk management in New Caledonia, we discuss how the ‘right place’ of sharks and humans at sea is negotiated, defined and enforced. Comparing the practices deployed to control sharks and humans’ behaviours and whereabouts, we argue that sharks are increasingly incorporated into marine spatial planning although with distinct patterns of sharks–humans relations.","In this paper , the authors discuss how the right place of sharks and humans at sea is negotiated, defined and enforced and argue that sharks are increasingly incorporated into marine spatial planning although with distinct patterns of sharks-humans relations."
"Introduction: theorising heritage for the seas","https://scispace.com/paper/introduction-theorising-heritage-for-the-seas-1gaseqrfwn","2024","Journal Article","International Journal of Heritage Studies","Edyta Roszko
Tim Winter","10.1080/13527258.2024.2323545","","This Introduction makes the case for a more critical engagement with oceans and the maritime within critical heritage theory. We lay out a research agenda that more consciously foregrounds aquatic domains in debates about conservation, sovereignty, governance, state power, and the politics of memory. In laying the ground for the papers that follow, we portray oceanic geographies and maritime heritage as politically and culturally charged arenas in order to argue that oceans are far from neutral or culturally egalitarian spaces and are subject to human-imposed hierarchies and competing ontologies. We scrutinize the dynamic interplay between maritime and marine realms to challenge conventional understandings of space, territory, and ownership, advocating for a reimagined approach to heritage that recognizes the ocean’s pivotal role in shaping human history and culture. ","Introduction: theorising heritage for the seas TLDR - Oceans and the maritime are politically and culturally charged arenas subject to human-imposed hierarchies and competing ontologies."
"Listening to the river: Representing non‐human needs and interests in debates about water governance and management","https://scispace.com/paper/listening-to-the-river-representing-non-human-needs-and-1gj9k2l3","2023","Journal Article","River Research and Applications","Veronica Strang","10.1002/rra.4137","https://onlinelibrary.wiley.com/doi/pdfdirect/10.1002/rra.4137","The social sciences and humanities have become increasingly critical of the anthropocentrism that supports exploitative relations with the non-human domain. This shift in positionality recognises that non-human beings and ecosystems are not humankind's passive subjects but the co-creators of shared lifeworlds. A logical consequence is a greater appreciation of the rights and interests of non-human beings and ecosystems, both in law and in the decision-making processes that shape human-environmental relations. This requires some form of pan-species democracy that simultaneously respects biocultural diversity. Drawing on ethnographic research on the River Stour in Dorset, this paper considers how we might reimagine the notion of community to encompass human and non-human inhabitants in river catchment areas. It considers what ‘speaking for the river’ would entail, and what a river might want to say. Employing anthropological approaches to art and material culture, examining ‘what things do’, and the multi-species ethnography that illuminates interspecies relations, this requires an imaginative leap, not into faux animism, but into serious consideration of the river as an active partner in human-non-human relations. This requires us to understand the river's properties and behaviours, and how it acts both creatively and destructively upon all of the living kinds that depend upon it—and vice versa. What does a river need to ensure its own flourishing and that of its dependent communities? This paper considers how ‘listening to the river’ enables the representation of its needs and interests in decision-making processes. ","In this article , the authors consider the role of the river as an active partner in human-non-human relations and propose a pan-species democracy that simultaneously respects biocultural diversity."
"Towards a more-than-human political ecology of coastal protection: Coast Care practices in Aotearoa New Zealand:","https://scispace.com/paper/towards-a-more-than-human-political-ecology-of-coastal-58kzz0otac","2021","Journal Article","","Friederike Gesing","10.1177/2514848619860751","","Coastal protection measures are intended to stabilize the boundaries of land and sea—and of private property. But structural engineering solutions, such as seawalls, have negative side-effects in t...","In this article, the authors proposed that structural engineering solutions, such as seawalls, have negative side-effects in coastal protection and private property, and proposed a solution to stabilize the boundaries of land and sea."
"Reimagining Ocean Stewardship: Arts-Based Methods to ‘Hear’ and ‘See’ Indigenous and Local Knowledge in Ocean Management","https://scispace.com/paper/reimagining-ocean-stewardship-arts-based-methods-to-hear-and-11az96lt","2022","Journal Article","Frontiers in Marine Science","Mia Strand
Nina Rivers
Bernadette Snow","10.3389/fmars.2022.886632","https://scispace.com/pdf/reimagining-ocean-stewardship-arts-based-methods-to-hear-and-11az96lt.pdf","Current ocean management approaches are often characterised by economic or environmental objectives, paying limited consideration to social and cultural dimensions, as well as Indigenous and local knowledge. These approaches tend to inhibit ocean stewardship, often marginalising coastal communities or limiting people’s access to spiritual, traditional and recreational uses of the ocean and coast. Piloting arts-based participatory research methods to co-create knowledge with co-researchers in Algoa Bay, South Africa finds that these methods can be useful in highlighting cultural connections to the ocean, and remembering and imagining, or reimagining, ways in which people relate to and care for the ocean and coast. For example, using photography and in situ storytelling often allows people to convey memories and histories of more accessible coastlines, or envisaging a future with more inclusive and participatory ocean management. The study finds that there is a strong sense of exclusion from and lack of access to coastal and ocean areas in Algoa Bay where Indigenous and local communities have depended on for spiritual, cultural and recreational purposes for several generations. Co-creation of knowledge regarding connections, values and priorities of the coast and ocean with Indigenous and local communities should therefore be planned for before the implementation of integrated ocean management approaches and intentionally designed as part of adaptive management processes. Emphasising these cultural connections, and better recognising them in ocean management has the potential to include i people’s awareness of the ocean which could translate into an increased sense of care and stewardship towards the ocean and coast as people feel more connected to their contextual seascapes. This could in turn contribute to a more sustainable sociocultural approach to ocean management which is necessary for equitable and sustainable future ocean social-ecological wellbeing.","In this paper , the authors use arts-based participatory research methods to co-create knowledge with co-researchers in Algoa Bay, South Africa, finding that these methods can be useful in highlighting cultural connections to the ocean, and remembering and imagining, or reimagining, ways in which people relate to and care for the ocean and coast."
"Intersecting Social Science and Conservation","https://scispace.com/paper/intersecting-social-science-and-conservation-2y0ngk5gqx","2021","Journal Article","Frontiers in Marine Science","Thomas Sanborn
Julia Jung","10.3389/FMARS.2021.676394","https://scispace.com/pdf/intersecting-social-science-and-conservation-2y0ngk5gqx.pdf","There is a growing consensus that current conservation strategies are unable to cope with the acceleration of human-caused environmental degradation. The philosophies that underpin and shape traditional conservation initiatives have begun to shift towards a ""people and nature"" approach, based on a new and deeper understanding of relational values. With this shift, there is increasing concern about the social impacts of conservation and a need to consider not only the environmental aspects of conservation, but also issues of equity and social justice. This is especially important for marine conservation to avoid repeating the exclusionary and unjust protective measures sometimes seen in traditional terrestrial conservation. Additionally, lack of compliance with management schemes, and failure to consider the social dimensions and realities of local communities have hindered the success of conservation initiatives. Therefore, increasing engagement with social science and a better understanding of human-wildlife and human-nature connections are necessary. Community-based conservation approaches and payment for ecosystem service schemes can provide important insights and lessons for such improved participatory management. Furthermore, the use of social science offers a range of methods and approaches that can be used to improve the consideration of those social dimensions. These include different theoretical frameworks for understanding the relationships between people, society, and nature, innovative participatory methods and more flexible, adaptive systems-based approaches for understanding complex socio-ecological systems. Increasing and mainstreaming the inclusion of the social dimensions of conservation will also depend on overcoming current institutional barriers such as lack of capacity, time, and funding opportunities especially in the context of marine social science.","In the context of marine conservation, a growing consensus that current conservation strategies are unable to cope with the acceleration of human-caused environmental degradation can be found in the work of."
"Relating to the Sea: Enlivening the Ocean as an Actor in Eastern Sri Lanka","https://scispace.com/paper/relating-to-the-sea-enlivening-the-ocean-as-an-actor-in-wkw0pymu4m","2013","Journal Article","Environment and Planning D-society & Space","Jessica Lehman","10.1068/D24010","https://journals.sagepub.com/doi/pdf/10.1068/d24010","Elements deemed part of ‘nature’ or the ‘environment’ have long been considered factors in political and social realities, but recent work by environmental historians, feminists, poststructuralists, and particularly posthumanists calls for them to be understood as actors. In this paper I build a case for considering the ocean as an actor on Sri Lanka's east coast, by bringing concepts around relationality and nonhuman agency into conversation with social theories of the sea and with the lived experiences of coastal residents. The ocean occupies a dynamic and central role on Sri Lanka's East coast, as demonstrated through daily practices and its centrality in the area's armed conflict, as well as by the devastation wreaked by the 2004 tsunami. By understanding the ocean as an actor it is possible to gain insight into the intersections of various phenomena, such as armed conflict and natural disaster, and to amplify the voices of those who occupy space closest to those intersections.","In this paper, the authors consider the ocean as an actor on Sri Lanka's east coast, by bringing concepts around relationality and nonhuman agency into conversation with social theories of the sea and with the lived experiences of coastal residents."
"Ocean views: an investigation into human-ocean relations","https://scispace.com/paper/ocean-views-an-investigation-into-human-ocean-relations-4gezmso3s7","2007","Dissertation","","Deborah Jane Kennedy","","https://scispace.com/pdf/ocean-views-an-investigation-into-human-ocean-relations-4gezmso3s7.pdf","This dissertation investigates some conceptions of oceans in modern Western societies that are highly influential in shaping human-ocean relations. My main aim in this dissertation is to demonstrate that the Western discourses of law, science and the aesthetic of the sublime illuminate characteristics of human-ocean relations in Western societies. I argue that the conceptions developed and perpetuated in the discourses of law, aesthetics and science unnecessarily constrain the possibilities for human-ocean relations and undermine just existences of oceans. A further aim of this dissertation is to set out an ethical political approach that is inclusive of a diversity of ocean views that facilitate improved knowledge about the oceans and transform dominant human ocean relations into more just relations.

In approaching my critique of Western discourses of law, aesthetics and science I canvas a range of philosophical, social and political theories, but make most use of the insights of feminist and ecological feminist thinkers into forms of oppression and environmental justice. I also move beyond critique to set out an approach for structuring ocean policy debates and outcomes with a form of political epistemology that de-centres influential Western conceptions of oceans and is inclusive of a diversity of perspectives.

In carrying out this dissertation's investigation I find that particular conceptions of oceans in the discourses of law, aesthetics and science narrowly define how Western human subjects think, feel and interact with oceans. These discourses provide a dominant position for Western subjects over those of other people and the oceans. This is how, in basic terms, I suggest that Western discourses undermine just existences for oceans. A common feature in the discourses that frame the conceptions of oceans that I discuss is the exclusion of a diversity of human-ocean relations from consideration. To counter the exclusionary practices of Western discourses I find that robust democratic processes are essential for just ocean existences. The importance of democratic processes is not only that they constitute ethical processes, and should be valued highly for that reason, but also because of a capacity to produce and deliver improved knowledge about the oceans and transform human-ocean relations. I advocate in particular the approach to political epistemology of Bruno Latour as one way to work toward just ocean existences. In the approach I advocate, oceans participate in democratic processes as agents, not as mere objects awaiting human benevolence or exploitation.","In this paper, the authors argue that the Western discourses of law, science and the aesthetic of the sublime unnecessarily constrain the possibilities for human-ocean relations and undermine just existences of oceans."
"Social Resilience in the Anthropocene Ocean","https://scispace.com/paper/social-resilience-in-the-anthropocene-ocean-myfjpbpa62","2017","Book Chapter","","Elena M. Finkbeiner
Kirsten L.L. Oleson
John N. Kittinger","10.1016/B978-0-12-805375-1.00005-2","","Our oceans are peopled seascapes that nourish communities, support household economies, protect coastal populations from storms, and give us lifesaving medicines. Yet the intersecting threats of overharvesting, climate change, pollution, and habitat destruction continue to threaten the ocean's ability to support the well-being of global humanity, and place at risk the most vulnerable people on earth. This chapter explores what it means for people, communities, and societies to be resilient to a changing sea. We do this by examining factors that undermine and enhance social resilience in the context of overfishing, sea level rise, and habitat degradation. The Anthropocene ocean needs to be managed for social resilience as well as ecological sustainability, ensuring individuals, communities, and societies have the resources necessary to anticipate and adapt to change. This will foster healthy engagement and stewardship of our oceans.","In this article, the authors examine factors that undermine and enhance social resilience in the context of overfishing, sea level rise, and habitat degradation, and explore what it means for people, communities, and societies to be resilient to a changing sea."
"Fluid geographies: marine territorialisation and the scaling up of local aquatic epistemologies on the Pacific coast of Colombia","https://scispace.com/paper/fluid-geographies-marine-territorialisation-and-the-scaling-2vaxuyrwp7","2018","Journal Article","Transactions of the Institute of British Geographers","Paula Satizábal
Simon Batterbury
Simon Batterbury","10.1111/TRAN.12199","https://scispace.com/pdf/fluid-geographies-marine-territorialisation-and-the-scaling-2vaxuyrwp7.pdf","The Pacific region of Colombia, like many sparsely populated places in developing countries, has been imagined as empty in social terms, and yet full in terms of natural resources and biodiversity. These imaginaries have enabled the creation of frontiers of land and sea control, where the state as well as private and illegal actors have historically dispossessed Afro-descendant and indigenous peoples. This paper contributes to the understanding of territorialisation in the oceans, where political and legal framings of the sea as an open-access public good have neglected the existence of marine social processes. It shows how Afro-descendant communities and non-state actors are required to use the language of resources, rather than socio-cultural attachment, to negotiate state marine territorialisation processes. Drawing on a case study on the Pacific coast of Colombia, we demonstrate that Afro-descendant communities hold local aquatic epistemologies, in which knowledge and the production of space are entangled in fluid and volumetric spatio-temporal dynamics. However, despite the social importance of aquatic environments, they were excluded from Afro-descendants’ collective territorial rights in the 1990s. Driven by their local aquatic epistemologies, coastal communities are reclaiming authority over the seascape through the creation of a marine protected area.We argue that they have transformed relations of authority at sea to ensure local access and control, using state institutional instruments to subvert and challenge the legal framing of the sea as an open access public good. As such, this marine protected area represents a place of resistance that ironically subjects coastal communities to disciplinary technologies of conservation.","In this paper, a case study on the Pacific coast of Colombia demonstrates that Afro-descendant communities hold local aquatic epistemologies, in which knowledge and the production of space are entangled in fluid and volumetric spatio-temporal dynamics."
"Regulating oceanic imaginaries: the legal construction of space, identities, relations and epistemological hierarchies within marine spatial planning","https://scispace.com/paper/regulating-oceanic-imaginaries-the-legal-construction-of-35yw5gxxbk","2020","Journal Article","Maritime Studies","Maria Ntona
Mika Schröder","10.1007/S40152-020-00163-5","https://scispace.com/pdf/regulating-oceanic-imaginaries-the-legal-construction-of-35yw5gxxbk.pdf","A growing body of critical social-scientific scholarship addresses the implications of marine spatial planning for those who depend on the ocean for their livelihood, sustenance, well-being and cultural survival. Of particular concern are planning initiatives that construct marine space in ways that negate or contradict its particular materiality, the latter holding great significance for how different actors relate to the ocean. In response, scholars are turning towards relational conceptualisations of marine space, focusing on the relationships between human and non-human actors, as well as the factors that mediate them. Here, we argue that legal geography, a strand of interdisciplinary research that explores how space, law and society are co-constituted, can make a valuable contribution to this discussion. In taking seriously the connections between the themes law as discourse, law as representation and law as power, legal geography offers a deeper understanding of the subjectivities, narratives and sources of normativity made in/visible by the legal dimensions of planning frameworks. Using the legal-geographical concept of spatial justice as our frame of reference, we posit that the relational materiality of the ocean lends itself to the socio-legal construction of marine spaces as ‘commons’, i.e. as pluralist spaces where different knowledges and ways of being coexist and intermingle, and where well-being is perceived in composite, socio-natural terms. This allows us to problematise marine spatial planning, along with its normative, regulatory and institutional underpinnings, as a vehicle for the enclosure of not only marine spaces but also spaces of decision-making.","In this article, the authors argue that the relational materiality of the ocean lends itself to the socio-legal construction of marine spaces as commons, i.e. as pluralist spaces where different knowledges and ways of being coexist and intermingle, and where wellbeing is perceived in composite, socio-natural terms."
"Ocean and Human Health in the Blue Era, Indian Ocean and African Perspectives","https://scispace.com/paper/ocean-and-human-health-in-the-blue-era-indian-ocean-and-24lmiqnf","2023","Journal Article","Journal of Indian Ocean world studies","Rosabelle Boswell","10.26443/jiows.v6i2.142","","
 
 
In this article, I discuss the fact that human-ocean relations are increasingly being scrutinized, as scholars seek to frame, understand and mitigate the impacts of climate change on Earth. I propose that for the southwest Indian Ocean that scholars follow Chimamanda Adichie’s directive to critique ‘single stories’ by considering locally produced, embodied, sensorial relations of indigenous peoples and local communities (IPLCs) to the sea and coasts, as well as the role that such relations might play in shaping health. I add that such relations cultivate a ‘blue’ consciousness and a nascent ‘blue’ rights – borne of symbioses between humans and ocean. I add that these advance a holistic and integrated human and ocean health. The discussion makes the case for the re-placement of globalized paradigms of climate change and for the inclusion of locally generated narratives of human relations with the sea. I posit that a more careful analysis of coastal and oceanic (intangible cultural) heritages can reveal transmaterial, interspecies relations with the sea. Drawing on anthropological research in the Southwest Indian Ocean World (SWIOW) and then in coastal South Africa, I argue that such narratives can herald not only a notion of global blue rights, they can also herald, from the ‘periphery’, a blue era where there is deeper consideration of sustainable human relations with the sea. 
 
 
","In this article , the authors discuss the fact that human-ocean relations are increasingly being scrutinized, as scholars seek to frame, understand and mitigate the impacts of climate change on Earth, and propose that for the southwest Indian Ocean that scholars follow Chimamanda Adichie's directive to critique single stories by considering locally produced, embodied, sensorial relations of indigenous peoples and local communities to the sea and coasts, as well as the role that such relations might play in shaping health."
