"Paper Title","Paper Link","Publication Year","Publication Type","Publication Title","Author Names","DOI","PDF Link","Abstract","Relevant Excerpt"
"Market Initiatives of Small-Scale Fisheries in the Mediterranean: Innovation in Support of Sustainable Blue Economy","https://scispace.com/paper/market-initiatives-of-small-scale-fisheries-in-the-2bec5vm2","2023","Book Chapter","","Begmuradov Shokhzod Dilmurod o'g'li, Nurmatov Kamol Jurakulovich","10.1007/978-3-031-20740-2_16","https://scispace.com/pdf/market-initiatives-of-small-scale-fisheries-in-the-2bec5vm2.pdf","Abstract The study of traditional marine stakeholders, such as small-scale fishers in the Mediterranean, represents a site of a changing seascape. This is characterized by impeding factors of the past but also a possibility for improved future trajectories. Small-scale fisheries (SSF) have played a crucial socio-economic role in the Mediterranean for decades, and they continue to comprise over 80% of the fishing fleets and provide direct and indirect economic contributions to coastal communities. Their contribution to blue economy has so far been described as low, but this is largely due to a narrow conception both of benefits to be drawn from the development of maritime sectors (which have focused strongly on economic growth) and types of innovation that are capable of supporting the transition to sustainability (which have overlooked social innovation). This chapter outlines the multi-scale contributions of the small-scale fisheries and presents innovative approaches of the sector towards the markets, both of which support the inclusion of SSF in the blue economy sector. The chapter focuses on key instances of recently developed initiatives by the SSF across the Mediterranean with impacts on the supply chain and the marketing of their products. We argue that these market interventions contribute to the ultimate governance objectives, and challenge the conception of SSF as a non-innovative sector. We propose that a richer engagement with the blue economy paradigm supports the perception of the SSF as a prospective sector, to match the promotion of aquaculture among others. ","Mediterranean (UfM 2015). As such, we suggest to consider the blue economy policy paradigm, especially when it is embedded in the overarching goal of sustainability, as conducive to the needed policy transformations and a more prosperous future of the SSF. Conclusion:
 The conceptual re-framing of the blue economy from a threat on SSF to an opportunity allows us to depart from the complaints over the lack of attention of existing policy priorities on the SSF and instead highlight concrete actions and activities by SSF that are both innovative and sustainable. By recognising the recent SSF market initiatives as valuable, we can also identify the points of entry for adequate governance interventions. For such initiatives to scale-up and multiply, active engagement is needed in form of stimulating networking, learning and capacity building. Targeted policy measures (public campaigns for promotion and valorisation of localised, artisanal and small-scale production, tax incentivisation, increase in funding dedicated to starting-up and scaling-up), can also be beneficial for the development of these positive SSF activities , alongside an acceleration of the policy process dedicated to improving access to resource of the SSF . Finally, better coordination among the existing initiatives regarding marketing innovation and capitalization on various, unconnected efforts would result in a stronger voice of this traditional sea-centred activity and its role in the future of oceans. Conclusion:
 Open Access This chapter is licensed under the terms of the Creative Commons Attribution 4.0 International License (http://creativecommons.org/licenses/by/4.0/), which permits use, sharing, adaptation, distribution and reproduction in any medium or format, as long as you give appropriate credit to the original author(s) and the source, provide a link to the Creative Commons license and indicate if changes were made. Conclusion:
 The images or other third party material in this chapter are included in the chapter's Creative Commons license, unless indicated otherwise in a credit line to the material. If material is not included in the chapter's Creative Commons license and your intended use is not permitted by statutory regulation or exceeds the permitted use, you will need to obtain permission directly from the copyright holder."
"Portugal and the Constitution for the Ocean: The united nations convention on the law of the sea 40 years later","https://scispace.com/paper/portugal-and-the-constitution-for-the-ocean-the-united-29qy2fzih3","2023","Journal Article","","Mateus Kowalski
João Gil Antunes","10.26619/978-989-9002-26-5","https://scispace.compdf/portugal-and-the-constitution-for-the-ocean-the-united-29qy2fzih3.pdf","","part of the paradigm of the economic component of the Green Deal. A. Introduction: It is a paradigm associated with sustainable development and inspires optimism for a new use of the oceans. It was included into the definition of the United Nations Sustainable Development Goals. A. Introduction:
 Goal 14, Life Underwater, calls for (i) significant reductions in marine pollution; (ii) combating ocean acidification; (iii) sustainable management of marine resources; (iv) expanding scientific knowledge; and (v) transferring marine technology to developing countries, especially small island developing States.  Since the Rio+20 Summit, the various actors interested in this economic sector have emphasized the growth potential of the oceans, believing it to be below its possibility. A. Introduction:
 At the same time, they have reiterated the importance of the ocean in the overall context of the global economy. The ocean is portrayed as the world's seventh economy based on the analogy that the oceans' annual gross marine product is equivalent to a country's annual GDP. CHAPTER 11 | A SEMIOTICS OF BLUE ECONOMY:
 While the concept of Sea Economy or Ocean Economy is defined by the OECD as the sum of economic activities of ocean-based industries,  the consolidation of the concept of Blue Economy is to be associated with the sustainable use of resources and the environment through the potential installation of new productive industries-energy, aquaculture, and environmental tourism-that complement or replace extractive practices. CHAPTER 11 | A SEMIOTICS OF BLUE ECONOMY:
 However, this also means that disputes over multiple and overlapping uses of the ocean's marine environments could increase. CHAPTER 11 | A SEMIOTICS OF BLUE ECONOMY:
 Nowadays, we are confronted with a wide range of derivations reflecting the plethora of debates and actors, e.g., Blue Revolution,  Blue Energies, Blue Tourism, Blue Carbon,  Blue Finance and Blue Bonds,  Blue Bioeconomy and Blue Biotech, Blue Justice,  Blue Food,  and Blue Mining. CHAPTER 11 | A SEMIOTICS OF BLUE ECONOMY:
 There are so many terms that one can get lost among them. However, it is understood that there are standards that differentiate the Ocean Economy (or Sea Economy) from the Blue Economy. The standards relate to the sustainability of activities and the positive or negative impact on climate, biodiversity, etc. CHAPTER 11 | A SEMIOTICS OF BLUE ECONOMY:
 In a wide range of sectors, activities and interests, it is easy to get lured by blue washing. Therefore, I cannot help but reflect on these dualities and dissonances. CHAPTER 11 | A SEMIOTICS OF BLUE ECONOMY:
 In the context of the Blue Economy paradigm, the debate around the concept of Blue Growth began-and gained particular weight-in the European Union and other associated European countries, particularly Norway and Iceland. CHAPTER 11 | A SEMIOTICS OF BLUE ECONOMY:
 In my transition from science to politics, perhaps one of the topics that stood out most, full of dissonances, was the discourse on the promises and opportunities for the economy based on the parallel paradigm of Blue Growth."
"Mobilizing Investors for Blue Growth","https://scispace.com/paper/mobilizing-investors-for-blue-growth-gua4wibmww","2017","Journal Article","Frontiers in Marine Science","Sander van den Burg
Marian Stuiver
B.C. Bolman
Roland Wijnen
T. Selnes
Gordon Dalton","10.3389/FMARS.2016.00291","https://scispace.com/pdf/mobilizing-investors-for-blue-growth-gua4wibmww.pdf","The European Union’s Blue Growth Strategy is a long term strategy to support sustainable growth in the marine and maritime sectors, aiming to contribute to innovation and economic growth (European Commission, 2012). The EU sees the financial sector as a key partner to bring about transition to sustainable consumption and production. However, knowledge about investment behaviour, experience with working with these investors and ways to engage investors in the Blue Growth sectors is lacking. This paper examines this knowledge gap. It characterizes investors and identifies investor behaviour, investors’ motives and conditions and criteria relevant for investors to invest in Blue Growth sectors. The presented results are derived from a literature study on investors and investment behaviour, an electronic survey and in-depth interviews. Stereotypical images of private equity bankers or wealthy individuals do not do justice to the diversity of investors involved in the Blue Growth sectors. These sectors are still in development and various risks reduce the willingness to invest. Risk mitigation should be seen as a shared responsibility of entrepreneurs, investors and governments. Government support must go further than financial support for research and development or technological demonstration projects. Proven technologies get stuck in the Valley of Death as investors alone are not willing to take the risk associated with upscaling of promising technologies. Tied in a reciprocal relationship, governments need to attract private investors – their capital, knowledge and networks – to further grow of the Blue Growth sectors while investors need stable, predictable and effective government support schemes to mitigate their financial risks.","Burg (Corresponding Author),Marian Stuiver,Bas C Bolman,Roland Wijnen,Trond Selnes,Gordon Dalton Keywords: EU policy, blue growth, investors, investment theory, offshore wind, aquaculture INTRODUCTION:
 The Limassol declaration on a Maritime Agenda for Growth and jobs, endorsed in October 2012 by European Ministers for Maritime Affairs, aims at creating sustainable economic growth, and employment in the marine and maritime economy to facilitate Europe's economic recovery . The European Blue Growth Strategy is presented as a long term strategy to support sustainable growth in the marine and maritime sectors as a whole and recognizes that seas and oceans are drivers for the European economy with great potential for innovation and growth . It seeks to stimulate smart, sustainable, and inclusive economic and employment growth from the oceans, seas, and coasts. INTRODUCTION:
 As mankind exceeds some of Earth's planetary boundaries, human impact threatens to push Earth into a new state . Climate change, biodiversity loss, and deteriorating ecosystems are only some of the reasons why a change to sustainable consumption and production is necessary. Increasingly, policy-makers and civil society turn to the financial sector as a key factor in bringing about this change. This is not only the case in the maritime domain but also in protection of nature  and climate change policies . INTRODUCTION:
 Blue growth represents a new and ambitious vision and strategy for more and better investments in the ocean economy. It is propagated by the European Commission  and has found its way into the international arena (see for example OECD, 2016) 2 . The underlying promise of Blue Growth is that it stimulates economic development-increasing jobs and incomes-while securing sustainable management of the marine resources . INTRODUCTION:
 Currently, the ""blue"" economy represents 5.4 million jobs and a gross added value of just under e 500 billion a year . The ""Blue Growth"" initiative aims to expand the maritime dimension of the Europe 2020 strategy. The Blue Growth strategy recognizes the importance of existing economic sectors such as shipbuilding & repair, transport, fisheries, and offshore oil & gas. At the same time, Blue Growth points to the potential of five emergent economic activities: aquaculture, coastal, and maritime tourism, marine biotechnology, ocean energy, and sea bed mining . INTRODUCTION:
 Bringing about Blue Growth requires major changes in the way both public and private act regarding these ambitions. It requires new ideas, concepts, policies, technologies, and business models. To this end, various governance strategies have been deployed, with emphasis on knowledge generation-through the Horizon 2020 Blue Growth calls-and networking . INTRODUCTION:
 Fulfilling the potential of Blue Growth requires the upscaling of innovative practices to full commercial scale as well as growth to mature economic sectors. This requires more than knowledge and networks, it also requires financial impulses by investors. Attracting private investors is therefore of paramount importance to implementation of the new Blue Growth strategy. Public investments in research and start-ups are not sufficient in this new road to a sustainable future, with new ideas easily ending up in de Valley of Death . In the Valley of Death, start-up firms die off because private investors are not willing to invest in companies without a steady stream of revenues."
"The blue economy's retreat from equity: A decade under global negotiation","https://scispace.com/paper/the-blue-economy-s-retreat-from-equity-a-decade-under-global-2gohem1c","2022","Journal Article","Frontiers in political science","Philippa Louey","10.3389/fpos.2022.999571","https://scispace.com/pdf/the-blue-economy-s-retreat-from-equity-a-decade-under-global-2gohem1c.pdf","Heralded as a key agenda for sustainable ocean development, the blue economy has risen to such prominence over the last decade that it is near impossible to engage in the fields of ocean governance or development without encountering it. The exact nature of the blue economy's sustainable ocean development promise, however, remains stubbornly unresolved, with different actors advancing varying, at times conflicting, visions of what sustainable ocean development should look like, how it is to be achieved, and who it is to serve. Tracing the various constructions of blue economy promises over the last decade, this paper contends that the blue economy has progressively retreated from its early commitment to equitable benefit sharing, shifting instead to a deepening preoccupation with economic growth. For small island developing states (SIDS) and coastal least developed countries (LDCs) who took a leading role in embedding equitable benefit sharing within the blue economy during its early popularization, such retreat raises pressing questions over the agenda's continued suitability in advancing desired (and often much needed) sustainable development outcomes. This paper's attempt to grapple with such questions offers a timely contribution to discussions on the blue recovery and ocean-led development avenues in the wake of COVID-19.","decade under global negotiation Authors: Maree E Fudge,Marc Jacquinet,Nathan J Bennett,Philippa Louey (Corresponding Author) Keywords: blue economy, equity, small island developing states, equitable benefit sharing, sustainable ocean development Introduction:
 Heralded as a key agenda for the achievement of sustainable ocean development, the blue economy has risen to such prominence over the last decade that it is near impossible to engage in the fields of ocean governance or development without encountering it. Broadly defined, the blue economy represents a vision for sustainable ocean development that promotes, and seeks to balance, economic growth, social inclusion and livelihoods, and the environmental sustainability of oceans and coastal areas . Its promise of an environmentally sustainable and socially inclusive intensification of ocean industries has attracted widespread interest from governments, civil society, commerce, intergovernmental organizations and development agencies alike-providing a central rallying point around which these diverse agents can build coalitions in their attempts to address the interrelated challenges of degrading ocean health, climate change and seemingly ever-growing resource demands . Introduction:
 As noted consistently throughout the literature, however, the exact nature of the blue economy's sustainable ocean development promise remains stubbornly unresolved, with different actors advancing varying, at times conflicting, visions of what sustainable ocean development should look like, how it is to be achieved, and who it is to serve . Silver et al. seminal study  provided the first insight into these competing interpretations of the blue economy's sustainable ocean development promise, identifying four distinct discourses at the 2012 UN Conference on Sustainable Development (Rio+20) where the agenda was first introduced to global audiences. 3 years later,  analysis of international policy documents uncovered a similarly diverse body of blue economy discourses and sustainable ocean development interpretations, suggesting that little coherence had been achieved over the 6 years since Rio+20 and few conflicts resolved. As of today, the blue economy remains unsettled, with a growing crowd of agents drawing on, and arguably contorting, the agenda's promise of sustainable ocean development to align with their various interests. Introduction:
 Such acknowledgment of the blue economy's nebulous nature provides the basis for this paper's inquiry into the evolution of blue economy promises over the last decade. By tracing the various constructions of blue economy promises within mainstream global discourses, this paper contends that patterns can be observed in the agenda's 10-year career which, when read together, detail a narrative of retreating equity and a deepening preoccupation with economic growth. Critically, this paper understands the blue economy as a socially embedded agenda that can only be adequately analyzed and understood in the context of its various socio-historical settings . This encourages an analysis of the broader socio-political ecosystems within which the blue economy and various promises have been articulated, ultimately situating it in the longer histories of sustainable development, modern geopolitics and neoliberalism."
"Toward a blue economy: a pathway for Bangladesh’s sustainable growth","https://scispace.com/paper/toward-a-blue-economy-a-pathway-for-bangladesh-s-sustainable-2i7pc0sevn","2018","","","Pawan G. Patil
John Virdin
Charles S. Colgan
M.G. Hussain
Pierre Failler
Tibor Vegh","","https://scispace.com/pdf/toward-a-blue-economy-a-pathway-for-bangladesh-s-sustainable-2i7pc0sevn.pdf","","ecosystems are inputs), but provides no measure or indication of the environmental sustainability of these activities. Using the metaphor of colors, an unsustainable ocean economy could be considered as ""brown"", while a sustainable one as ""blue"", or somewhere between the two. 38.:
 At the same time, some organizations have also emphasized the social dimensions of an ocean economy in their definitions of a blue economy, following the three dimensions of the concept of sustainable development. For example, FAO (2014) has promoted the concept of a blue economy as a ""coherent approach for the sustainable, integrated and socio-economically sensitive management of oceans and wetlands, focusing on capture fisheries, aquaculture, ecosystem services, trade and social protection of coastal communities."" 39.:
 Similar to the definitions proposed by the EIU (2015) and the World Bank (2017), and reflecting the social dimensions of sustainable development emphasized by , the Government of Bangladesh defines the blue economy concept as a sustainable pathway forward for growth of the ocean economy (as opposed to a less sustainable or ""brown"" pathway), as shown in Box 3 below. 40.:
 In order to establish a common denominator between the international definitions of the blue economy concept and the definition in Bangladesh, a blue economy is defined here simply as sustainable development of the ocean economy. Given the status of ocean ecosystems, the challenges of ensuring that an ocean economy stays or becomes ""blue"" are formidable for many countries, but particularly for developing coastal and island states such as Bangladesh where the Box 3. The Government of Bangladesh's Definition of the Blue Economy Concept ""Blue Economy comprises activities that directly or indirectly take place in the seas, oceans and coasts using oceanic resources and eventually contributing to sustainable, inclusive economic growth, employment, wellbeing, while preserving the health of ocean. It includes activities such as exploration and development of marine resources, appropriate use of ocean and coastal space, use of ocean products, provision of goods and services to support ocean activities and protection of ocean environment. The Blue economy approach emphasizes that ideas, principles  norms of Blue Economy lend significant contribution[s] towards eradication of poverty, contributing to food and nutrition security, mitigation and adaptation of climate change and generation of sustainable and inclusive livelihoods. It is needless to say that for most developing States particularly for Bangladesh, making [the] transition to [a] Blue Economy would entail fundamental and systemic changes in their policy-regulatory-management-governance framework(s) and identification of various maritime economic functions."" ""The Blue Economy conceptualizes oceans and seas as ""Development Spaces"" where spatial planning integrates conservation, sustainable use of living resources, oil and mineral wealth extraction, bio-prospecting, sustainable energy production and marine transport. The Blue Economy approach is founded upon the assessment and incorporation of the real value of the natural (blue) capital into all aspects of economic activity (conceptualization, planning, infrastructure development, trade, travel, renewable resource exploitation, energy production/consumption). Thus Blue Economy requires a balanced approach between conservation, development and utilization of marine and coastal eco-systems, all oceanic resources and services with a view to enhancing their value and generates decent employment, secure productive marine economy and healthy marine eco-systems."""
