"Paper Title","Paper Link","Publication Year","Publication Type","Publication Title","Author Names","DOI","PDF Link","Abstract","Relevant Excerpt"
"Managerial technologies and power relations: a study of the Australian waterfront","https://scispace.com/paper/managerial-technologies-and-power-relations-a-study-of-the-2qd91kc8ku","2013","Journal Article","New Technology Work and Employment","Victor Gekara
Peter Fairbrother","10.1111/NTWE.12003","https://scispace.com/pdf/managerial-technologies-and-power-relations-a-study-of-the-2qd91kc8ku.pdf","In recent times, the modern port has been characterised by rapid changes in work technologies and the consolidation of logistics functions. These changes signify an important recomposition of the port labour process and raise questions about the strategic location of frontline manual jobs. This research examines how these changes have played out in the Australian ports industry, developing the argument that a depersonalised managerial form of control is emerging with potentially challenging consequences for worker solidarity and collective organisation. The argument is that relations between port management and workers have changed significantly, with a reconfiguration of job roles, skill compositions and thus workplace power relations. It is informed by qualitative research at two Australian ports, exploring the organisation of work and the impact of recent technologies.","heavily unionised front-yard workforce. By promoting depersonalised management systems they have prompted the reconfiguration of the workforce, creating a layer of staff who are in effect located in ambiguous class positions, neither unequivocally managers qua supervisors or workers. The Reconfiguration of Worker Power:
 Nonetheless these new roles are operationally strategic, critical to the operation of the port terminal . However, there is no evidence that this new layer of workers have begun to leverage their work positions in terms of industrial bargaining. Whether they come to exercise this capacity is yet to be seen and will depend not only on their commitment to the exercise of associational power but also whether the scepticism of other union members can be countered. Conclusion:
 The analysis highlights the ways in which the implementation of new managerial technologies in port work at Australian container terminals has impacted the port labour process. Such developments have implications for waterfront power relations. Thus, one conclusion is that there has been a significant reconfiguration of the labour process with regard to who does what and from what location, with a concurrent shift in the balance of power on Australia's waterfront, reinforcing  about the impacts of new technologies on waterfront workers' power. Conclusion:
 Clearly, the outcome of the re-composition of the port labour process is a more complex set of power relationships, which has profound implications for the exercise of managerial authority as well as the capacity of unions to organise and operate. For management, this re-composition suggests that they will seek continued control of work and the labour process by use of new technologies; while for workers, such developments may undermine established ways of exercising collective power; unions may have to extend their prevailing forms of collective organisation, so that they have the capacity to exercise the possibilities that may derive from the restructuring of power relations . Conclusion:
 A second conclusion is that unions organising in the ports face major challenges in how to keep members committed to union ideals in relation to a reconfigured port workforce. The predominantly manual labour force at the waterfront has been scaled down and is increasingly replaced by a more diversified group of workers, some of whom have been trained in the uses of these technologies, others who are responsible for data collection and management, and yet others who implement and commission these systems. These employees occupy ambiguous class positions, between and beyond the clear-cut demarcation between operators and supervisors of the past . Moreover, sections of these new social groupings no longer enter port work in traditional ways; many no longer move from manual to non-manual labour within the organisation. The latter possesses little, if any, connection to the manual work at the yard, on the basis of which workplace solidarity was built and sustained in the past. Conclusion:
 Although port workers historically have been well placed to defend and even advance their interests at both the national and international levels (in spite of the changing nature of their workplace) the new technology-driven transformations could be undermining these capacities ; see also . The challenge is twofold: first how to maintain a strong union presence at the docks in the face of new managerial strategies and technologies, which incrementally undermine the core of dockside solidarity -manual labour, and second, how to sustain its capacity to defend its members in the face of a shift in the configuration of organisational and political resources."
"Protective security at sea: a counter terrorism framework for cruise and passenger ships","https://scispace.com/paper/protective-security-at-sea-a-counter-terrorism-framework-for-28nvh350","2023","Journal Article","WMU journal of maritime affairs","Kristen Kuhn
David McIlhatton
James A. Malcolm
Ioannis Chapsos","10.1007/s13437-022-00296-w","https://scispace.com/pdf/protective-security-at-sea-a-counter-terrorism-framework-for-28nvh350.pdf","In the present context of global terrorism, managing protective security in cruise and passenger ships is a challenge for organisations. This is due, in part, to the distinct lack of a counter terrorism framework for the industry. To address this gap, this paper develops a counter terrorism framework for cruise and passenger ships. This framework identifies protective security components and terrorist threats based on known attacks. It provides stakeholders with a means to assess risk, both in terms of likelihood and wider organisational impact. From an operational security perspective, the contribution of the framework is threefold: First, it offers a consistent approach to delivering an effective protective security posture at all stages of a ship’s itinerary. Second, it is envisaged that the application of the framework will improve security decision-making within organisations. Third, improved organisational security may, over time, enhance deterrence. ","approach to delivering an e↵ective protective security posture at all stages of a ship's itinerary. It is envisaged that the application of the framework will improve security decision-making within organisations which, over time, has the potential to enhance deterrence. Conclusion:
 Looking forward, it is important that the framework is trialled in di↵erent contexts to ensure it is transferable. Further, industry stakeholders should be engaged in ways that are sensitive to their interests, needs and capabilities. In this way, the framework can be validated and then operationalised by industry stakeholders, at which point measures of e↵ectivity can be established to guide evaluation. We aspire that this framework, once validated, may be sit alongside existing requirements on vessels and ports that stem from regulatory frameworks such as the ISPS Code . Emphasis needs to be placed on laying out the benefits of recognising core components to protective security for added consistency, whilst keeping open the space for sharing experiences and innovation in relation to specific policies and practices implemented. Here, more work is needed to bring together land and maritime focused practitioners, the public and private sector, and to explore any grey areas brought about by questions of jurisdiction and maritime law. For researchers interested in this subject, refinement of this framework through its deployment in relation to di↵erent cruise and passenger ship routes globally, where varied protective security governance exist, is a clear avenue for future research."
"Labour Market, Work Mentality and Syndicalism: Dock Labour in the United States and Hamburg, 1900–1950s","https://scispace.com/paper/labour-market-work-mentality-and-syndicalism-dock-labour-in-4aa01p4oj5","1997","Journal Article","International Review of Social History","Klaus Weinhauer","10.1017/S0020859000114890","https://scispace.com/pdf/labour-market-work-mentality-and-syndicalism-dock-labour-in-4aa01p4oj5.pdf","This international comparison firstly examines labour market organization, casual labour and work mentality in North American seaports and in Hamburg. By contrast to British ports, these ports finally dispensed with casual labour between the world economic crisis and the Second World War, and labour markets there were centralized. Secondly, the industrial militancy of mobile dockworkers without permanent jobs is examined through a consideration of syndicalist organizations (1919–1921), and interpreted as an interplay of experiences with power in the network of labour market, workplace and docklands. The study refers repeatedly to the decisive dividing line between regularly and irregularly employed dockworkers. National differences in trade union representation and dispute behaviour are analysed by reference to dockworkers' direct actions.","particular company. Since they had no regular job to lose and could not be punished by a permanent dismissal, they were in a position to achieve immediate successes directly on the job and on the labour market by these means whenever the labour-market conditions were favourable. CONCLUSION:
 However, nationally differing forms of dispute were concealed under the umbrella term of direct actions, which are to be seen as forms of industrial action without primarily political aims. In US ports these were the job actions that aimed at gaining influence on working conditions. As could be shown both for Hamburg (from summer 1919 until around the spring of 1921) and for San Francisco (1934-1938) it was only under special conditions that these took on a political thrust going beyond work and labour-market concerns. The decisive factor was a highly developed feeling of collective strength, which in both cases had become politicized through successful major labour struggles with the accompanying shared experiences of state repression. Considering the traditions of the German labour movement with its exclusion of workplace-related demands, it is obvious that the years 1919-1920 formed an exception on two counts. First, this period marks a hitherto unknown flourishing of syndicalist organizations. Second, during these years it was the irregularly employed dockers in particular who formulated a far-reaching claim to power in the workplace. Both factors were based on extraordinary experiences of power in the network of workplace, labour market and harbour districts. CONCLUSION:
 Finally, the question should be raised whether the contrast between qualified and unqualified or skilled and unskilled workers should not similarly be abandoned in the analysis of the trade union organization and the dispute behaviour of other trades. For the dockworkers analysed here, at least, it has proved more productive, locally and from an international perspective, to analyse working conditions and labour-market conditions more precisely using the questions listed at the outset. Consideration of the rotational hiring introduced in the US West Coast ports in 1934 under trade union control has led to a differentiation of this set of questions: the mobility of the irregular dockworkers, with its potential for increased conflict, could be reduced not only through links to particular companies, but also through commitment to a union-promoted work ethos that every job should be carried out properly to union standards. CONCLUSION:
 Overall, then, it should also have become clear how important it is for labour history to investigate the organization of the labour market and to analyse what norms and values became predominant in it and how these affected the work ethos of the relevant workers. A consideration of working conditions alone would have presented a misleadingly static picture in the case of the dockworkers. It remains to be examined in further studies whether and to what extent the interaction of labour market, workplace, work mentality and housing district discussed here with reference to the syndicalist organizations will lead to further advances in understand-ing for other aspects of dockworkers' militancy (for other organizations and industrial disputes). However, even a broad-based socio-historical analysis of this kind can only delimit the structural conditions for the conduct of disputes and the organizational behaviour of various groups of dockworkers. More precise conclusions will become possible only when the modes of behaviour of the people in this network are reconstructed in concrete historical situations."
"Structural changes in ports and the competitiveness of Latin American and Caribbean foreign trade","https://scispace.com/paper/structural-changes-in-ports-and-the-competitiveness-of-latin-5f7lp2dd7l","1990","","","Nu. Cepal. División de Transporte y Comunicaciones","","https://scispace.com/pdf/structural-changes-in-ports-and-the-competitiveness-of-latin-5f7lp2dd7l.pdf","","roles in that new environment. These contrasting messages indicate the breadth of the problems involved in the modernization and integration of port services. Of the many changes required to achieve those goals, the most important encompass numerous i) institutional and ii) operational considerations. Organizational structures:
 A wide range of enterprises and institutions carry out their activities to support trade flows at ports. Each institution and enterprise has its own organizational structure. For example, dock workers, Customs administrations, freight forwarders. Customs brokers, banks, insurance companies and carriers operate with different unions, contractual arrangements, government regulations and international conventions. Ports must organize this complexity, but organized complexity does not imply efficiency, cost-effectiveness nor productivity. As is often the case, the organizational structure of a port is not an optimal choice, but rather a reflection of the structures of all those providing services at its facilities. Organizational structures:
 If this diversity were not enough, most Latin American and Caribbean ports have extensive socio-political responsibilities. Political leaders may see the port as a means to create a constituency, absorb unemployment and assign prominent positions to major supporters. If uncontrolled, these socio-political responsibilities can become part of such an enormous network of benefits, cross-subsidies and welfare that the possibility of a port operating on a commercial basis is placed at risk. Just as increasing inflation drives funds towards ever shorter term investments and pubHc-sector financing crowds out that from the private sector, port policies with demanding socio-political objectives can limit and even preclude a port's capacity to support trade flows in a cost-effective manner. There will always be competing needs for scarce port resources, but they will be able to provide greater benefits to a nation as a whole if operated as business entities with socio-political responsibilities which are both defined and limited. Organizational structures:
 Generally, Latin American and Caribbean liquid-and dry-bulk ports are controlled by the private sector, while general cargo ports are government-owned and operated. Most public sector ports have complex organizational structures which are shared with government and private sector groups. As illustrations of this point, in Argentina there a six ministries and 18 state agencies involved in port activities. In addition, there are 10 unions representing different groups of workers. For its part, the port of Veracruz (Mexico) must renegotiate dock worker wage rates with seven port labor unions each time the national minimum wage is increased, which occurs several times a year. This dense organizational arrangement is complicated even further by the existence in many ports of two parallel groups of port laborers, formal and informal. The formal group is represented by imions and employed by the port, and the informal group is utilized by their formal counterparts to replace them or to carry out certain heavy, dirty or undesirable tasks."
"Crafting an International Legal Regime for Worker Rights: Assessing the Literature since the 1999 Seattle WTO Protests","https://scispace.com/paper/crafting-an-international-legal-regime-for-worker-rights-3l4jnd1os7","2009","Journal Article","International Labor and Working-class History","John D. French
Kristin Wintersteen","10.1017/S0147547909000106","https://scispace.com/pdf/crafting-an-international-legal-regime-for-worker-rights-3l4jnd1os7.pdf","Since the fall of the Soviet Union in 1991, critical attention has increasingly focused on the remaining world system, capitalist in nature and anchored in the World Trade Organization (WTO), founded in 1994 as the successor to the 1948 General Agreement on Tariffs and Trade (GATT). As the 1990s progressed, a smattering of exciting new intellectual work began to appear on the social and environmental impacts of the international trade and investment regime, especially given its apparently negative impact on many developing countries and the world’s working people. “The distinction somewhat comfortably maintained by ‘trade hands’ who managed the post-World War II international economy––that trade is strictly a commercial function with no immediate connection to social concerns––has evaporated under the pressure of political and social forces generated by the globalization of the economy.” 1 These incipient currents of political disquiet, at first easily overlooked, would surface with surprising force in late 1999 when large and dramatic street protests confronted the WTO’s Third Ministerial Conference in Seattle. For the first time, a meeting of the mandarins of international trade was met with a massive and unruly expression of democracy in the streets. The Seattle events seized the world’s imagination in part because they were so unexpected in a thriving tradebased US city that was, at the time, the world headquarters of Boeing and Microsoft, giants of the “old” and “new” global economy, respectively. The labor issue even reverberated in the suites of the city, as government representatives debated the inclusion of worker rights in the agenda of the “Millennium Round” of international trade negotiations that was to have started in Seattle. 2 The Seattle protests heightened public and scholarly attention to proposals for social or worker rights clauses in international trade agreements, an issue that had briefly flared up at the 1994 GATT meeting in Marrakesh (though not in the streets). As the new millennium began, the labor question was part of a vital international policy debate that spoke to societal concerns felt well beyond the usual haunts of academic labor specialists. Indeed, the formation of the WTO, with near-universal membership, led a number of labor scholars, as early as 1996, to envisage new possibilities for promoting worker rights on a world scale. 3 Drawing on interdisciplinary reflections going back to the early twentieth century, this review essay offers a point of entry into the pitched debates about globalization, which peaked during the protest cycle","Norway, Russia, and the United Kingdom. Shipping vessels and their crews--stewards of human lives and valuable cargo--often operate precariously on the open seas, beyond the reach of national governments, trade unions, and environmental regulations. World Views in Conflict: Economists versus Lawyers:
 But this foreboding image of maritime shipping as a lawless, ""anythinggoes"" industry is all but overturned by a closer examination of the sector's complexities. At the global level the industry is by no means bereft of regulatory mechanisms, institutions, and structures; indeed, it is the only industry that maintains an internationally-set minimum wage. Two recent books by social scientists Elizabeth DeSombre (2006) and Nathan Lillie (2006) demonstrate the possibilities for social justice in the context of maritime shipping through international 154 ILWCH, 75, Spring 2009 negotiations and enforcement. In her study of environmental, safety, and labor standards in the industry, DeSombre examines international agreements on issues such as trade, working conditions, and pollution, as well as shifts in rates of registration among FOC states and port detention rates, to theorize about the systemic nature of regulatory dynamics. She concludes that the industry is characterized by a ""race to the regulatory middle""--not a race to the bottom, as much of the literature on globalization suggests--among flag states competing for registry revenues.  While certain FOC states tend to attract more registrants than industrialized states because of lower costs and lack of oversight, labor groups and port inspectors target the FOC vessels with the worst records. FOC states thus tend to make and enforce decisions that raise environmental, safety, and labor standards in order to avoid facing boycotts or detentions.  Those FOC states that choose not to raise standards, in turn, suffer disadvantages when competing with higher-standard ships in the global marketplace while new entrants take their places. The same balancing mechanism is at work among owner-run classification societies, since a ship's classification impacts its reputation (and thus competitiveness) in the industry, as well as insurance costs and the likelihood of being detained or targeted by labor actions. To DeSombre, globalization in this industry is a process with a ""constant and predictable evolution"" whereby low-standard FOC states tend to raise standards and the industrialized states are compelled to lower them in the face of marketplace competition.  Instead of continually descending toward the regulatory bottom, she argues, the system reaches equilibrium somewhere in between."
