"Paper Title","Paper Link","Publication Year","Publication Type","Publication Title","Author Names","DOI","PDF Link","Abstract","TL;DR"
"Global Maritime Flows and Local Implications: Conceptualising a Worldwide Taxonomy and Glossary of Port‐City‐Regions","https://scispace.com/paper/global-maritime-flows-and-local-implications-conceptualising-iegsj5ezusoh","2025","Journal Article","Ocean and Society","Mina Akhavan
Yvonne van Mil
Carola Hein","10.17645/oas.10067","","The dynamic interplay between global maritime flows and the spatial, economic, and social development of port‐city‐regions lies at the heart of this thematic issue. As globalisation accelerates, the relationships between ports, cities, and their surrounding regions become increasingly complex, requiring innovative conceptual frameworks, methodologies, and interdisciplinary collaborations to address both challenges and opportunities. Flows of goods and people shape infrastructural networks and create nodes of logistics and administration in and around nearby cities. They establish specific networks that primarily facilitate transport. Multiple approaches and definitions exist to describe and map these unique spaces. This thematic issue of Ocean and Society aims to advance our understanding of these phenomena by exploring a range of terminologies, typologies, spatial transformations, and examples of sustainable practices across diverse geographic contexts. ","This thematic issue explores the complex relationships between global maritime flows, port-city-regions, and their spatial, economic, and social development, proposing a worldwide taxonomy and glossary to advance understanding of these phenomena through interdisciplinary collaborations and sustainable practices."
"Coastal Cities and Environmental Change","https://scispace.com/paper/coastal-cities-and-environmental-change-4h1pdqb6mt","2014","Journal Article","Environment and History","Stephen Mosley","10.3197/096734014X14091313617280","https://scispace.com/pdf/coastal-cities-and-environmental-change-4h1pdqb6mt.pdf","This paper explores the complex environmental relationships of coastal cities with their shorelines and the sea. Cities developed in coastal locations because they offered easy access to fisheries, trade and commerce, transport, attractive scenery and recreational opportunities. However, coastal cities have also been vulnerable to the natural hazards of hurricane-force winds, tsunamis and tidal flooding; and climate change will exacerbate flood risks in the future. Many of the world's largest cities are situated by the sea, and today in every continent except North America the highest share of urban dwellers live in coastal zones. These issues, together with growing concerns over the state of the world's oceans - declining fish stocks, aquatic ecosystem degradation, and marine acidification - have attracted growing historical interest in coastal cities and their role in environmental change. Using examples of different types of coastal cities, I survey how growing urbanisation, trade, industrialisation and tourism impacted on shorelines and the sea over time. I also examine how communities have adapted to the challenges and risks of living in coastal cities. The paper concludes by offering some suggestions for further inquiry.","In this paper, the authors explore the complex environmental relationships of coastal cities with their shorelines and the sea, and examine how communities have adapted to the challenges and risks of living in coastal cities."
"Ocean Cities Network: Amplifying Local Voices and Fostering a Stronger Connection Between Coastal Communities and the Ocean","https://scispace.com/paper/ocean-cities-network-amplifying-local-voices-and-fostering-a-g5ia54iokha6","2025","Journal Article","","María Elena Carbajal
Marco Talone
Carine Simon
Josep Lluis Pelegri
Josep Lloret
Francesc Peters
Cristina Solé
Vanessa-Sarah Salvo","10.5194/oos2025-542","","The poster presents the Ocean Cities Network (OC-NET) program and its main event, Ocean Cities Month, an annual celebration launched in 2021 that takes place in various cities across the OC-NET network around the world and engages thousands of people each year. This event promotes connection and respect between coastal cities and the ocean. OC-NET encourages residents of these cities to recognize the crucial role the ocean plays in their lives, fostering a regenerative relationship that ranges from local activities to global collaboration networks. Ocean Cities Month serves as a platform for awareness and engagement, organized across three key areas: Citizen Science and Participation Campaigns, where citizens directly engage in protecting marine ecosystems, actively participating in ocean conservation, and acting as change agents within their communities. The second area focuses on exhibitions and performances designed to raise public awareness of the challenges facing the ocean. Through these activities, an emotional connection and understanding of the importance of caring for and preserving the ocean are fostered, bringing this environmental issue to a broader audience. The third area includes public communication campaigns and discussion forums, where OC-NET brings together citizens, experts, and political leaders to discuss coastal and marine challenges and develop collaborative and innovative solutions for sustainability that benefit both cities and marine ecosystems. OC-NET embraces the diversity of each coastal city as an essential part of its approach, recognizing that each community has a unique relationship with the ocean, shaped by its history and social, economic, and political context. Using participatory methods, OC-NET incorporates local voices to tailor Ocean Cities Month activities to the specific needs and strengths of each region, encouraging reflection on the connection between cities and the sea. Through research that combines natural and social sciences, OC-NET addresses the interdependence between human health and ocean health, underscoring the importance of effective ocean governance and sustainable marine resource management—vital for the quality of life, food security, and livelihoods of coastal communities. With active community involvement, the program promotes education and awareness about the importance of these ecosystems, fostering a global community that recognizes the ocean as a fundamental axis for its well-being and development. ","The Ocean Cities Network (OC-NET) fosters a regenerative relationship between coastal cities and the ocean through citizen engagement, awareness campaigns, and collaborative solutions, addressing the interdependence of human and ocean health for sustainable marine resource management and community well-being."
"The Management of Coastal Public Space in Large Euro-Mediterranean Cities. An Overview of French, Spanish and Italian Littoral Cases","https://scispace.com/paper/the-management-of-coastal-public-space-in-large-euro-vmx6rzrx29h2","2025","Journal Article","","Ivan Pistone
Antonio Acierno","10.20944/preprints202507.0385.v1","","Coastal urban areas play a strategic role in urban planning processes, as they are ideal contexts for implementing innovative transformative practices for communities. These areas are characterised by high population density and are subject to complex social, environmental and economic-productive dynamics that profoundly influence their evolution. Added to this is their significant landscape and functional value, which fuels expectations for development, making coastal areas the focus of growing interest from urban policies aimed at sustainability, resilience and integration between the anthropic dimension and natural systems. Waterfronts are configured as actual interfaces between the city and the sea, where fundamental assets for coastal community are juxtaposed, while needing appropriate planning to meet the complex needs of the users who enjoy them. The present contribution examines the approaches adopted by different cities in the Euro-Mediterranean basin in planning their city-sea interfaces in response to the socio-ecological challenges faced by urban coastal societies, particularly over the last five decades. Focusing on large coastal cities with more than half a million inhabitants, significant port infrastructure and rich cultural and historical attributes, the study aims to provide a comprehensive overview of coastal planning practices, examining whether they meet socio-environmental demands along the urban shore. ","This study examines coastal planning practices in large Euro-Mediterranean cities, focusing on French, Spanish, and Italian cases, to assess whether they meet socio-environmental demands and promote sustainability, resilience, and integration between urban and natural systems."
"The transformation of the oceans and the future of marine social science","https://scispace.com/paper/the-transformation-of-the-oceans-and-the-future-of-marine-tjj5e431yh","2018","Journal Article","Maritime Studies","Peter Arbo
Maaike Knol
Sebastian Linke
Kevin St. Martin","10.1007/S40152-018-0117-5","https://scispace.com/pdf/the-transformation-of-the-oceans-and-the-future-of-marine-tjj5e431yh.pdf","The oceans have become a juncture of great visions of blue growth as well as strong environmental concern. This paper discusses the essential role of the social sciences as the oceans increasingly emerge as a contested social arena. The marine social sciences have generated a vast knowledge about the development of fisheries and the implications of fisheries policies on coastal communities. We review this heritage and show that it makes the marine social sciences well qualified to address contemporary challenges raised by the increasing ambitions of exploiting and conserving the world’s oceans. However, with the current transformation of the oceans as sites of comprehensive industrialization, captured in the concept of blue growth, we argue that marine social scientists need to rethink their research objectives. This requires a reflection on the lessons learned from decades of engagement with fisheries and fisheries policy to understand and intervene in processes and practices of modernization, science-based management, and privatization of resources. We suggest how the marine social sciences can provide new knowledge and actively engage in current developments by studying emergent processes in the marine environment, and the institutions, practices, and discourses that shape them. The social sciences have a responsibility to contribute to growth and conservation issues, and are in the capacity to do so, through formulating governance alternatives, anticipating future trends, imagining desirable futures, and facilitating socially just processes and outcomes.","The marine social sciences have generated a vast knowledge about the development of fisheries and the implications of fisheries policies on coastal communities and are well qualified to address contemporary challenges raised by the increasing ambitions of exploiting and conserving the world's oceans as discussed by the authors."
"More than the sea: Review of different approaches to seascapes reveals unique transdisciplinary conceptualizations and contributions of archaeology","https://scispace.com/paper/more-than-the-sea-review-of-different-approaches-to-5f43nj60wnzs","2024","Journal Article","The Journal of Island and Coastal Archaeology","Ian J. McNiven","10.1080/15564894.2024.2411686","","Seascapes mean different things to different people and disciplines. Scholarship over the past 30 years has seen conceptualizations of seascapes move beyond dictionary definitions of seascapes as marine vistas to nuanced understandings of seas variously emphasizing their biological and cultural dimensions. Biological approaches (conservation) focus on marine ecosystems and management aimed at minimizing human impacts with cultural values increasingly acknowledged as critical to the success of marine protected areas. Cultural approaches (heritage, history, anthropology, and archaeology) focus on the symbolic dimensions of seas as culturally constructed and linked to maritime peoples and maritime cultures and identity. Maritime historians have sought to reposition the sea from a backdrop to history to an active and agentive historical actor. Maritime anthropologists have focused on cosmological and cultural underpinnings of customary maritime tenure by small-scale coastal communities. Maritime archaeologists have expanded their research scope from shipwrecks such that seascapes include maritime infrastructure on land. While interdisciplinarity underpins cultural approaches to seascapes, the transdisciplinarity of anthropologically and historically informed archaeologies allows cross-cultural conceptualization of seascapes as extending from the sea (marine seascapes) across adjacent lands (terrestrial seascapes) and ritual engagement with the sea as a sentient and animate realm and cosmologically constructed spiritscape. Ontological notions of sentient seas and agentive seascapes invite future seascape scholarship to further explore more authentic bottom-up, emic, mariners' and sea peoples' epistemological positions centering on ""how seas think"" and ""who is the ocean."" Such notions and positions provide enormous scope for archaeologists to further explore the marine and terrestrial expressions of seascapes given that maritime peoples' social and spiritual relationships with sentient seas are mediated materially by rituals involving sites (e.g., shrines) and objects (e.g., votives) both in the sea and on land. ","This review synthesizes diverse approaches to seascapes, highlighting transdisciplinary conceptualizations that integrate biological, cultural, and ontological perspectives, emphasizing the sea's agency and the importance of emic, mariner-centered epistemologies in understanding seascapes as sentient realms."
"El patrimonio cultural en entornos marítimos y su aporte al cumplimiento de los objetivos de desarrollo sostenible","https://scispace.com/paper/el-patrimonio-cultural-en-entornos-maritimos-y-su-aporte-al-2ai73810","2022","Journal Article","","","10.26640/cecoldo.articulo_00007","","La riqueza histórica y cultural que resguardan los espacios marítimos colombianos hace parte de una herencia prehispánica, colonial y republicana que tiene la capacidad de describir las formas de vida, los significados y saberes de nuestros mares. Su adecuada investigación y gestión tiene el potencial de incentivar el desarrollo social y el fortalecimiento de la identidad cultural de las comunidades costeras, impactando con ello el cumplimiento de algunos objetivos de desarrollo sostenible (ODS), incluidos aquellos que se centran en la educación de calidad, las ciudades sostenibles, el medio ambiente, el crecimiento económico, las pautas de consumo y producción sostenibles, entre otros. ","The riqueza histórica y cultural que resguardan los espacios marítimos colombianos hace parte de una herencia prehispánica, colonial and republicana que tiene la capacidad de describir las formas de vida, los significados y saberes de nuestros mares as mentioned in this paper ."
"The Shore as a Politicized Space for Community Heritage: The Case of Pra’, Genoa","https://scispace.com/paper/the-shore-as-a-politicized-space-for-community-heritage-the-3ltfu28lbp","2024","Journal Article","","Francesca Savoldi","10.58981/bluepapers.2024.1.15","","Changes in coastal and maritime environments, increasingly caused by the climate crisis and large infrastructural projects such as global port construction, significantly impact community identity. When a community’s terraqueous space – a space that transcends the land-sea binary distinction – suffers a shock, long-term sociability within the community and relationships with nature are altered. This article connects the challenges of coastal community spaces and the community’s cultural heritage by articulating a critical ontology of the shore. The connection is illustrated using the example of Pra’ in Genoa, where constructing a large port terminal has detached the local maritime community from the sea.","The Shore as a Politicized Space for Community Heritage explores the impact of changes in coastal environments on community identity and heritage. It argues that the loss of terraqueous space due to infrastructural projects disrupts long-term sociability and relationships with nature."
"Urban Blue Space and ""The Project of the Century"": Doing Justice on the Seattle Waterfront and for Local Residents","https://scispace.com/paper/urban-blue-space-and-the-project-of-the-century-doing-qm91syww6g","2014","Journal Article","Buildings","Anne Taufen Wessells","10.3390/BUILDINGS4040764","https://scispace.com/pdf/urban-blue-space-and-the-project-of-the-century-doing-qm91syww6g.pdf","Urban blue space is increasingly embraced by cities as a specific and valuable genre of public space, valued for its economic, symbolic and experiential place attributes and essential to sustainable urban development. This article takes up the concept of urban blue space from a design perspective, extending and exploring it through a critical social science lens. Using the reconfiguration and redesign of the central Seattle waterfront as a case example, the idea of “doing justice” is enlisted to examine not just the design opportunities and formal characteristics of the site, but also the patterns of privilege, access and regional socio-ecological equity that are raised through its redesign. After situating the extraordinary design opportunity presented by this iconic urban blue space, and the imperative to do justice to the waterfront’s physical situation, the article presents the site from four additional and discrete perspectives: economic justice, environmental justice, social justice and tribal justice. By thus foregrounding the urban political ecology of the waterfront, the article demonstrates that the most important challenge of the site’s redevelopment is not technological, financial or administrative, although these are real, and significant challenges, but rather, the need to construct a place that works to counter established patterns of local and regional injustice. In Seattle as in other coastal port cities, urban blue space is a shared public and environmental good, with unique and demanding governance responsibilities for its conceptualization and sustainable development.","In this paper, the authors take up the concept of urban blue space from a design perspective, extending and exploring it through a critical social science lens using the reconfiguration and redesign of the central Seattle waterfront as a case example."
"The Relevance of Nearshore Marine Space for Blue Economy Sustainability: A Bibliometric Analysis","https://scispace.com/paper/the-relevance-of-nearshore-marine-space-for-blue-economy-5mlk6m85mbf8","2025","Journal Article","Coastal Management","Sereno DuPrey Diederichsen
Marinez Eymael García Scherer
Tiago Borges Ribeiro Gandra
Javier García Sanabria","10.1080/08920753.2025.2452035","","The Blue Economy (BE) is increasingly seen as a field of new opportunities. Nearshore Marine Space (NMS) is understood as the area in opposition to offshore space, having a great deal of human activities. While historically significant and culturally valuable, NMS remains underappreciated within the BE context. This study employs bibliometric analysis to explore the key attributes of NMS critical for the sustainability of the BE. By analyzing (i) the social and ecological significance, (ii) spatial characteristics, (iii) the nature of human activities, and (iv) conservation strategies, we aim to stimulate a comprehensive discussion on enhancing BE sustainability through a focus on NMS. The review highlights the need to better address the diversity of human uses and their cumulative impact over marine and coastal ecosystems. Relevant features of the NMS included multiple human uses, terrestrial influence, and ecological value. Moreover, NMS plays a vital role for coastal communities and fishing, supporting cultural heritage, poverty alleviation, and social resilience. In terms of challenges, the review indicated the need for fostering social participation, promoting livelihood of coastal communities, and addressing cumulative impact. Advancing the sustainability of the BE will require innovative approaches that address the interplay between natural processes and human uses, including a collaborative assessment and community-based knowledge. ","This bibliometric analysis explores the relevance of Nearshore Marine Space for Blue Economy sustainability, highlighting its social, ecological, and spatial significance, and emphasizing the need for innovative approaches to address human uses and cumulative impact."
"How to Incorporate Cultural Values and Heritage in Maritime Spatial Planning: A Systematic Review","https://scispace.com/paper/how-to-incorporate-cultural-values-and-heritage-in-maritime-2vyr0l16eb","2024","Journal Article","The Heritage","Eirini Barianaki
Stella Sofia Kyvelou
Dimitrios G. Ierapetritis","10.3390/heritage7010019","","Understanding aspects of maritime/underwater cultural heritage (MUCH) and the associated cultural values and integrating them into maritime spatial planning (MSP) processes is a new global challenge alongside the rapid increase in human activities at sea and climate change impacts on the seas and the oceans. This article highlights the significance of cultural values in shaping human interactions with marine environments and how MSP can address the cultural dimensions of marine resources management. The key research question addresses the prerequisites and methods for a better incorporation of MUCH in the MSP processes. This review revealed a diversity of literature addressing the inclusion of MUCH in (a) coastal and marine management but also in (b) marine/maritime spatial planning (346 articles from the Scopus database). In the first case, there is a strong focus on cultural ecosystem services (CES) and cultural values, the role of indigenous and local communities, the transfer of traditional ecological knowledge, and participatory approaches and tools. As for the latter, this review demonstrated quite a lot of relatively recent MSP endeavors that seem to be influenced by the above approaches identified in the coastal and marine management literature. This article concludes that for MSPlans to be innovative and mainly acceptable by local communities, the “missing layer” of socio-cultural values and data is indispensable. Furthermore, a collaborative MSP between governments and regional/provincial authorities may boost sustainable blue activities while preserving ecological and cultural values.","The incorporation of cultural values and heritage in maritime spatial planning requires a systematic approach to address the cultural dimensions of marine resources management. The inclusion of cultural values in MSP processes enhances the acceptability and sustainability of MSP plans."
"SeaCities: Aquatic Urbanism","https://scispace.com/paper/seacities-aquatic-urbanism-2s9us3ly","2023","Book","Cities research series","","10.1007/978-981-99-2481-3","","This book highlights future city development from a terrestrial towards an amphibious and aquatic understanding ","In this paper , future city development from a terrestrial towards an amphibious and aquatic understanding is discussed, highlighting future cities from terrestrial to aquatic understanding, and highlighting future city growth from terrestrial towards aquatic understanding."
"Ocean Decade Challenge 10 underscores social dynamics in marine sciences as critical to transforming human–ocean relationships","https://scispace.com/paper/ocean-decade-challenge-10-underscores-social-dynamics-in-5utiyuyjw4o3","2025","Journal Article","Ices Journal of Marine Science","Diz Glithero
Nicola Bridge
Ken Paul
Jen McRuer","10.1093/icesjms/fsaf030","","Abstract The United Nations Decade of Ocean Science for Sustainable Development (2021–2030) seeks to deliver “transformative ocean science solutions for sustainable development, connecting people and the ocean.” Yet, traditional scientific methods and data collection alone are insufficient to catalyze the societal change needed for ocean sustainability and equity. This article focuses on the vital role and significance of ocean literacy as central to operationalizing one of the foundational challenge areas within the Ocean Decade framework—Restoring society's relationship with the ocean (Challenge 10). It draws attention to the key insights in the recently published Challenge 10 White Paper and the broader Vision 2030 ambition-setting process. First, it highlights the need to shift beyond sustainable ocean management to include managing human behaviors that impact ocean health. Second, it reframes ocean literacy as a “societal outcome,” offering a unifying lens to capture contextualized human–ocean relationships, science-policy-society connections, and insights to bridge the knowledge-action gap. The authors present a novel figure integrating four key drivers and operational activities offering tangible pathways to strengthen and restore ocean-society relations. ","The Ocean Decade Challenge 10 emphasizes the critical role of ocean literacy in transforming human-ocean relationships, shifting from sustainable management to managing human behaviors, and reframing literacy as a societal outcome to bridge the knowledge-action gap."
