"Paper Title","Paper Link","Publication Year","Publication Type","Publication Title","Author Names","DOI","PDF Link","Abstract","Relevant Excerpt"
"Towards a common trajectory of port labour systems in Europe? The case of the port of Antwerp","https://scispace.com/paper/towards-a-common-trajectory-of-port-labour-systems-in-europe-2nndb7hrsm","2020","Journal Article","Case studies on transport policy","A. Bottalico","10.1016/J.CSTP.2019.12.003","https://air.unimi.it/bitstream/2434/716677/2/1-s2.0-S2213624X1830333X-main.pdf","The purpose of this paper is to provide an analysis on the port labour system in Europe. The study aims at investigating the impact of the market players’ strategies along the maritime-logistics chain on port labour dynamics, stressing the role of the institutional constraints. The empirical findings gathered during the fieldwork in the port of Antwerp are presented and discussed. The paper shows how the strategic action of the main players along the maritime-logistics chain is modifying the port labour system analysed. The organizational model of labour in the port selected seems to be undermined by the institutional transition and the cutthroat competition along the entire logistics chain. The structure of the paper is as follows: After a critical appraisal of the literature review on port labour and the methodological approach used, in the second part the empirical findings are presented. The conclusions provide a summary and a reflection aimed at interpreting the ongoing, common changes of the port labour systems in Europe.","Title: Case Studies on Transport Policy Authors: Andrea Bottalico (Corresponding Author) Introduction:
 Scholars have addressed a variety of topics on port issues over the last decades. The maritime-economic literature shows how dynamics such as consolidation processes, increasing size of vessels, vertical integrations and shipping alliances have transformed the landscape, as well as the market structure . Introduction:
 Ports have been strongly influenced by these processes. In particular, scholars have underlined two major forces that affect the port sector: changes in organizational structures as a result of privatization or deregulation, and the efforts of shipping companies to control the whole logistics chain in order to leverage economies of scale . Introduction:
 The strategies of the main players along the maritime-logistics chain have increasingly affected the economic behaviour of the cargo handling companies, posing new challenges for the future of port labour systems and labour relations. On the other hands, gradual changing dynamics occur at the institutional level in the European ports. While the literature produced on the abovementioned processes has been consistent, scholars paid less attention on the extent to which these trends are altering the environment for terminals and port labour systems. Empirical research on port labour systems, on the behaviour of multinational cargo handling companies and the way they handle labour depending on the institutional frameworks within which they operate, is limited. With some exceptions, the existing literature on port labour is dominated by juridical disciplines, whereas the scientific debate on the maritime-port sector, predominantly economic, does not takes labour relations too much into account. Introduction:
 In recent decades, European ports have been integrated into broader supply chains and global production networks . The changes related to the intermodality have been observed by many scholars as resulting from the need to support economic globalisation . Ports have played a key role in this process, alongside the revolution in the logistics chain embodied by the development of the container and of intermodal transport. The variety of labour systems in key European ports is therefore influenced not only by the (institutional and economics) actors involved in the port segment, but also by the global actors operating along the entire logistics transport chain. The competition nowadays is in fact along the whole logistics chain, more and more integrated . Introduction:
 Since ports began to develop as nodes within global supply chains and production networks, this paper argues that the labour relations in European ports are currently under a common shifting process (e.g. gradual erosion of regulative assets via the European port policies, impact of market strategies on organizational aspects at workplace, increasing flexibility, etc.). These common changing dynamics that affect labour relations have to deal with the historical legacies of each port, but what really matter nowadays is the common trajectory that different cases share instead of the superficial differences among them. Introduction:
 The goal of the following paper is therefore to claim this ongoing convergence towards which the European port labour systems are going through the analysis of a single case integrated in global productive networks and embedded in a socio-institutional context. The paper aims at answering the following research questions: Are the labour systems of key European ports diverging or converging at the present time? What are the other key factors shaping these tendencies? Studying the working dynamics in ports can tell us something more general about the relative impact of global productive networks and national institutional constraints on local employment conditions."
"Maritime Sociology in the Making","https://scispace.com/paper/maritime-sociology-in-the-making-2b3fq6zl","2022","Book Chapter","","","10.1163/9789004503410_002","https://scispace.com/pdf/maritime-sociology-in-the-making-2b3fq6zl.pdf","","objective (spatial development of coastal areas) and subjective spheres (searching for a new maritime identity) . What is remarkable is that along with the loss of ""maritime identity,"" the engagement of the social sciences with port towns and cities is growing . The Subject of Maritime Sociology -beyond People Representing Maritime Professions:
 The change in the sea-port town/city relationship occurs in a broad social context. Ports receding from towns and cities means less opportunity for seafarers to rest when their ships call at ports for a stopover. Nevertheless, the necessity to redevelop wharves might be of benefit to residents themselves, who will gain access to new areas of towns and cities. Following these changes, port towns and cities have to redefine their weakened relation (their relationship) with the sea. In significant part, this process takes place in the symbolic sphere. Suitable cultural (including mass events) and educational events are to form a new maritime identity for a region and its inhabitants. Efforts to preserve the maritime character as a factor identifying the distinctiveness (differentiation) of a given region and shaping its specific nature and attractiveness constitute a thought-provoking subject for the social sciences (including sociology). The Subject of Maritime Sociology -beyond People Representing Maritime Professions:
 Another consideration linking the theme of social life with the marine environment is the importance which maritime transport has for the quality of life ashore. Currently, maritime transport constitutes roughly 90% of global transport . Access to cheap goods is possible due to complex processes of the centralisation and decentralisation of production . What is understood by centralisation is the ability to manufacture subassemblies on a large scale in one location. Decentralisation means the ability to assemble a final product from subassemblies obtained from various sources. Of key importance to both these processes is the low cost of transport. The potential of maritime transport, therefore, exceeds the simple ability to ship manufactured goods to customers cheaply. The Subject of Maritime Sociology -beyond People Representing Maritime Professions:
 The impact of work at sea (utilisation of the sea) therefore leads to extensive social consequences which also manifest themselves clearly in the cultural sphere. This does not mean, however, that land-related culture is becoming ""maritime culture."" Nevertheless, globalisation and the processes it entails cannot be fully comprehended without taking account of the role of the work performed by approximately 1.6 million seafarers and probably hundreds of thousands of people in other maritime professions (dock workers, logistics experts, shipyard workers)."
"Multi-scalar trade unionism: Lessons from maritime unions","https://scispace.com/paper/multi-scalar-trade-unionism-lessons-from-maritime-unions-18dmac39ne","2017","Journal Article","Relations Industrielles-industrial Relations","Peter Fairbrother
Victor Gekara","10.7202/1038524AR","https://scispace.com/pdf/multi-scalar-trade-unionism-lessons-from-maritime-unions-18dmac39ne.pdf","Union approaches in relation to the global recalibration of work and employment relations and practices over the last three decades are being worked out in practice. The question for unions is by which means they either have leverage or the potential to exercise power in relation to state and corporate decisions and strategies. Unions thus face challenging questions about the ways they organize, exercise their capacities and attempt to meet their purposes. With reference to the Australian maritime sector, the study examines the ways the main union, the Maritime Union of Australia, developed multi-scalar approaches to localized events. The problem unions face is to defend and advance workers’ interests. The task is to organize, to realize their capacities to defend and advance maritime workers’ interests, increasingly in multi-scalar ways.
 The argument is that leaderships and activity that ‘bridge’ scalar relationships are an important condition in this process. There appears to be a complex set of cross-connections between the local, the national and the international. While transnational connectivity increasingly defines contemporary forms of trade unionism, these scalar relations are defined in relation to the workplace, the everyday world, and by the ways that transport is a defining characteristic of the global world. These relations constitute contemporary class struggle where work and employment relations are always in a process of change and development. Trade unionism, thus, remains a collective expression of power relations, in an increasingly internationalized world of work and employment.
 Thus, this research presents important lessons for multi-scalar organization and campaigning by unions to realize their capacities and purpose. Nonetheless, this study is only a beginning. While it indicates the processes of bridging, the next step is to investigate the variety of ways that bridging may take place and with what outcomes for the development of multi-scalar activity.","distanced and often disconnected management or suffer parochial irrelevance . Increasingly, it is likely that unions will construct their approaches and focus, at the local, national and international levels, an approach that is termed ""complicated scalar practices"" . Debates:
 Nonetheless, the institutional and relational dimensions of transnational trade unionism play out in complex and contingent ways. Such analysis highlights the importance of continuing to re-examine the different dimensions involved in union renewal as an integrated process involving a dialectic whereby unions frequently reassess their organisation, their capacities and their purpose as collective actors . This observation draws attention to the role and place of leaders and activists in the process of addressing multi-scalar relations. The social network literature provides a clue as to how these matters may be addressed, especially in relation to the idea of 'bridging' theories . While the focus in such theories is on the ways that the intensity of relationships decrease as the movement is from the inner set of network relationships to outer ones, the value of the idea of 'bridging' networks is that it provides a view of linking relationships between union leaders / activists and others, within the same union, across levels and between unions. These propositions will be explored in relation to the ways in which unions organize, develop their capacities and frame their concerns to achieve set objectives. The questions are: What enables unions to address the complexity of multi-scalar practices and how might they do so? These questions are explored via an examination of the maritime industry in Australia, a prototypical case. context and methodology:
 To address these themes, the focus is on the unions that organize and operate in relation to ports, as the nodal hubs in global production and distribution, and as the sites of long-standing, often militant trade unionism, at local and transnational levels. It also examines the ways unions may follow workers (and union members) irrespective of the mobility of work and how both fixed and mobile workers may intersect. The research is predicated on the assumption that the local is both part of global relations as well as a distinct aspect of the global ; the task is to study globalization and the associated global relations via an examination of globally significant and interconnected yet local contexts, such as ports (see also . context and methodology:
 The maritime transport sector has been selected as emblematic of the processes of globalization. This industry is marked by a progressive integration of ports into the global trade routes. To explore these relations, the focus is on Australian ports because they sit at the edge of the main routes, are expanding, and are the site of long-standing active trade unionism, with strong and robust international associations. Thus, in effect, Australia may provide a litmus test about the ways unions may begin to address the industry changes that are in process in multi-scalar settings."
"Service-sector Guilds and the Challenge of Liberalization: The organization of maritime-cargo handling in Barcelona, c.1760-1840","https://scispace.com/paper/service-sector-guilds-and-the-challenge-of-liberalization-4vh2l43awq","2017","Dissertation","","Brendan J. von Briesen","","https://scispace.com/pdf/service-sector-guilds-and-the-challenge-of-liberalization-4vh2l43awq.pdf","Esta tesis tiene como objetivo elucidar el sub-sector del manejo de la carga maritima en Barcelona (1760-1840) para mejor entender la funcion de los gremios de servicios. En especial analiza como reaccionaron estos gremios al desarrollo progresivo del liberalismo, que represento un reto considerable al sistema gremial. De esta manera, la tesis contribuye a la historiografia de los estudios de gremios europeos y de la historia de trabajo en el ambito maritimo. Es notable que el objeto de estudio se encuentre como un outlier (o, caso atipico) en varios campos, ya que en los estudios de gremios hay poca atencion puesta en el sector de servicios, y en los estudios de trabajo maritimo hay muy pocas investigaciones sobre la epoca artesanal. A nivel de historia local, existen unas pocas publicaciones sobre los gremios tratados aqui, pero en su mayoria se enfocan en un solo gremio, desconectado del resto de componentes del universo del trabajo portuario. Entre los temas tratados se encuentran: el analisis del sistema gremial europeo en general y la diferenciacion de estos gremios de servicios; un acercamiento al entendimiento socio-espacial del puerto (con casos comparativos); la definicion socio-juridica y economica de los gremios tratados; el avance progresivo del liberalismo en Espana y particularmente en Barcelona; y las estrategias de los diferentes gremios del sub-sector del manejo de la carga maritima frente las reformas y aboliciones liberales del sistema gremial. Basado en literatura secundaria principalmente en castellano, catalan e ingles, y en fuentes primarias mayoritariamente en castellano, el tesis se presenta en ingles, con un resumen exhaustivo en castellano.","By the same measure, economic development was a highly localized affair as well. It seems quite evident that the maritime guilds followed similar trends of increasing specificity based on the economic development of their markets (as was common with secondary-sector guilds throughout Europe). Chapter Conclusions:
 The comparison between European ports suggests that the reasons for the composition of the guild universe were not specifically dependent on the cargo in question, but on traditions that developed over time. In some ports, the maritime porters were responsible for unloading vessels, in others, there were specific lightermen. Some port studies specifically note the presence of cartmen and common porters. The existence of maritime porters was universaland division of this trade into different guilds was not uncommon. The considerations included the specific goods in question, where they were unloaded or handled, whether or not they were imported or not, what their destination was, or what productive trade was involved. That is, it is impossible at this stage to create a predictive system or reach conclusions on the reasoning for the maritimecargo subsector throughout Europe. Chapter Conclusions:
 The existence of employment relationships within some of the porterage guilds was an important consideration. The fact that in some ports these relationships could be either formal (as in the case of London) or informal (in the case of Marseille), in Barcelona, these relationships did not develop in the maritime porters. The reasoning for this is impossible to state positively; however, it would seem as though cultural considerations beyond those created in the work sphere or guild life were responsible. Chapter Conclusions:
 Unfortunately, the port-studies encountered in this investigation focused mainly on maritime portersreferences to other trades were perfunctory at best. This underscores the academic need for more sector-based investigations in other European ports. Chapter Conclusions:
 While the question of national origin does not seem to have been a consideration in Barcelona,   the other ports studied demonstrated very different models. In some ports, imported workers were used to create competitive scenarios. In Genoa and Florence, workers were from another communitya specific one at thatand the ongoing relationship with their place of birth was important. In Cádiz, the workers were from another part of Spain (a mountainous region, as in Livorno)but I do not have enough information to determine whether they were solely from that area, or if they merely contributed to a larger pool of workers. In London, the use of foreigners (that is, men or women who were not free of the city) was a point of prohibition and conflict. In Barcelona, workers had to be residents of the areathere is no indication of foreign or alien workers. Chapter Conclusions:
 The labor panorama in the port area of Barcelona was complex, with three guilds dividing the privilege of unloading the vessels in the harbor, three guilds privileged with moving goods from the beach to the Customs House, and another guild that was responsible for moving goods from Barcelona to other points beyond the city. Additionally, there were common porters and common laborers who, without any privileges over maritime-cargo handling still competed with the responsible guilds from time to time."
"Governance of Arctic Shipping","https://scispace.com/paper/governance-of-arctic-shipping-2trdgjmoq0","2017","Book","","Robert Beckman
Tore Henriksen
Christine Dalaker Kraabel
Erik J. Molenaar
J. Ashley Roach","10.1163/9789004339385","https://scispace.com/pdf/governance-of-arctic-shipping-2trdgjmoq0.pdf","Governance of Arctic Shipping: Balancing Rights and Interests of Arctic States and User States examines potential cooperative mechanisms for balancing rights and interests of Arctic States and user States in light of experiences with Southeast Asian cooperative mechanisms.","seasonal baseline for ambient noise in Barrow Strait is calculated and compared against historical measurements. The chapter observes that there is a role for underwater acoustic modelling in marine spatial planning to enable quanti cation of the impact of seasonal noise from industrial activity. Structure:
 Shifting from maritime risk, the theme of Part B moves the discussion to 'The Human Dimension' through ve chapters with a focus on Indigenous peoples and maritime workers in Canadian Arctic waters. The rst two chapters consider Inuit conceptualizations and knowledge of Arctic spaces, which differ fundamentally from conceptualization for ocean policy, management and legal purposes and are key to decision-support systems in the region. In Chap. 7, Leah Beveridge discusses from seafarers, Part B concludes with Chap. 11, which looks at 'Insights from the History of Fishing Safety: Preparing for Increased Fisheries and Shipping in the Canadian Arctic', co-authored by  Fishing has always been one of the most hazardous industries, and in the harsh operating conditions of the Arctic, the dangers are exacerbated. The authors make a strong case to study the history of occupational health safety aspects of shing in subpolar and low-Arctic seas to anticipate and respond to the issues that can be expected to arise as shing activity moves deeper into Arctic waters. Structure:
 While various regulatory concerns are addressed in Parts A and B, Part C provides a more focused discussion on international standards for marine safety and vessel-source pollution in Arctic waters. Titled 'Regulating Shipping and Ocean Use', Part C consists of ve chapters focusing on the governance of shipping through the IMO, ship emissions, the Polar Code and heavy fuel oil and includes a discussion on marine spatial planning. Setting the stage for subsequent chapters, Chap. 12 is on 'The IMO Regulatory Framework for Arctic Shipping: Risk Perspectives and Goal-based Pathways' and is co-authored by Anish Hebbar, Jens-Uwe Schröder-Hinrichs, Maximo Q. Mejia Jr., Heike Deggim and Sascha Pristrom. As the competent international organization with respect to international shipping, the IMO adopts global standards for safety, security and environmental performance of shipping. The chapter discusses the organization's goal-based approach to regulation and the instruments relevant to Arctic shipping, including the Polar Code, and approaches to implementation by ag and coastal states as well as regional cooperation. The next two chapters concern un nished business in the regulation of the environmental aspects of polar shipping. Authored by Aldo Chircop, Chap. 13 is on 'The Regulation of Ship Emissions in Canadian Northwest Atlantic and Arctic Waters: Is there a Need for Consistency and Equity?' The author argues that while the Polar Code has raised standards for the prevention of vessel-source pollution, it stopped short of addressing the environmental impacts and public health concerns of ship emissions, including PM, SOx and NOx. The author argues for the designation of an emission control area in Canadian Arctic waters consistent with the standards applicable in the North American Emission Control Area. Chapter 14 concerns discussion to the national implementation of integrated ocean management pursuant to the regional policies and directives adopted by the European Union, focusing on the French approach and the challenges it faces in domesticating regional standards."
