"Paper Title","Paper Link","Publication Year","Publication Type","Publication Title","Author Names","DOI","PDF Link","Abstract","Relevant Excerpt"
"Exploring the Failure Mechanism of Container Port Logistics System Based on Multi-Factor Coupling","https://scispace.com/paper/exploring-the-failure-mechanism-of-container-port-logistics-2m5yj9z1","2023","Journal Article","Journal of Marine Science and Engineering","Mengmeng Wang
Haiyan Wang","10.3390/jmse11051067","https://scispace.com/pdf/exploring-the-failure-mechanism-of-container-port-logistics-2m5yj9z1.pdf","Container ports are prone to delays, congestion, and logistics interruptions under the perturbation of uncertain events inside and outside the system. This not only affects the service quality of the system but also brings a serious blow to the whole transportation network. Therefore, this paper aims to develop a hybrid Bayesian network (BN) model to investigate the failure mechanism of the container port logistics system. Considering the complex coupling relationship between failure risks, the DEMATEL and ISM methods are presented to thoroughly analyze the interdependence and hierarchical structure of system failure factors. The failure evolution mechanism of the system is then analyzed using BN reasoning ability. The suggested hybrid model can identify the main failure factors, examine how factors are coupled, and produce the main propagation path resulting in system failure. The findings indicate that the risks associated with technology, facilities, and equipment are the most significant and immediate in the system; human risks affect all system components by acting on other factors; organizational management risks have a fundamental impact on the stability of the system; additionally, the uncertainty of external risks has greatly increased the variability of each logistics link. This study provides useful insights for port logistics risk management.","risks of the system and the strong coupling role of the internal system should be paid attention to in order to discover the risk potential in time, cut the risk connection, and develop risk response measures to ensure the safe and stable operation of the system. Conclusions and implications:
 On the whole, this research has important theoretical and practical implications. On the one hand, this research's theoretical contributions are multi-fold. First, the object of this study is to investigate port risk from the new perspective of system failure and provide important insights by considering the influence of multifactor coupling on the evolution of system failure and building a failure mechanism model. This provides a new analytical framework and research perspective. Second, this study enriches the failure risk index system of the port logistics system and strengthens the understanding of the complex coupling relationship between factors. Third, this paper constructs a new risk model to deeply explore the relationship between factors, effectively overcome data problems, and improve the accuracy and persuasiveness of the results. Furthermore, the model can achieve real-time updates of data, which helps with risk monitoring and control. In short, this paper compensates for the shortcomings in port risk management research, enriches the theoretical foundation of the maritime risk field, and promotes the development of this field. Moreover, the new analytical framework proposed in the article can be applied to risk management in other fields. Conclusions and implications:
 From a practical point of view, this research provides a theoretical basis for enterprise managers to carry out risk management, helps them propose targeted prevention and control strategies, and promotes the scientific decision-making of enterprise managers. Moreover, it can enable port companies, governments, and other stakeholders to grasp the risks of port operations and determine the direction of future changes and development. In addition, timely and effective risk control can reduce losses caused by port risk events and improve resource utilization. Finally, constructive suggestions are put forward in terms of organizational management, daily monitoring of facilities and equipment, technical management, and contingency response, such as sound port management rules and regulations, comprehensive risk monitoring, and early warning mechanism. Limitations:
 However, there are some limitations to this study. First, this study mainly relies on expert assessment to obtain relevant data but lacks objective data. Second, to make the output network structure more aesthetically pleasing, this paper simplifies the association lines of factors on the graph when establishing the structural model, which makes the hierarchical structure not fully reflective of the direct connection between individual factors. There is still room for improvement regarding the methodological model used. Third, this research tends to be theoretical, and more comprehensive practical investigations can be conducted in the future to have a deeper understanding of the failure risk issues of typical ports and propose targeted risk management recommendations for specific ports. Therefore, in the future, the scale of expert review can be expanded and combined with objective statistics to improve the accuracy of the output results. On the other hand, the failure evolution of the port can be studied under different scenarios, and its feasibility can be proved. In the end, research on risk mitigation and control strategies for container port logistics can be continued based on the findings of this paper."
"Port control of the ship as a special case of control of the entrepreneur’s business","https://scispace.com/paper/port-control-of-the-ship-as-a-special-case-of-control-of-the-4u46491qcu","2020","Journal Article","","Łukasz Jakub Grodź","10.18276/SA.2020.12-03","https://scispace.com/pdf/port-control-of-the-ship-as-a-special-case-of-control-of-the-4u46491qcu.pdf","The issue of controlling business activities of entrepreneurs is an extremely broad one. Due to the limited framework of this study, port control of ships has been made the subject of this paper. The development of the existing system for controlling compliance with shipping safety standards has been analysed in depth. International, EU, and Polish legal solutions concerning port control of ships have been presented, analysed, and evaluated. The aim of this study is to demonstrate the effectiveness of the analysed system of ship control. The research method used in this paper is dogmatic and legal.","Chapter XI-2 of the SOLAS Convention seems to confirm the validity of the above-mentioned thesis. It is not possible to ensure the safety of a ship in the broadest sense of the word without protecting it against threats of intentional illegal acts. System for monitoring compliance with shipping safety standards:
 It should be stressed that the monitoring of compliance of ships' parameters with international safety standards, the qualifications of the crew, the prevention of maritime pollution as well as living and working conditions on board the ship is the responsibility of the Flag State. The responsibility for maintaining the good condition of the ship and its equipment, and for the compliance of the crew's qualifications with the requirements of the international conventions, lies with the company (ship owner/ship operator -depending on agreement).  The system for monitoring compliance with maritime safety standards currently operates at three levels: national, regional, and global.  This system is not incidental, because it is at national level that maritime safety standards are implemented and enforced. At regional level, however, actions are of a coordinating nature and are complementary to national processes. The aim of activities undertaken at global level is to create unified safety standards, and therefore appropriate legal standards. The main role in their creation is played by the International Maritime Organization (hereinafter referred to as the ""IMO""), based in London. As a United Nations specialised agency, the IMO is an international body that sets standards for shipping safety, environmental protection, and the development of maritime trade. The primary objective of the IMO is to create a fair, effective, generally accepted, and widely implemented legal framework for the shipping industry.  To date, the IMO is responsible for more than 50 agreements and conventions and has adopted a number of protocols and amendments. The Republic of Poland is a founding member of this organisation. Another body playing an important role in creating uniform maritime safety standards is the International Labour Organization (hereinafter referred to as the ""ILO""), based in Geneva. The main objective of the ILO is to promote employment and job creation, to strengthen the protection of labour rights, social security, and social dialogue and to develop international labour standards (e.g., the Maritime Labour Convention, 2006). Other important maritime organisations include: − Baltic and International Maritime Conference (BIMCO), − International Chamber of Shipping (ICS), − International Association of Classification Societies (IACS), − International Association of Lighthouse Authorities (IALA), − International Marine Pilots' Association (IMPA), − International Hydrographic Organisation (IHO), − Baltic Marine Environment Protection Commission (BMEPC), and Committee of Paris Memorandum of Understanding on Port State Control. This is a non-governmental organisation, bringing together the maritime administrations of the participating States, with the aim of international cooperation in the field of inspection of ships with regard to their compliance with the basic rules on maritime safety."
"The shift of seafaring from traditional to emerging maritime states : an analysis of the trends","https://scispace.com/paper/the-shift-of-seafaring-from-traditional-to-emerging-maritime-527pi7oqdq","2003","","","Jabeth Sena Jepath A. Dacanay","","https://scispace.com/pdf/the-shift-of-seafaring-from-traditional-to-emerging-maritime-527pi7oqdq.pdf","v Table of","examine the impact on seafarers' living and working conditions of changes in the structure of shipping industry which is expanding along with global trade, and fashion a new ""bill of rights"" for all seafarers on the high seas. International Maritime Labour Regime on Seafarers' Rights:
 This revolutionary move at the ILO aims to consolidate the existing body of 39 Conventions and 28 Recommendations into one major framework instrument representing a kind of ""bill of rights"" for the industry. It has been recognised by the Joint Maritime Commission (JMC) of the ILO that many of its maritime instruments were already outdated some dating back to 1920s, most had not been ratified, many of them deficient and did not reflect modern practice. Some of them were not practical for today's ship operation and manning, and the follow-up inspection was close to nil.  At the same time, existing instruments did not cover many issues that had later become relevant. Thus, the need to review and thresh out new set of rules that is hopefully adopted during the next maritime session of the International Labour Conference in 2005, and if possible, to be implemented for effective enforcement around year 2006. International Maritime Labour Regime on Seafarers' Rights:
 The role of the ILO as an international standard-setting organisation has become far more important with the transformation of the shipping industry over the past few decades and the globalisation of the seafarer labour workforce. Many people express the view that as a truly global industry, the shipping industry requires a global response with a body of global standards. While many people in the industry support the recent initiative of the ILO maritime body in converting into a single ILO consolidating instrument the numerous ILO conventions and recommendations, others find such move to be too little if not too late.  In supporting the latter view, proponents submit that while there have been calls for the review and updating of said conventions and recommendations for many years, the situation of maritime labour scene has radically changed in recent years with the introduction of the port state scheme, the revised STCW certification and the ongoing ISM certification. They further advance the view that ILO conventions have no mandatory effect without the relevant national ratification, hence, very limited enforcement if the regulation is violated, even if ratified. International Maritime Labour Regime on Seafarers' Rights:
 On the other hand, advocates of the proposed consolidated convention envisage incorporating, in so far as possible, the substance of all relevant maritime labour standards with the necessary updating to be easily updatable to keep pace with the developments in the maritime sector, be drafted in such a way as to secure  Arne Sagen Companion,""Seafarers' working conditions"", Seaways, March 2002, at p. 15.  Ibid. the widest possible acceptability, place emphasis on the means of enforcing its provisions and be structured in such a way as to facilitate the achievements of the foregoing objectives.  Notwithstanding the growing criticism on the proposed consolidation of ILO maritime labour instruments, it cannot be denied that the need for a self-confident, proud and highly skilled workforce is urgently needed now by the industry more than ever. While coherence and quality in training of seafarers were already addressed by the STCW 1995 and ISM Code, the same will not in themselves be sufficient."
"Säkerhetskultur i Östersjöfart : En studie kring sjösäkerhet, säkerhetskultur och arbetsvillkor ombord på fartyg som trafikerar Östersjön","https://scispace.com/paper/sakerhetskultur-i-ostersjofart-en-studie-kring-sjosakerhet-3mijugm2lm","2012","","","Fredrik Hjorth","","https://scispace.com/pdf/sakerhetskultur-i-ostersjofart-en-studie-kring-sjosakerhet-3mijugm2lm.pdf","Foreliggande avhandlings centrala syfte ar att undersoka sakerhetskultur ombord i fartyg vilka trafikerar Ostersjon. Genomgaende for fartyg i Ostersjofart ar tata hamnanlop, kustnara resor, trafik ...","Keywords: Safety culture, maritime safety, reporting culture, accidents, ISM, work conditions, shipping, system perspective xi"
"Globalization Under Fire","https://scispace.com/paper/globalization-under-fire-hen4xstk09","2005","Journal Article","Labour/Le Travail","Mark P. Thomas","","https://scispace.com/pdf/globalization-under-fire-hen4xstk09.pdf","Da vid Ba con, The Children of NAFTA: Labor Wars on the U.S./Mexico Bor der (Berke ley: Uni ver sity of Cal i for nia Press 2004) Jacques B . Gelinas, Jug ger naut Pol i tics: Un der stand ing Preda tory Glob al iza tion (London & New York: Zed Books 2003) Ronaldo Munck, ed., La bour and Globalisation: Re sults and Pros pects (Liv er pool: Liv er pool Uni ver sity Press 2004) James Petras and Henry Veltmeyer, Sys tem in Cri sis: The Dy nam ics of Free Mar ket Cap i tal ism (Black Point, NS: Fernwood 2003)","ex am ple, those within dif fer ent na tion-states), while si mul ta neously seek ing to iden tify com mon is sues that could pro vide a transna tional platform for ac tion. (149-65) Glob al iza tion and Re sis tance:
 Of the chal lenges faced by labour move ments, it is per haps in ter na tion alism that is the most daunt ing. Dis cus sions of in ter na tion al ism tend to fo cus on in ter national or ga ni za tions such as the ICFTU, the In ter na tional Trade Sec re tar iats, and the ILO. Con cerns are often raised that such or ga ni zations have lit tle bear ing on workers' strug gles on the ground. In as sess ing in ter na tion al iza tion strat e gies, Munck argues that it is im por tant to avoid bi nary un der stand ings of ac tiv ism, for exam ple, a dichoto mous analy sis be tween rank-and-file ac tions and those at the level of un ion of fi cials (na tional or in ter na tional). Anal y ses must seek to cap ture the dy nam ics of strug gle at mul ti ple lev els in ef forts to pro mote la bour in ter na tion al ism. These issues are taken up in a well-detailed case study com par i son of the strat e gies used by dockworkers in Liv er pool and Aus tra lia, which pro vides in sight into the im pli cations of two dif fer ent forms of la bour in ter na tion al ism: an in ter na tion al ism that built global sol i dar ity through global ac tions (Liv er pool), and a bot tom-up strat egy that be gan with tra di tional work place ac tion that was bol stered by in ter na tional sup port (Aus tra lia). Ac cord ing to Jane Ken nedy and Mi chael Lavalette, the success of Aus tra lian dockworkers in de fend ing their jobs lay in lo cal ized working-class and com mu nity-based orga niz ing that led to mass picketing and the shut ting down of the docks, while the em pha sis on inter na tional ac tions un der taken in the Liv er pool dockworkers' global sol i dar ity cam paign, while in spi ra tional, failed to pres sure the Mer sey Docks and Har bour Com pany to change its course. Ken nedy and Lavalette use the case to make the ar gu ment that lo cal ized ac tiv ism is still needed to chal lenge the glob al iz ing ten den cies of con tem po rary cap i tal ism. (206-26)"
"El trabajo en la marina mercante española en la transición de la vela al vapor (1834-1914)","https://scispace.com/paper/el-trabajo-en-la-marina-mercante-espanola-en-la-transicion-422o8s8lgr","2013","Dissertation","","Garcia i Domingo
Enric","","https://scispace.com/pdf/el-trabajo-en-la-marina-mercante-espanola-en-la-transicion-422o8s8lgr.pdf","El objeto de estudio es la Marina mercante espanola (en concreto las tripulaciones) durante la transicion de la vela al vapor. El marco cronologico se situa entre 1834 (primera linea regular estable con buques de vapor) y 1914 (cuando el proceso de mecanizacion ya se puede dar por acabado). Aunque con referencias a un marco internacional mas amplio, se analiza el caso espanol focalizando en la marina catalana porque durante el proceso el centro de gravedad de las actividades maritimas estaba en Barcelona, y por tanto fue alli donde la mecanizacion tuvo su campo de accion principal. Esta tesis se situa en la interseccion entre la historia maritima, la historia social y la historia del trabajo. Con estas perspectivas metodologicas, se realiza una primera aproximacion a los procesos de trabajo en la Marina mercante espanola en el momento del cambio de la vela al vapor, es decir, a lo largo de un proceso de casi cien anos que supone la ruptura con formas de trabajo y de relacion que se habian mantenido practicamente inalteradas durante siglos. El sector maritimo es uno de los campos donde la industrializacion (entendida como un proceso de cambio en la organizacion de la produccion, el trabajo y las relaciones laborales, mas que como la adopcion de una nueva tecnologia basada en el vapor) tuvo un impacto mas acusado, no solo economico y social, sino tambien de identidades y culturas sociolaborales. El estudio se centra en el proceso que llevo de la vela al vapor desde el punto de vista de los marinos, para observar y explicar como este colectivo diverso y complejo se enfrento y se adapto a la industrializacion. La atencion se centra en los marinos mercantes embarcados que trabajaban en buques de altura, es decir, de navegacion oceanica. Interesan tanto las clases directoras (el capitan y los oficiales de cubierta y de maquinas) como las clases ejecutoras (los subalternos de cubierta y de maquinas), ya que comparten en esencia los condicionantes del trabajo en la mar. Y de todos ellos, los marineros conforman el autentico nucleo de la investigacion, pues son los que estan sujetos en mayor medida al reto de redefinir su papel a bordo cuando el elemento propulsor de los buques pasa de palos y velas a la maquina. La tesis se ha organizado en torno a tres partes principales. En primer lugar se presenta el marco legislativo en el que se desarrollo la Marina mercante espanola en el periodo estudiado, condicionado por la institucion de la Matricula de mar. El analisis de este aspecto es imprescindible para conocer las particularidades del caso espanol en todas las facetas relacionadas con el trabajo y su regulacion. Tambien analiza el papel de la legislacion reformista en este sector. En la segunda parte se presenta el mundo del trabajo en la marina de vela a partir del analisis de la organizacion del trabajo, los oficios o las profesiones (definidos genericamente como clases) y las categorias o niveles laborales, el reclutamiento, la contratacion, las formas salariales y las condiciones de trabajo. Se trata de un texto esencialmente descriptivo. En la tercera parte, de caracter interpretativo, se analiza el impacto, directo e indirecto, de la mecanizacion sobre el trabajo en la Marina espanola. Aparte de las consideraciones generales relacionadas con el proceso desde el punto de vista tecnologico, se repasan los cambios producidos y se dedica una atencion especial a las nuevas profesiones y categorias que se incorporaron al sector maritimo con la implantacion de la maquina de vapor. En el ultimo capitulo se recogen las conclusiones.","debía ser el Montepío, que entonces estaba a punto de ser constituido. La Dirección General de Navegación lo administraría hasta que se constituyese oficialmente el Montepío del Personal de la Marina Mercante. Organizaciones profesionales y obreras:
 Zamora utilizó sobre todo prensa obrera y profesional, y yo he seguido el camino marcado por este autor utilizando otros recursos, (fuentes dispersas, como fondos de archivo de la Junta de Comercio de Barcelona, de la Cámara de Comercio de Barcelona, publicaciones y otras) para reconstruir los trazos básicos de estas organizaciones y sus planteamientos. Organizaciones profesionales y obreras:
 Las sociedades obreras y profesionales de las que se tienen noticias en el sector de la Marina mercante en el período estudiado son, hasta 1914, sociedades de oficio, herederas directas de las estructuras gremiales medievales. Las organizaciones sindicales agrupaban sobre todo trabajadores no cualificados o especializados. En cambio, en el societarismo de oficio y en las hermandades de socorros mutuos se asociaban trabajadores cualificados. Asumo como propia la advertencia de Juanjo Romero sobre la barrera que los estudios históricos han levantado entre el primer sindicalismo de clase y el asociacionismo mutualista/profesional, o de socorros mutuos. Sindicatos y hermandades de socorros mutuos son considerados en la historiografía moderna como realidades distintas y a veces opuestas. Sin embargo, no parece que en las primeras etapas del movimiento obrero sus protagonistas participasen de esta disyuntiva metodológica (ROMERO, 1999:246-247). El sindicalismo fue un fenómeno de élite, irrelevante para la experiencia vital del grueso de la fuerza de trabajo del siglo XIX (AIZPURU   y RIVERA, 1994:149). En cualquier caso, lo cierto es que, a diferencia de otros sectores, donde los sindicatos de ramo o de sector fueron desarrollándose a partir de la década de 1910, en la Marina mercante este modelo no se implantó hasta la fundación del Sindicato Libre de la Marina Mercante en 1975. La mayor parte de estas sociedades carecen de una estructura estable, aparecen y desaparecen según las circunstancias y en principio tienen un bajo nivel de afiliación."
"Maritime interests and the EU port services directive","https://scispace.com/paper/maritime-interests-and-the-eu-port-services-directive-19oaa792pd","2008","Posted Content","","Athanasios A. Pallis
George-Spiros P. Tsiotsis","","https://scispace.com/pdf/maritime-interests-and-the-eu-port-services-directive-19oaa792pd.pdf","A key theme of the EU Port Policy has been the establishment of free market access to the provision of port services in EU ports. However, two successive European Commission proposals for a relevant EU port services directive (PSD) failed to produce a new policy regime. This paper examines the mobilisation of maritime interests, aiming to identify stakeholders' preferences and their contribution to the rejection of this port policy proposal. The analysis suggests that, although they did not share the same perspective, the views of organised maritime interests shared a common denominator: they were against the proposed EU rule due to its structural deficiencies. Assisted by the industrial heterogeneity, the difficulties to implement a 'one size fits all ports' policy, and the observed institutional tensions a variety of vested interests frequently with monopolistic positions contributed to the produced policy output failure.","Keywords: Intra-port competition, Port policy, Maritime interests"
