Sensory Group,Sensor / Modality,Grouping Justification,Stop Trigger: Santa Apolónia (OPS),Stop Trigger: Beato (BioBus/Lab),Stop Trigger: Barreiro (HyChem),Kolumna nr 1
Distance (Exteroception),1. Sight  2. Hearing,High channel capacity for far-field environmental mapping.,"Cable infrastructure, LED signal glare, docking hum.","Solar roof patterns, green bus livery, startup chatter.","Electrolyzer towers, white gas pipes, industrial hiss.",
Chemical (Interfacial),3. Smell  4. Taste,Direct molecular interaction with the atmosphere.,"Marine diesel fading to ""clean"" ozone smell.",Residual scent of fried food/cooking oil near bins.,"Clean, metallic ""non-smell"" of high-purity hydrogen.",
Somatic (Haptic/Tactile),5. Touch  6. Temperature  7. Pressure  8. Vibration,Proximal sensors for physical material density and energy.,Vibration of ship auxiliary engines through the pier.,Heat radiating from black solar panels on brick.,"High-pressure gas flow ""thrumming"" in pipes.",
Internal (Body-Sense),9. Balance (Vestibular)  10. Proprioception  11. Kinesthesia,Internal monitoring of the body's relation to gravity/motion.,"The ""sway"" of the pier during heavy ship docking.",Rhythmic motion of the BioBus navigating tight alleys.,The scale-shift (feeling small) next to gas storage.,
Rhythmic & Invisible,12. Time (Chrono)  13. Electro-mag  14. Nociception  15. Air-Flow,"Temporal and technical layers of the ""smart"" city grid.",Peak demand cycles (Chrono); EMF near transformers.,Battery recharge cycles; wind cooling in factory silos.,Shift from coal-time (past) to hydrogen-time (future).,