"Paper Title","Paper Link","Publication Year","Publication Type","Publication Title","Author Names","DOI","PDF Link","Abstract","Relevant Excerpt"
"Maritime Sociology in the Making","https://scispace.com/paper/maritime-sociology-in-the-making-2b3fq6zl","2022","Book Chapter","","","10.1163/9789004503410_002","https://scispace.com/pdf/maritime-sociology-in-the-making-2b3fq6zl.pdf","","Title: Maritime Sociology in the Making Authors: Arkadiusz Kołodziej,Agnieszka Kołodziej-Durnaś Several endogenous (connected with the social sciences themselves) and exogenous factors have led to an increased interest in maritime issues. Owing to increased ecological awareness, the seas and oceans are drawing growing attention from society. They also exert an increasingly strong impact (mainly due to maritime transport) on the shape of social life. These and other phenomena contribute to the growing social importance of the sea, and this obviously attracts sociologists' attention. On the other hand, though, sociological theory itself is changing by more favourably considering non-human actors or the area of the sea as an essential platform of social life . The perspective on the sea can be and is very different in the social sciences. From an individual perspective, ""The sea is one of the greatest 'things-,' a human faces"" . For centuries, the sea has been explored. However only recently did it become more systematically apprehended and studied as a social space  (for a long time, science emphasised an ""undesirable"" differentiation between society and nature ). The sea can be perceived as a background, a connection of lands, but also as a central place ) (sea means a separation too but most of all a way to other lands). It also serves as a source of income for many people. It is noteworthy that there are over 40 million people employed in the maritime sector, for whom the sea is a workplace, isolated from their families, but the same time, however, it is a place of fulfilment when performing a specific vocational role; a place where their social life takes place . This economic dimension of relations with the sea is often crucial when looking from an individual perspective. A collective (community) perspective provides a different point of view . Many nations with access to the sea based their narrative in times of a struggle for independence or territorial expansion on ""anchoring"" in seaside areas. Rancew-Sikora discusses how maritime discourse ) can reflect a nation's collective imagination which, in the case of Poland, is based on remembering the past and its associated symbols, including symbols of nature. The meaning of the sea is highlighted in culture by anthropomorphisation (this is particularly reflected in the English language). History has recorded the Marriage of the Sea Ceremonies (e.g. in mediaeval Venice or in Poland after regaining independence in 1920 and then at the end of World . At present, social awareness is growing with regard to problems of the seas, and the oceans in particular. Together with a developing ecological awareness, oceans ""grow closer"" to people, irrespective of their places (countries) of residence. The social importance of maritime professions is also growing. Consumerism or cultural uniformity as phenomena characteristic of contemporary lifestyles necessitate cheap (maritime) transport. The world we know has never been so dependent on maritime transport which, not without reason, is considered as one of the fundamental pillars of globalisation. This is how we cross the boundary between the sea and land, as we do between cultures and civilisations and slowly drift towards the world of hybridisation ."
"Global transformation of the contemporary labour market for merchant navy seafarers : case studies of Filipino, South African and British seafaring labour markets.","https://scispace.com/paper/global-transformation-of-the-contemporary-labour-market-for-4d2zm98k0n","2008","Dissertation","","Shaun Ruggunan","","https://scispace.com/pdf/global-transformation-of-the-contemporary-labour-market-for-4d2zm98k0n.pdf","The central aim of this thesis is to investigate how and why labour markets are formed in specific ways under contemporary global capitalism. This thesis achieves this through a sociological analysis and explanatory account of the contemporary transformation of merchant navy seafaring labour markets for Filipino, South African and British seafarers. The study is centrally concerned with four questions relating to the restructuring of these labour markets. These questions are: 1. How has the labour market for seafarers been reshaped? 2. How has the restructuring of shipping capital facilitated this process process? 3. What has the role of labour been in this restructuring process? 4. What other labour market institutions contribute to this restructuring? Answering these four questions allows me to achieve the central aim of my thesis which is to investigate how and why labour markets are formed in specific ways under contemporary global capitalism. In answering these questions this thesis makes three theoretical interventions in industrial sociology. Firstly, this work offers a substantially different account of labour markets that advances a more fully social explanation of labour market formation that does not consider the social as a 'factor' or an 'add on' as does classical and neo classical economics (and some strands of economic sociology) but a significant shaper of global labour markets. Secondly, it fills a gap in theorising the agency of organised labour under global capitalism. The thesis demonstrated how the agency of organised labour and the importance of locality or place should also be accorded primacy in arguing how labour markets are produced. Thirdly in making my own assertions about the creation and decimation of working classes under capitalism, I draw on three detailed case studies of seafaring trade unions, capitalist and state strategies in the shaping and transformation of contemporary labour markets for seafarers and therefore demonstrate the fallibility of the 'race to the bottom' thesis using contemporary research and data.","upgrade to officer levels. In conjunction with this locally based strategy is a campaign by the Rail and Maritime Union within the International Transport Workers Federation to secure and protect United Kingdom ratings' jobs. These trade union strategies will be discussed in detail in chapter six. The Implication of Flexible Labour Markets for Seafarers:
 To reiterate the purpose of this chapter is to answer the question ""how has the labour market for seafarers been reshaped?"" I have shown how this reshaping is taking place in very specific ways in Filipino, South African and British labour markets for seafarers. This section argues that in addition to the specific changes occurring in these three labour markets, there are more generic trends that can be observed across global seafaring labour markets. These trends, following the discussion in chapter two, can broadly be discussed as ways in which merchant seafarers are similar and dissimilar from other types of workers in a post Fordist labour market. This is important because it situates seafarers and seafarer labour markets into the broader context and discussion of changes in the nature of global labour markets as referred to in chapter two. This section argues that there are five similarities and four differences between seafarers and other flexible workers in the global labour market. The Implication of Flexible Labour Markets for Seafarers:
 The first way in which seafarers are similar to other flexible workers is their reliance on agencies or labour brokers for employment. Of the three case studies presented in this thesis, Filipino seafarers rely on agencies for their employment (See Chapters six and seven) of the thesis, though this is certainly the case for all seafarers in the new global seafaring supply countries around the world. This was not the case for South African seafarers though there are some attempts to move in this direction (see chapter six) or British ratings, who are almost non-existent in their employment in global labour market (see chapters four and six and seven). The Implication of Flexible Labour Markets for Seafarers:
 Interview, RMT Information Officer, London, United Kingdom: February 2005. The Implication of Flexible Labour Markets for Seafarers:
 However given that seafarers from the dominant seafaring supply countries such as the Philippines, rely on labour broking for their employment (see chapter six), labour broking is an important process in the formation of seafaring labour markets. Labour broking in the commercial shipping sector is mainly a result of the shift to flexible accumulation strategies of shipping companies, which involve radical changes to the nature of the bureaucracy of shipping companies. The details of the organisational restructuring of shipping companies are more fully explored in chapter five."
"Framing social justice: the ties that bind a multinational occupational community","https://scispace.com/paper/framing-social-justice-the-ties-that-bind-a-multinational-ilv9stgyd0","2018","Journal Article","Sociology","Nicholas J. Bailey
Nik Winchester","10.1177/0038038516670111","https://scispace.com/pdf/framing-social-justice-the-ties-that-bind-a-multinational-ilv9stgyd0.pdf","The notion of a frame is central to the conceptualisation of social justice and the grounding of social justice claims. Influential theories of social justice are typically grounded in national or cosmopolitan framings. Those entitled to raise claims of injustice are identified as citizens of states or the globe, respectively. The re-visioning of understandings of space and belonging, incumbent in the processes of globalisation, problematises static geographical framings. We offer an alternative lens and argue for the inclusion of sociological data in accounts of social justice to identify the relevant framing of the community of entitlement. Drawing on secondary analysis of a qualitative dataset, we explore the case of multinational seafarers caught at the intersection of competing appeals to nationality and commonality as an exemplar of transnational workers. And, argue that there are compelling grounds to treat this group of multinational seafarers as a community of entitlement.","but also by enunciating seafarer perceptions and feeling of inequity. In this we seek to go beyond claims that sociology should leave ethical theory to philosophy and contend that the sociological and the ethical should be seen as mutually constitutive. Conclusion:
 In a globalised world claims of social injustice often transcend national boundaries. In such cases a key area of contestation is the determination of the appropriate and legitimate frame, i.e. who is entitled to raise claims and on what basis. We have examined the case of seafarers in the global maritime industry, where claims for equitable treatment are based on perceived commonality but rebutted on the grounds of national belonging. We have presented data from seafarers demonstrating that they self-identify as a community of entitlement; where belonging is based in perceptions of competence and willingness to contribute to the joint endeavour in a way consistent with established sector-wide maritime tradition and practice and, importantly, shaped by the sector-wide organisational structures and arrangements. Having argued that seafarers, as a community, warrant the status of legitimate claimants to social justice, a fuller theory of social justice requires the elucidation of the mechanisms by which claims could be addressed. Whilst beyond the scope of this paper, we point to several elements necessary to developing a fuller account that are present in the sector. First, the maritime sector is subject primarily to international regulation as developed by the International Maritime Organisation (IMO) and International Labour Organisation (ILO), with labour organised globally by the International Transport Workers' Federation (ITF); Second, the ILO has developed an internationally accepted minimum wage for seafarers, while the ITF has leveraged commonality to set minima in respect of terms and conditions and secured some basic rights; Third, the recent development and ratification of the ILO's Maritime Labour Convention, which attempts to delineate an extensive 'bill of rights' for seafarers. Conclusion:
 In developing our argument we have focused on seafarers, however, the need to identify who can legitimately raise claims to social justice applies equally to other groups -we could for instance, have examined the case of other transnational workers, e.g. air crew, construction workers in the Middle East, or migrant domestic workers in Singapore or Hong Kong. Indeed, we have argued that any account of social justice would benefit from a detailed examination of the of the community that underpins it. The thesis advanced is that social justice relates to a community whatever its basis; be it in terms of geographical boundaries underpinned by legal and constitutional arrangements and notions of citizenship or through some more amorphous but socially grounded set of social relations. And, in giving an account of social justice appeal needs to be made to the empirical elucidation of those relations that define the community. Hence our contention is, that in the matter of social justice, theorists should not declaim principles without detailed understanding of the social world and a recognition of the relations that bind those for whom they speak. To this end sociological methods and data are an essential element."
"Sociological aspects of seafarers' life and work and management styles in shipping","https://scispace.com/paper/sociological-aspects-of-seafarers-life-and-work-and-jsffk1oose","2016","","","Andrija Nenadić
Dražen Jašić
Aleksandra Krajnović","","https://scispace.com/pdf/sociological-aspects-of-seafarers-life-and-work-and-jsffk1oose.pdf","As this paper’s authors have learned from experience, contacts with seafarers and their participation in the internet forums, it appears that seafarers reluctantly take comments on the specific ways of their life and work which are made by people who do not come from their walk of life. Their attitude gave an impulse to this research. The results have been produced through surveying the seafarers and analysing their statements posted on online discussion sites where they share their experience. The research sample consists of the seafarers attending additional training programs at the Faculty of Maritime Studies in Split, the so-called Special education and training programme for seafarers [1].","corporate policies, international standards and conventions. The sacrifice arising from being separated from their families and friends is huge and a simple calculation shows that a seafarer never makes a fortune -in most cases he or she works hard for an average pay. SEAMAN'S PROFESSION AND MARITIME SHIPPING TODAY -PSYCHO-SOCIOLOGICAL IMPLICATIONS:
 Each person experiences and deal with challenge in a different way. Fortunately, seafarers are predominantly strong and independent individuals, otherwise they could not survive in their severe professional environment. However, it means a lot to the seafarers to have someone to talk to and reduce the feeling of isolation, particularly with regard to modern multinational and multicultural crews. Linguistic, cultural and religious constraints are huge and hard to overcome; hence, seafarers tend to form small circles of relationships and have few people to communicate with on a regular basis. Today, it is hard to find a crew consisting of people having only one nationality. Most of the crews are multinational, with seafarers coming from all over the world. These multi-linguistic and cross-cultural gaps are hard to bridge even though the seafarers are considered as citizens of the world. SEAMAN'S PROFESSION AND MARITIME SHIPPING TODAY -PSYCHO-SOCIOLOGICAL IMPLICATIONS:
 Communication technologies have greatly contributed to the feeling of being better connected with home, family and friends. Permanent contacts with home via the internet, mobile or satellite phones have important positive effects and help seafarers to cope with risks and challenges more efficiently. However, personal and human touch is irreplaceable. Hence the role of the Apostleship of the Sea is essential. Seaman's clubs, organised by the Catholic Church across the world, are meeting places where seafarers are able to satisfy their natural need of talking and socialising with people who can understand them. Hard situations and dreadful scenes that a seafarer experiences throughout his working life would be enough to fill a number of average lifetimes. This is very hard to endure and to cope with from the psychological standpoint. The shore-based community does not have enough understanding as most of other people do not have such experience, so that both the seafarer and his family take the consequences. SEAMAN'S PROFESSION AND MARITIME SHIPPING TODAY -PSYCHO-SOCIOLOGICAL IMPLICATIONS:
 At the annual meeting of the Apostleship of the Sea, Captain Mladen Russo discussed the issue of Somali pirates, presenting arguments and interesting details. It is clear that the media address the issue from the Western point of view but, again, there is another side of the coin. It is tragic that the seafarers are victims of the unbearable situation as they are neither its cause nor the solution. It is probably not necessary to describe the feelings of an innocent man spending months in prison under inhuman conditions, fearing for his life constantly and looking at a machine gun in the attacker's hands as the only sign of civilisation. Arming a merchant vessel with weapons and escort is not a solution to this situation as the vessel thus becomes a military target and, besides, arms and escort are not there to protect seafarers but to protect cargo and corporate assets."
