"Paper Title","Paper Link","Publication Year","Publication Type","Publication Title","Author Names","DOI","PDF Link","Abstract","Relevant Excerpt"
"The Spread of Social Inclusion in the Maritime Industry: A Social Study","https://scispace.com/paper/the-spread-of-social-inclusion-in-the-maritime-industry-a-3dk8r8hc","2023","Journal Article","The international journal of business ethics and governance","Lucie Sislian
Anicia Jaegler","10.51325/ijbeg.v6i1.120","https://scispace.com/pdf/the-spread-of-social-inclusion-in-the-maritime-industry-a-3dk8r8hc.pdf","This paper presents a social study on the maritime port of Montreal investigating the spread of social inclusion in the maritime industry. We used both qualitative and quantitative methods, including structural equation modeling to answer the research questions. Our findings show that the spread of social inclusion was significant in the port in terms of workplace diversity and inclusion, the workplace environment, and the port’s responsibility toward society. These findings highlight specific factors that are currently being overlooked and thus require greater industry collaboration. The proposed framework also serves as a tool for a single maritime port to self-assess its current stage of sustainable development, with implications for future social-inclusion implementation strategies.","Title: The Spread of Social Inclusion in the Maritime Industry: A Social Study Authors: Lucie Sislian,Anicia Jaegler Keywords: Sustainability, Social Inclusion, Diversity, Port, Maritime, Structural Equation Modeling, Partial Least Squares Introduction:
 Corporations and ports have been transformed by the need to incorporate environmental and social aspects into their business operations. The triple bottom line approach, as described by  and , advocates a balance between economic, social, and environmental approaches to achieve sustainability. The well-established definition of sustainability in the literature refers to the present-day combination of international laws and stakeholder concerns that have posed challenges to businesses and ports alike . Introduction:
 In the shipping and maritime industry, the world has become a small, interrelated, and interdependent village . Shipping is the most heavily regulated industry in the world. Thus, the maritime industry has faced new challenges with growing concerns about sustainability. Health and safety, environmental protection, workplace diversity, working conditions, and the impact of ports' activities on communities are issues that must be addressed by port authorities . In addition, port management involves complex and multidimensional tasks: maritime activities are conducted in an international environment involving employees with diverse cultural backgrounds, which could lead to workplace conflicts.  have previously analyzed maritime activities through the combined lenses of academic, moral, and financial perspectives in the workplace. Sustainability can be achieved via enhanced employee relations, improved port reputation in the maritime industry, improved communication with stakeholders, minimized operating expenses, and greater efficiency . Introduction:
 With regard to the shipping industry, there has been a lack of research on the relationship between sustainability and the impact of social inclusion. Given the maritime industry's critical role in achieving social inclusion, the lack of research in maritimerelated studies is surprising. Some researchers attribute it to the International Maritime Organization's (IMO) slow response to the implementation of social inclusion, citing the fact that no social inclusion spread explicitly addresses the maritime sector . As a result, the maritime industry is unsure of its role in the spread of social inclusion, and social inclusion visibility in all industries is generally low . A comprehensive assessment of social inclusion for the sustainable development of the maritime industry is still lacking. Introduction:
 Thus, this article explores how the spread of social inclusion in the maritime industry (the dependent variable) is influenced by the following independent variables: 1) workplace diversity and inclusion, 2) the workplace environment, and 3) a port's responsibility to society. The research question for this paper is: ""What curbs or drives the spread of social inclusion in the port and surrounding communities?"" Introduction:
 The paper is divided as follows. Section 2 describes the findings of the literature review. Section 3 presents the research methodology used in the study. Section 4 analyzes the results of the questionnaires. Section 5 discusses these results. Section 6 details the implications of the study for research and policymaking. Finally, Section 7 concludes by describing the study's limitations and insights into future research. Literature Review:
 Ports are, in general, more motivated to engage in social inclusion, and there are significant benefits to justify the development of a social inclusion strategy and reporting system. It is believed that a social inclusion system will improve a port's ethical standards, economic transparency, and efficiency. Specifically, spreading the ideals of social inclusion to employees and across organizational functions can promote loyalty, inspire innovation, and reduce risks ."
"Shipping and Globalization in the Post-War Era: Contexts, Companies, Connections","https://scispace.com/paper/shipping-and-globalization-in-the-post-war-era-contexts-4yicsfwb3y","2019","Book","Research Papers in Economics","Niels P. Petersson
Stig Tenold
Nicholas J. White","10.1007/978-3-030-26002-6","https://scispace.com/pdf/shipping-and-globalization-in-the-post-war-era-contexts-4yicsfwb3y.pdf","Without shipping and its ability to forge connections and networks of a global reach, the modern world would look very different. This introductory chapter provides a broad sketch of the relationship between shipping and globalization in the post-war era. Shipping was both an example and an engine of globalization in this period. It was among the first industries exposed to fierce globalized competition, and the shipping industry experienced and pioneered, mirrored and enabled key developments that led to the present-day globalized economy. Indeed, many of the organizational models and mechanisms that characterize the current corporate landscape grew out of the extremely mobile shipping industry.","combining social, cultural, political and economic approaches and encouraged dialogue with neighbouring disciplines. In particular, interest in economic history has increased due to the obvious importance that businesses, markets, infrastructures, and economic policies have had for global flows of all kinds. Conclusion:
 Deep-sea shipping is inextricably linked to notions of transnationalism and globalization. Over centuries, transnational and transcontinental spaces were opened up by ships and defined by shipping routes.  The integration of the world economy and world markets in the nineteenth century has been explained by the impact of low-cost transportation made possible by the introduction of steamships.  In his excellent history of Europe and the maritime world, Michael Miller presents maritime infrastructures as an essential ingredient in all key processes of twentieth-century history. At the same time, historians have studied the transformation of shipping from an activity recognizably anchored in specific nation-states into 'the world's most global industry'. Thus, the history of shipping can illustrate and illuminate the characteristics of different periods in the history of globalization and help explain the changes that occurred. Conclusion:
 This volume focuses on the transformations of the second half of the twentieth century. There has been considerable discussion on periodization as well as on how to characterize changes that have been summed up as the 'shock of the global'.  For both purposes, the question of continuity and change in the run-up to present-day globalization has been important. For Miller, the transnationalism of the maritime world and its cross-border networks underpins the continuity of globalization throughout the twentieth century, including the interwar years that are often regarded as a period of deglobalization.  Nonetheless, Miller also sees a switch, in the final third of the twentieth century, from networks that were Eurocentric, imperial, and fragmented to ones that were multipolar and almost seamlessly global. His account of the relationship between shipping and globalization in the twentieth century is a story of progressions and mutations rather than interruptions and new beginnings.  Miller focuses on the expertise that was available to overcome obstacles to global flows-but it is equally possible to highlight instead the variety and importance of such obstacles, and how they fell away once the old world of protected national markets, cargo liners and conferences gave way to that of liberalized world trade, container ships and cut-throat competition.  We have to take a closer look at particular contexts, companies and connections and find out about mutations, interruptions and new beginnings and how they relate to the wider histories of globalizations."
"Seamen on Late Eighteenth-Century European Warships","https://scispace.com/paper/seamen-on-late-eighteenth-century-european-warships-8dagej6ghk","2009","Journal Article","International Review of Social History","Niklas Frykman","10.1017/S0020859009000030","https://scispace.com/pdf/seamen-on-late-eighteenth-century-european-warships-8dagej6ghk.pdf","The Dutch navy barely managed to scrape together two-thirds of its manpower-requirements for the Fourth Anglo-Dutch War in 1780-1784, and Sweden suffered acute shortages of men during its war with Russia 1788-1790. European navies met this emergency by expanding their coercive recruitment systems to include groups previously safe from non-voluntary service at sea, and by allowing proportion of foreign-born seamen on-board their ships to expand. At the end of century, class-war was no longer a metaphor in wooden world of European warships. Seamen loved to talk about their lives, 'a subject', noted Melville, 'upon which most high-bred castaways in man-of-war are very diffuse', and the boredom of naval service gave them plenty of opportunity to do so. On half of the Dutch ships, the crews now rose on their officers, broke into the spirit-rooms, and nearly beat to death several of their shipmates who were known as Patriots. Keywords: eighteenth-century European warships; European navies; foreign-born seamen; man-of-war; mobilising manpower","population -and the substantial presence of Bohemians in the Dutch navy at the same time. This is, of course, merely suggestive, but similar developments can be observed in Ireland, where peasants flooded into the British navy, and rural France where they filled the lower decks of their own country's fleet. M O B I L I Z I N G M A N P O W E R:
 Many new seafarers also came from Europe's urban centers where capitalist deregulation, together with the imposition of the wage-form, smashed the moral economy of the guild system and released artisans, journeymen, laborers, and low-level intellectual workers into market freedom by the hundreds of thousands.  Wartime recession drove them into unemployment and to the brink of starvation. They were easy targets for naval recruiters. M O B I L I Z I N G M A N P O W E R:
 The largest group on board European warships, however, remained the men who were born and bred to the sea.  But these came from two relatively distinct sectors. One was made up of the men of the deep-sea trades who sailed out across the world's oceans to carry back capital and commodities to Europe's major port cities. These were the proletarianized mariners whose dreary lives were essentialized into the well-known stereotype of Jack Tar: deracinated, spendthrift, and impulsive. Their working conditions had been steadily deteriorating since the late Middle Ages, and by the late eighteenth century co-ownership of the cargo had been replaced with straightforward wage payments and limited collective decision-making with the almost boundless powers of the captain.  In the other sector, however, that of local fishing and short-distance merchant shipping, the patriarchal relations of old-regime rural Europe still prevailed. Crews were small, hierarchies flat, cargo ownership shared, and the powers of the captain limited both by custom and the force of communal disapproval in the home port, usually a small town or village where most of the crewmen lived with their families.  Movement between these two sectors was limited, but it appears that an increasing number of men shifted from the shallow-to the deep-sea trades in the later eighteenth century. Long years of naval service, with its socially corrosive and individualizing effects, often made this move one of permanent proletarianization. Many old seafarers struggled to reintegrate into landed society when the wars drew to a close. 42 M O B I L I Z I N G M A N P O W E R:
 Whatever their life may have been before -experienced mariner, landless peasant, or unemployed artisan -new naval recruits found themselves in a profoundly alien environment. Only very rarely in the eighteenth century did hundreds of men work together in one place, let alone at a single machine as they did on board a warship. Few people had experience with industrial labor discipline, and most barely accepted that the clock might have anything to do with when they ought to be working.  But coming into a warship, new recruits suddenly found themselves in a miniature mass society, physically isolated for long periods of time, with extraordinary levels of internal stratification, complex organizational structures, 24-hour work cycles, constant, close surveillance, and a terroristic justice system. This regime shock-proletarianized tens of thousands."
"Postmodern Maritime Human Resources Management – Amending the Maritime Labor Convention with Gender Requirements","https://scispace.com/paper/postmodern-maritime-human-resources-management-amending-the-3vvuexwkbc","2019","Journal Article","Postmodern Openings","Cristina Dragomir","10.18662/PO/53","https://scispace.com/pdf/postmodern-maritime-human-resources-management-amending-the-3vvuexwkbc.pdf","Postmodernism changes in the organizational behavior contribute to improving maritime sector, strongly affected by gender bias. In this paper is presented a study on the effects of intergovernmental external requirements, namely the Maritime Labor Convention (MLC), on human resource practices. The paper contains arguments for updating legal instruments and norms on maritime labor, with postmodern gender requirements. There are identified concrete steps needed for amending MLC with requirements necessary for improving the work of seafarer women. The results of the study are useful to establish further effective strategies on recruitment, retention of seafarers and on providing equal career opportunities for women seafarers. Beside a strategy for career attraction and development for women seafarers, updating MLC normative with gender requirements represent also an effective solution for women empowerment.","Title: Postmodern Maritime Human Resources Management -Amending the Maritime Labor Convention with Gender Requirements Authors: Cristina Dragomir (Corresponding Author) Keywords: women seafarers, labor, ILO, IMO, shipping, maritime transport Introduction:
 Compared to onshore human resources management, maritime human resources management has several particularities, occurred mainly by the particular working environment. Seafarers work in long voyages of several months, away from their family, friends and social communities. They work day and night in the same enclosed and definite space -the ship. In most of the cases, during long voyages medium age ships cannot provide any internet or phone communication facilities. In such situations ships are perceived as total institutions by the one that live within. These are the cases when seafarers have no mean of communication with the onshore society and they feel isolated, especially if they work in multinational crews with further language and cultural barriers. Such particular conditions of seafarers"" societal separation decrease the interest and the motivation for maritime labor and especially the interest and motivation of women for a seafaring career on board ship. Young generations, Millenials and Generation X of both genders prefer to work on shore, integrated within postmodernism social communities and familiar environment. In such conditions is manifested an acute decrease of maritime workforce. Introduction:
 A change in modern maritime human resources management is timely necessary, as in the next 10 years the world merchant fleet is expected to grow, together with the demand for seafarers. According to , the global demand for seafarers in 2015 was estimated at 1,545,000 seafarers, with the industry requiring approximately 790,500 officers and 754,500 ratings. In such conditions, Maritime Education and Training (MET) institutions have an important role in providing officers, as the current supply-demand situation reveals a shortage of 16,500 officers. The report also indicates the anticipated trend of an overall shortage in the supply of officers occurs despite improved recruitment and training levels and reductions in officer wastage rates over the past five years. Introduction:
 There were made previous IMO and United Nation""s initiatives in promoting women to join the shipping sector, through the United Nations Decade for  and IMO Women in Development Programme implemented starting with 1989. Introduction:
 However, modernism male-centred workplace culture and stereotypes from the maritime sector continues to influence in postmodernism the women""s choice to join or leave the sector. Though there are encouraging signs that the number of women in maritime professions is increasing, yet shipping remains a male-dominated industry. Literature review on postmodernism, maritime human resources management and gender:
 The new approach of this paper is to specify the particularities of postmodern human resources within the process of modernization, taking into account that postmodernism and transmodernism are often perceived as forms of the modern society. Such particularities are further discussed considering stringent societal needs, in particular for the maritime sector, as the gender bias."
"The ‘Yellow Danger’? Global forces and global fears in the North Sea and beyond (1600–1950)","https://scispace.com/paper/the-yellow-danger-global-forces-and-global-fears-in-the-2cnddisk8c","2015","Journal Article","The International Journal of Maritime History","Matthias van Rossum","10.1177/0843871415610502","https://scispace.com/pdf/the-yellow-danger-global-forces-and-global-fears-in-the-2cnddisk8c.pdf","Since direct shipping routes between Europe and Asia opened up at the end of the
15th century, the growing intercontinental and regional shipping connections resulted
in increasing entanglements between European and Asian maritime labour markets. This
article analyses the long term development of the connections between European and
Asian maritime labour markets and its impact on socio-cultural (and labour) relations
through three elements: first, the changing connections between European and Asian
maritime labour markets; second, the changing nature of European and Asian maritime
labour markets and its influence on the positions of sailors; and third, the changing
relations between European and Asian sailors and its effects on the reactions and
interactions in a globalising maritime labour market. It explores how these changing
global connections shaped encounters between European and Asian sailors on
(intercontinental) shipping in and from the North Sea region, and how it affected the
positions and reactions of its workers.","parties, attempts were made to introduce new health and safety regulations that would make it more difficult for foreign, especially Asian, seamen to work on European vessels. In some cases, the plea was heard to exclude non-European sailors from the fleet. Strategies and conflict:
 Other groups, often revolutionary organisations of European and Asian sailors, opted for the opposite strategy of internationalist solidarity by attempting to cultivate links between the two groups. International centres for seafarers irrespective of nationality and race set up in important port cities such as Rotterdam and Hamburg. In the principal Dutch port cities, Rotterdam and Amsterdam, radical European union leaders also tried to bridge the divide by directly contacting and organising Chinese and Javanese sailors. In the second half of the 1920s, these attempts were outpaced by initiatives aimed at selforganisation by Asian sailors and organisers, such as the communist Indonesian sailors' union Sarikat Pegawei Laoet India (SPLI).  The conflicts created by the employment of these different strategies reverberated until the Second World War. The war quickly disrupted this landscape in which nationalist and even racist strategies of exclusion were mainly employed by social-democratic unions and parties, while revolutionary and communist organisations aimed at more internationalist strategies of inclusion. After the war, the scene changed again, drastically, as the result of decolonisation, changing regulation, but also maritime industries going footloose through the construction of the flags of convenience. Conclusions -global forces, global fears:
 Forces of globalisation reshaped the maritime landscape of the North Sea region long before globalisation accelerated through the rise of steam shipping and global 34. Versus the explanations of Tabili and Wubben. communication networks. The moment of globalisation was not as unique as presented by Dutch 'modernist' labour unions in their racist campaigns against Asian sailors. The 1920s, or even the 1910s, were not the first moments in which connections were created between different labour markets around the world and sailors from different continents worked side by side. The stages of globalisation and integration can best be categorised according to the degree of connectedness of labour markets. Differing stages can be explained not only by technological developments, but also must be related to regulatory regimes and the actual recruitment practices that underpin these markets. Conclusions -global forces, global fears:
 It is important to note that other parts of the picture painted by European unions are deceptive as well. Asian sailors were portrayed as cheap and unorganised, employed in coolie-type relationships, and used by shipowners as a reserve force of labour with the intention to depress wages and hinder the organisation of European workers. By the time European and Asian sailors were pitched against each other in the globalised maritime labour markets of the early twentieth century, Asian sailors were indeed in a different position than Europeans. This, however, was not consequent upon backward, underdeveloped Asian societies -which supposedly were ripe for modernisation according to colonial narratives -and nor were Asian workers ignorant of labour markets, organisations and the representation of labour's interests. More likely, it was the actual consequence of the combined influences of high colonialism and capitalism that actively worsened the position of Asian maritime workers during the nineteenth century."
