"Paper Title","Paper Link","Publication Year","Publication Type","Publication Title","Author Names","DOI","PDF Link","Abstract","Relevant Excerpt"
"The mobilities, immobilities and moorings of work-life on cargo ships","https://scispace.com/paper/the-mobilities-immobilities-and-moorings-of-work-life-on-1z9h8c3dlp","2012","Journal Article","Sites: a journal of social anthropology and cultural studies","Maria Borovnik","10.11157/SITES-VOL9ISS1ID194","https://scispace.com/pdf/the-mobilities-immobilities-and-moorings-of-work-life-on-1z9h8c3dlp.pdf","Despite the rather obvious mobilities of cargo ships there are not so obvious immobilities. Both are negotiated through global economic processes, the (ir)regular and repetitive processes of ships crisscrossing international waters and encountering ports of differing nation states, and the agency of people involved in these processes. This paper argues that so called fixities within a mobilities approach do not only enable mobile processes, as assumed widely within mobilities research, but that mobilities also can become immobilising. The circumstances of these immobilising dynamics are linked with neoliberal processes within the shipping industry, the need for increased border security, and the need for workers from developing countries to compromise their employment conditions. In contrast to these paralysing factors this paper also discusses the enabling and anchoring mooring processes by linking these to a positive view on social construction of place.","seafarers are quite keen on their products, and tell me that this is definitely the cheapest one can get anywhere but one has to watch out for good quality and bear with some lemons (Journal entry, 13 January 2010). IMMobIlItIes:
 The above examples show how the 'static' of the port environment has moved onto the 'mobile' ship; hence, spatial arrangements have created a routine in which the port and ship momentarily overlap. The degrees of 'intensity of staying' are in this case dependent on the (ir)regularities of the transversal loops that the ship to shore movements create when engaging in international trade routes. in comparison to normark's (2008) fuel station, and morris' (1988) motel, this situated accomplishment then refers not only to the accomplishments of the industries and histories involved, but includes a multinational overlap between local trade and social interactions, political structures of border security and the fragmented global cosmopolitanism of seafarers. The repetitions of such interactions construct an experience of the familiar, which provides a sense of stability and certainty. This familiarity links with merriman's ( ) also land-based observations, where social constructions -or situated accomplishments -perform landscape rather than criss-crossing landscape. conclusIons shipping is quite obviously a highly mobile industry, symbolised not only by transversal movements across international waters, but also by the temporary assemblages of material and people. The technologies of the shipping industry both constrain and enable. Trade in merchandise operates in a time constraint space, where competition fuels modes of transport with ever increasing need for speed and fast turnarounds. This increased speed, which is caused by the enabling facilities of the transport and communication sectors within globalising processes, affects the different fields of mobilities. These effects can be demonstrated by the argument that mobility is 'part of the process of social production of time and space , and that both people and material are 'on the move' , that people travel more globally, that they travel further and faster, and both rich and poor find some '""way of life"" across the globe' . furthermore, scholars engaged with the 'mobilities paradigm' have emphasised mainly on the enabling factors of fixity as a necessity for mobility."
"Challenges and potential of technology integration in modern ship management practices","https://scispace.com/paper/challenges-and-potential-of-technology-integration-in-modern-2micarrz3j","2013","Dissertation","","Suresh Bhardwaj","","https://scispace.com/pdf/challenges-and-potential-of-technology-integration-in-modern-2micarrz3j.pdf","This paper is based on the research project that ex plores the challenges and potential of technology i ntegration in current ship management practices. While technology advancements were designed to be contributing to m inimising task complexity, issues such as fatigue, increased dministrative burden and technology assisted accid ents still plague the industry. In spite of the clearly recognisable enefits of using modern technology in the manageme nt of ships, in practice its application appears lacking by a consi derable margin. The main driver of the study was to appreciate the cause of this disparity. The study first reviewed a wide body of literature on issues involving the use of technology which inc luded academic literature with empirical evidences and th eoretical explanations of implementation of technol ogy at work. With the help of the extant knowledge this research embarked on providing an explanation to the gap th t existed in the application of technology in the shipping industry. By taking a case study approach the thesis looked into the induction and integration of technology in the management and operation of ships that primarily interfaced close ly between the ship and its management unit on shore. Three compan ies with mutually diverse management setup were stu died. The fourth case comprised of purposefully selected seni or members of ships’ staff. The analysis of the data revealed that the manifest ation of the gap in technology implementation is ca used by deeper influences at work in the shipping industry. The un-optimised technology integration results in the seafarer, who is the keystone to the technology application, beco ming a victim of the circumstances. The technology that was intended to ease operations and burdens ends up in controlling him, even leaving him under-resourced a n causing fatigue. This was not an unintended outcome but the result of weak regulatory practices, short-term ca pital outlook and weakened labour practices in the shipping industry all caused by wider social and economic development s affecting not just this industry but businesses globally. The imp act of such influences was however more acute in th is industry resulting in such extreme consequence. By bringing to light the limited application of som e fundamental principles of human-systems integrati on, this study has attempted to expand the boundaries of res earch on the subject and contributed to the holisti c understanding of the various underlying factors that influence techn ology integration in ship management processes.","comes out glaringly is that the seafarer, who manages technology for optimum performance of the sole productive unit the ship, and on whose performance the profiteering of the myriad of actors in the industry hinge, finds himself as the lowest priority. Technology integration gap rationalised:
 The explanation once again lies in the outcome of economic globalisation that underpins the state-capital-labour relationship. The increasing dependence of national economies on the global economic flow of investments sees financial capital play off one territorial jurisdiction against another to gain optimum return including labour that is cheaper, more flexible and more easily subjected to hard work. As nations compete amongst themselves the content of their labour laws are watered down to the detriment of their workers including those that protect their rights . Even  has conceded that while there is improvement in global production systems, globalisation has impacted work and worker relations, compromising the observance of core labour standards. A growing amount of literature on social dimensions of globalisation shows that many are wary of the so-called benefits of globalisation . Labour fortunes are undermined by an ideological discourse that upholds profit as a sign of efficiency that will generate the required levels of productivity to sustain economic growth for national development. To succumb to labour demands or interests would render an economy inefficient and directed towards failure, thus making out labour 'standing in the way' of national progress if it insists that its interests should be considered. In this way, while globalisation is about removing state restrictions on capital, it seeks also to control labour by making believe that social protection and job security are uneconomic and inimical to economic growth .  asserts that such economic policies that purport to separate efficiency issues from equity treat labour as a commodity and runs counter to the interest of workers. 'Labour market flexibility' and 'capital market flexibility' appear as symmetric policies but they have very asymmetric consequencesand both serve to enhance the welfare of capital at the expense of workers. Lack of consultation with seafarers in the use of shipboard technology, discarding the user perspective in the development of such products and requiring seafarers to merely adapt and comply once the technology is implemented as this study reveals, can all be explained by the wider developments discussed above. It corresponds to the statements made earlier  of the shipping industry where a widespread laissez-faire approach has resulted in significant restructuring of its labour market to the detriment of the seafarer."
"Life Would Have Been a Thousand Times Simpler if I Were Not a Seafarer","https://scispace.com/paper/life-would-have-been-a-thousand-times-simpler-if-i-were-not-90o30b1a","2022","Book Chapter","","","10.4018/978-1-7998-9039-3.ch002","https://scispace.com/pdf/life-would-have-been-a-thousand-times-simpler-if-i-were-not-90o30b1a.pdf","This chapter examines skills retention in the British shipping industry. In doing so, the chapter explores the impact of the COVID-19 pandemic on seafarers as individuals and the potential for serious repercussions of such impact for the UK seafaring industry as a whole. The findings indicate a clear need for a coordinated effort from the key stakeholders, including national government and shipping companies, to work together to support the seafaring labour force. Providing sufficient support has the potential to mitigate the risk of increasing numbers of seafarers leaving the profession and reduced numbers choosing to join it, both of which could have profound consequences for the industry and more widely. ","pandemic -such as delayed repatriation -they have not received any support from the UK Government. Many have also received no meaningful support from their employers either. Instead of support, many British seafarers have experienced widespread indifference from the industry. DISCUSSION:
 Our findings indicate a clear need for a co-ordinated effort from the key stakeholders, including national government and shipping companies, to work together to support the seafaring labour force. Such efforts need to be sufficiently flexible to meet the varying needs of different groups of seafarers and take into account what the seafarers themselves say would help. For example, those who have been made redundant or have not had employment contracts renewed would benefit from financial support. Those who have been at sea onboard vessels which -contrary to normal operations -have remained in UK waters need additional support accessing the SED scheme. Whilst this chapter does not purport to have all the answers, it clearly indicates that there is much could be done to better support the British seafaring labour force. In addition, it has shown that providing sufficient support has the potential to mitigate the risk of increasing numbers of seafarers leaving the profession and reduced numbers choosing to join it, both of which would have serious repercussions for the industry and more widely. CONCLUSIONS:
 This chapter adds to an emerging body of literature which focusses on the impact of the COVID-19 pandemic on various workforces. It has explored the impact of the pandemic on seafarers as individuals and the potential for serious repercussions of such impact for the UK seafaring industry on a whole. Like all studies, this research was not without limitations. Firstly, a degree of selfselection is likely to have occurred owing to the research method utilised and consequently those seafarers who chose to participate may have done so owing to their own particular experiences. Secondly, the findings may not fully reflect the experiences of seafarers employed at the 'poorer end' of the international seafaring industry as the participants are solely British seafarers, who tend to be employed at the 'better end' of the industry. CONCLUSIONS:
 Nevertheless, the study has identified potential issues as a result of the COVID-19 pandemic in relation to skills retention in the seafaring industry. This is worthy of the attention of the industry's stakeholders in itself. Moreover, the study has highlighted some of the ways in which the pandemic has thrown a range of pre-existing concerns held by seafarers into starker contrast and exacerbated the impact of the structure and organisation of their employment and work on seafarers' wellbeing. This is far from unique to seafaring (see, for example, Walters 2021). So whilst our research has focused solely on the seafaring labour force, the experiences of seafarers and the broader impact of the pandemic, particularly the ways in which it has highlighted pre-existing concerns, issues and inequalities in relation to their work and employment, are likely to be mirrored among a range of workers who have played vital roles during the pandemic but remain 'forgotten'. The authors wish to thank all those who participated in this study. This research was funded by the Solent University COVID-19 support fund, the Merchant Navy Welfare Board (UK) and Nautilus International."
"Communication skills and cultural awareness - model course","https://scispace.com/paper/communication-skills-and-cultural-awareness-model-course-28h3igdq6s","2007","","","Altaf Ur Rehman","","https://scispace.com/pdf/communication-skills-and-cultural-awareness-model-course-28h3igdq6s.pdf","iv","competitiveness, shipping companies were striving for reducing the operational cost. This was dealt by flagging out, merging of big companies and employment of skilled/unskilled but cheap labour from the developing countries. This had a tremendous effect on the safety and training. Shipping Companies:
 On the other hand, IMO and other legislative bodies became active and lot of rules and regulations were adopted to apprehend the global situation in the shipping industry. As the industry grew, modern shipping management concept emerged. Efforts are being made by the ship-owners to train seafarers. ""There is no doubt in my mind that manpower, training and all of the wider issues connected with human resources in shipping will become the biggest challenge that the industry and all those connected with it will face over the coming years"" (Efthimios) Shipping Companies:
 Shipping industry and the ship owners are not striving hard for the development human resources with few exceptions. Every one is trying to pass on the training burden to the other's shoulders. MET institutes at their own can not cop up with the increasing demand of trained and skilled seafarers unless they are supported by the shipping industry morally and financially. At a seminar called ""Human factors-seafarers focus"", Rajaish Bajpee accused owners of shoddy treatment of seafarers, saying that they were prepared to spend large amount of money on their ships but not on their mariners. Shipping Companies:
 (the sea, 2007, p. 3) Seafarers:
 Human resource management (HRM) has become a key tool in the success of any industry. ""As we develop the required human resources, one crucial group will be our seafarers. With out the contribution of seafarers, half of the world would freeze and the other half would starve. This underscores the important role of these people who work on the frontlines of maritime transportation""(Yohei . Seafarers:
 Seafarers are the key players but the most neglected part of the shipping industry. Life and dignity of seafarers is at stake. IMO had been working with ILO and other concerned organizations to resolve these issues. It is not in the scope of this dissertation."
"A Study of the Results of Coronavirus (COVID-19) on the Nigerian Maritime Workers","https://scispace.com/paper/a-study-of-the-results-of-coronavirus-covid-19-on-the-4br4d7xdwj","2020","Posted Content","","U. J. Okeleke","10.21467/PREPRINTS.176","https://scispace.com/pdf/a-study-of-the-results-of-coronavirus-covid-19-on-the-4br4d7xdwj.pdf","Findings have shown that the recent lockdown of the economy and restriction of movements in Nigeria, due to Corona virus (COVID-19) pandemic, seriously affected the Nigerian shipping, Aviation industries, Land transport sector, Financial, Health and Educational sectors. Import and export operations were hampered. The Nigerian maritime workers; mariners and seafarers were mentally and psychologically disturbed. Some were stranded in their various workplaces; aboard ships, platform rigs and stayed beyond their agreed contractual terms. They, therefore, lack social support from their family members and friends. Similarly, they had little or no support from their management, who were more concerned about contract execution than the welfare of their work force.  This paper, however, is supporting the recommendation that the living and working conditions of the Nigerian Maritime workers and seafarers stranded and those whose salary and promotion arrears have not been paid during this pandemic should be given utmost attention. This should include applying pragmatic approach on the facilitation of sea workers’ health insurance schemes and incentives.","scientists usually consider whatever happens ""at sea"" and ""on board"" as something spaced out and unrelated to what happens on land, or, in the best of cases, as a preparatory phase for the real life that takes place on land. The Sea as a Social Space:
 To a certain extent this is also true about how the maritime industry see seafarers. Training of seafarers' bears testimony to this as it is only concerned with the technical side of seafaring as if life at sea is separated and removed from the emotions, ideas, feelings, behaviour, needs and values landbased people experience. The inability to recognise the sea as a social space is the root of the ever expanding divide between seafarers and the recognition that they are human beings. The Sea as a Social Space:
 Coco (2013:9) makes a case that the sea is not only a medium but a social space, which could not be merely 'used by society' but rather represent 'a space of society'. This social space is complex in nature, not only because of relationships with fellow crewmembers from different backgrounds, religions, ethnicity and social standing, but also because this social space is filled with relationships that span across the globe and connects them to families, friends and communities in an often constrained and misconfigured way. The Sea as a Social Space:
 As a first step in working towards a new conceptual framework for the training of seafarers, it must be acknowledged that this framework, as well as the shipping industry as a whole, is set within a social space that is unique, but in the same breath shares the emotions, ideas, feelings, behaviour, needs and values of land based people. This may seem too obvious a statement, yet there is painfully little evidence of addressing the human side of seafaring in the curriculums of maritime institutions and the operations of shipping companies across the globe. The neglect of the human side comes at a hefty price. Not only do companies run massive financial losses, but through ignorance of the human factor the most valuable asset in the shipping world is a neglectedhuman beings themselves."
"Human resource management practices in human resource management practices in human resource management practices in human resource management practices in human resource management practices in shipping comp","https://scispace.com/paper/human-resource-management-practices-in-human-resource-31i74nbyme","2007","","","Subhash C. Kundu
Divya Malhan
Pradeep Kumar","","https://scispace.com/pdf/human-resource-management-practices-in-human-resource-31i74nbyme.pdf","HE need of organizations for people and people for organizations will be more difficult to satisfy in the today’s competitive business environment. Firm’s competitive advantage could be generated from human resources (HR) and firm performance is influenced by a set of effective HRM practices. In this study, we intend to assess the HR practices in shipping companies. Primary data based on 250 observations from 125 shipping companies was analyzed to bring out the human resource management practices practiced in shipping companies. Factor analysis brought about five factors, which were further analyzed. Two factors namely ‘training and performance appraisal’ and ‘hiring and compensation system’ emerged very strong HR practices followed by ‘career development’. ‘Job analysis and HR planning’ was moderately practiced in shipping companies. ‘Workforce diversity and flexi-work system’ also showed presence but did not emerge as strong practice.","modes of transport (www.marisec.org/ flag-performance). Much of the attention in services has been found on the professional, financial and telecommunications areas. Sometimes forgotten is the fact that the physical transportation of goods in international trade is itself a service . Literature Review:
 In the last half century, the shipping industry has experienced a massive expansion in demand reflecting the growth in volume of seaborne trade, a growth to which technology has responded with, for example, the introduction of containerization and gas-carrying capacity. There have also been changes in the organizational structure with the appearance of management companies, and the extension of 'flagging out' and 'second registers' . Movements combined with changes in regions where the recruitment of seafarers took place from their home nation to be put onto an international recruiting basis, with the development of the Asian labour market. Despite all these comparatively rapid and profound changes in the industry, labour is the primary factor of production and is still organized on board ship on the basis of a steep hierarchical structure of officers and ratings-a construction that developed from the changeover from sail to steam propulsion half a century or more earlier . Literature Review:
 During the last decade or so, force majeure events have directed the shipping industry to focus on its sea-going manpower. The on-going issues have been both concerned with quality and quantity of seafarers. These concerns have been reflected in the increasing amount of academic work and international legislation on the so-called 'human factor'. However, there are still many facets of it that have not been explored and that might give a better understanding of the maritime manpower system (Obando-rojas, Gardner and Naim, 1999). Competitiveness in many sectors of the maritime industry may be achieved through the efficient and effective organization of a firm's economic resources. Neo-classical economic theory suggests that these resources include land, labour and capital . Literature Review:
 Effective human resource practices lead to competitiveness. Literature Review:
 Job analysis is the process of obtaining information about jobs i.e. information about the tasks to be done on the job, as well as personal characteristics (education, experience, specialized training) necessary to do the tasks. Job analysis are essential for sound HR management as they provide a deeper understanding of the behavioral requirements of jobs in turn creating a solid basis to make job-related employment decisions . Change in profile of jobs is happening speedier than in the past and absence of job analysis data can cost organizations dearly. Hence, job analysis exercise should be conducted at regular intervals . The process of analyzing and identifying the need for and availability of human resources for organization to meet its objectives is human resource planning . Human resource planning is not only concerned with 'hard issue' of acquiring the right number of personnel but also with the 'soft issue' of quality of manpower including creativity, innovativeness, flexibility, risk taking and problem solving ."
