"Paper Title","Paper Link","Publication Year","Publication Type","Publication Title","Author Names","DOI","PDF Link","Abstract","Relevant Excerpt"
"Dealing with multicultural human resources in a socially responsible manner: a focus on the maritime industry","https://scispace.com/paper/dealing-with-multicultural-human-resources-in-a-socially-40j56stnp0","2011","Journal Article","WMU journal of maritime affairs","Maria Progoulaki
Michael Roe","10.1007/S13437-011-0003-0","https://scispace.com/pdf/dealing-with-multicultural-human-resources-in-a-socially-40j56stnp0.pdf","Shipping companies’ crucial need for cost cutting is their main motive for recruiting seafarers of various nationalities and formulating multicultural teams on board ships. This paper seeks to examine ways of dealing with cultural issues by being a socially responsible company. The main point of the research is to examine how managing multicultural crews is related to the shipping companies’ and the industry’s social responsibility. An extensive literature review on the cultural issues of maritime manpower, with a focus on the working and living conditions and the management of shipping crews, reveals important aspects of the subject. This analysis is enriched with qualitative data from an on-board case study, and from a survey among crew managers and manning agents. Results show that managing multicultural human resources in a socially responsible manner requires socially acceptable behaviour towards seagoing labour from all the industrial actors.","Title: Dealing with multicultural human resources in a socially responsible manner: a focus on the maritime industry Authors: Maria Progoulaki,Michael Roe Keywords: Human resources, Social responsibility, Multiculturalism, Seafarers Introduction:
 Shipping companies are the ""front-runners of globalisation"" . Shipping can be characterised as largely international and the most global industry. A series of structural changes or ""waves of evolution"" (Sletmo 1989) transformed the world's shipping industry to today's globalised character. The third 'wave' indicated the internationalisation of shipping through flagging out and the increased dependence upon manpower from developing countries. Finally, the evolution of modern ship management came through the expertise of ship management companies in operating efficiently and reducing variable costs; this was achieved with a combination of recruiting low-cost labour from developing countries, the de-flagging method, and drawing on Western technology and capital.  argue that the long period of ruinous economic competition in the shipping industry had far reaching effects on capital, management and labour. A spate of corporate mergers and takeovers across national boundaries was provoked, along with the evolution of ship management companies and crewing companies providing specialist management and labour recruitment services to owners. In respect to labour, transnational employers reduced variable costs by intensifying the use of labour through reduced crewing levels, extended working hours and registering vessels under a ""flag of convenience""  or ""open registries"" associated with lower regulatory costs, weak labour rights and lower wage levels. At this point, one should take into consideration the fact that the world's largest fleets are attached to either open or second registers, and the nationalities of these fleets' crew do not correspond with the flags of their ships . Over the last 25 or more years, 80% of the world merchant fleet has been manned with multicultural and multilingual crew , while, as  mention ""65% of the world fleet uses multicultural crews, while over 10% of the fleet is manned with crews of more than five different nationalities""; this sets the matter of multiculturalism and the management of culture under the spotlight. Introduction:
 This paper presents thoughts and raises questions stemming from an overview of the cultural issue among shipping crew. Culture can be defined as ""the shared ways groups of people understand and interpret the world (…) Culture is a collective phenomenon that is about shared values and meanings"" (see . The paper discusses those thoughts from the viewpoints of the industry's share of social responsibility, the shipping companies' and other actors'. Furthermore, results of an on-board case study and a survey among crew managers and manning agents give a further view of the issue; the one that seafarers are facing today on board. The following section introduces the reader to the issue of corporate social responsibility and its application in shipping. The management of the cultural issue and an analysis of the working and living conditions of multicultural crew are further presented. Section 4 presents the methodology, while seafarers', crew managers' and manning agents' attitudes and opinions are discussed in Section 5. The last section gives the conclusions and suggestions for further research."
"Preliminary Material","https://scispace.com/paper/preliminary-material-2p4gmlb8","2022","Book Chapter","","","10.1163/9789004503410_001","https://scispace.com/pdf/preliminary-material-2p4gmlb8.pdf","","and conduct a closer exploration of over half a century of Polish maritime sociology. They also discuss the socioeconomic and ideological context in which the regional emergence and development of the discipline took place, which is currently experiencing increased interest among scholars both in Poland and internationally. Organisation of This Volume:
 Seung Kuk Kim, in the second chapter, proposes to conceptualise maritime spaces from the perspective of posthumanist and post-materialist theories, combining these approaches with East Asian classical thought. The maritime space, in this conception, is to be understood as 'a hybridising and hybridised' actor interacting as an 'ocean of hybridisation' with other nonhuman and human subjects in a multiscalar way. Thus, the author postulates a more humandecentred approach to oceans. He believes that thanks to the process of ocean hybridisation, many contrasted binarisms can be overcome (like individualism vs collectivism, material vs ideal) and lead to the emergence of a single oneness. The author's inspirations are both the Asian spiritual heritage of Taoism and Buddhism, especially the Taoist 'Book of Changes' , and Western sociological (meta)theories like the idea of multidimensionality of Jeffrey Alexander. According to Kim, together with the decline of the West, terrestrial sociology declines, and the era of Asia and oceanic sociology is coming. Organisation of This Volume:
 Part two contains theoretical and empirical examinations of the port city as a maritime social space. Robert Bartłomiejski and Maciej Kowalewski state that classical concepts describing port cities usually limit their analysis to either the economic, historical or cultural aspect. However, recent studies show that recent global developments offer a new context in which ports are increasingly separate from, but also transcend, cities. The authors present dif-ferent approaches to explore the connection between the sea, port cities and maritime communities, e.g. marinisation theory developed by Polish maritime sociology, the perspectives of environmental sociology and human ecology, as well as attempts to establish a sociology of the coast. In doing so, they conceive of today's coasts as post-productive places that are less connected to the maritime industry than to consumption, recreational infrastructure and serve as spaces for cultural and ecological activities. The sea, the authors argue, 'regulates processes that translate, mediate and control the course of metabolism between environment and society' . Following these theoretical considerations, the authors propose a research programme for the application of the Actor-Network Theory to the study of port cities."
"Investigation into an optimal model for a maritime education and training system amongst the European Union member states in the light of international legislative instruments and new technologies","https://scispace.com/paper/investigation-into-an-optimal-model-for-a-maritime-education-1jy9wxg29z","1999","","","Alexander G. Alexandrov","","https://scispace.com/pdf/investigation-into-an-optimal-model-for-a-maritime-education-1jy9wxg29z.pdf","Investigation into an optimal model for a Maritime Education and Training System amongst the European Community member states in the light of the international legislative instruments and new technologies Degree: Master of Science This dissertation is a study of the Maritime Education and Training (MET) systems in the European Community member states in the light of international legislative instruments referring to maritime education, and of new technology developments. The research focuses on synthesising an optimal model for MET systems with some particular parameters. A general study is made of the environment where MET systems operate, and on factors which have an impact upon them. International Maritime Organization (IMO) Conventions and European Commission (EC) Directives are examined. A brief survey and analysis regarding some trends and developments in the shipbuilding industry, ship operations and education technologies and methodologies is conducted. All these aspects are examined in relation to past, present and future eras of operating MET systems, and where a created model could be established and put into effect. An investigation of the information collected in the EU METHAR research project, followed by some additional calculations is undertaken. A quantitative model base and its parameters are determined to support the model hypothesis. The author's understanding of the seafarer's profession and arguments presented are used to justify cohesive links between different levels and make the appearance of the model structure feasible. The results are collated and evaluated through a number of conclusions, which highlight the proposed optimal model of a MET system. A number of recommendations place emphasis on the necessity of the MET systems to adapt to the changes in the society and the maritime industries. A message is sent that a way this could be achieved is by more open international co-operation.","career cannot be over-emphasised. Shore-based shipping activities are to a significant extent undertaken by ex-seafarers and a shortage of the latter can have detrimental effects on the efficient management of shipping companies and on preserving the necessary shipping know-how. Maritime transport and its global role:
 This type of education should be jointly funded by shipowners, governments and possibly by Community resources, and apart from being self-fulfilling for the seafarer it can contribute in making a seafaring career more attractive. Furthermore, the level of education and training facilities should be upgraded and programmes co-ordinated among Member States. This would make the transferability of sea-going labour between Member States easier and would tend to even out disparities in remuneration and thus in the cost structures of European shipowners. The curriculum should comprise subjects such as maritime economics, law, logistics, and in general, subjects pertinent to the efficient management of modern shipping company. • The changing industry:
 The considerable independence and isolation of seafarers has been diminished • The changing industry:
 and partly replaced by dependence and integration. Although seafarers of today continue to be physically separated from the shore, they are integrated into a scheme of close supervision and control from the head office. Shipping is no more an independent and isolated industry. Transport by sea has become part of a transport chain from sender to receiver. Intermodal transport has reduced the weight and importance of particularities in shipping which made this part of the transport industry so special. The traditional shipowner has increasingly disappeared. Shipping companies today are owned by transport companies or, in many cases, are used as a form of investment by enterprises, which have no traditional relationship to the maritime industry. This sort of anonymity of ownership is matched by a change of attitude on board. Seafarers do not refer to ""my ship"" anymore but to ""this ship"" or ""the company's ship"". • The changing industry:
 The main reason for the change is the exacerbating competition in sea transport. • The changing industry:
 It has given economic matters greater importance than ever before. The rapid progress in technology has provided shipping companies, ports and other maritime enterprises with opportunities to bring about change and to maintain and increase their competitiveness. • The changing industry:
 Modern technology allows head offices to stay in permanent contact with ships. • The changing industry:
 The ship's Master and officers take hardly any economic decision anymore. Their influence on the stowage of cargoes on board is reduced and is nil for some types of vessels, e.g. container vessels. Another result of the availability and increased use of modern communication technology is that radio officers could be made redundant. • The changing industry:
 Progress in technology has also facilitated the building of highly specialised ships, the operation of which requires special qualifications from their masters, officers and ratings. The work of the ship officer could be limited to the operation of the ship, and to a limited and probably even further decreasing extent to maintenance or preventive maintenance of ship equipment. The range for economic decisions on board has in most cases been reduced to those, which are connected to the movement of the ship. The master leads an overseas transport. Considering the costs of ship and cargo the Master could be seen as in charge of a costly, complicated and complex process and enterprise."
"Workplace fiddles in the shipping industry","https://scispace.com/paper/workplace-fiddles-in-the-shipping-industry-1xyy5va411","2020","Journal Article","Employee Relations","Helen Devereux
Emma Jane Kirsty Wadsworth
Syamantak Bhattacharya","10.1108/ER-07-2019-0294","https://scispace.com/pdf/workplace-fiddles-in-the-shipping-industry-1xyy5va411.pdf","The purpose of this paper is to examine the ways in which workers employ rule breaking, rule bending and deviations from management defined norms in the workplace and the impact this has on their occupational health and safety (OHS) experiences.,The paper uses qualitative semi-structured interviews conducted with 37 seafarers working on board four vessels engaged in international trade. The data were recorded, transcribed and thematically analysed using NVivo software.,The findings indicate that seafarers utilised workplace fiddles – which included rule breaking, rule bending and deviating from management defined norms – in order to engender a workable system in which they could remain safe but also profitable to those who controlled their labour. Moreover, the findings suggest that shore-side management deflected the responsibility for rule violations by deferring many of the decisions regarding features of life on board – such as the scheduling of work hours – to the senior officers on board.,The paper sheds light on where, in practice, responsibility for OHS lies in the international shipping industry, an industry in which workers experience relatively high rates of work-related fatalities, injuries and mental health conditions.","Title: Workplace fiddles in the shipping industry Keywords: Employee behaviour, Group behaviour, Occupational health and safety, Seafarer"
"“Blue” social capital and work performance: anthropological fieldwork among crew members at four Danish international ships","https://scispace.com/paper/blue-social-capital-and-work-performance-anthropological-xsynn2rh8q","2013","Journal Article","WMU journal of maritime affairs","Sisse Grøn
Gunnar Lind Haase Svendsen","10.1007/S13437-013-0041-X","https://scispace.com/pdf/blue-social-capital-and-work-performance-anthropological-xsynn2rh8q.pdf","One outcome of globalization is an increasing number of seafarers, who seldom are members of the same crew two voyages in a row and must cooperate with seafarers from many countries (Progoulaki and Roe WMU J Marit Affairs 10:7–23, 2011). This situation challenges the level of social capital on board, i.e., the resources inherent in network cooperation associated with norms of reciprocity and trust (Putnam 2000: 19). Fragmentized “blue” social capital should, however, be restored, as work performance depends on the quality of cooperation among crew members horizontally, as well as between crew members and the shipping company vertically. Drawing on anthropological fieldwork data from four Danish international ships, the purpose of this paper is to offer a new theoretical framework for analyzing cooperation among crews. Our inductive empirical findings suggest that a balance between three types of social capital—bonding, bridging and linking—is needed to achieve a high-performing work system (Gittell et al. Organ Sci 21(2):490–506, 2010). Hence, the main actors within the shipping sector should take “blue” social capital into account to increase work efficiency and economic performance.","talked about the two different perspectives (the cook's words): How the ratings do not consider that the officers get orders from the shipping company, and that it is difficult for the ratings to speak openly as they are constantly afraid of losing their jobs. Report from the field:
 We end this report from the conflict zone with a record of the unproductive consequences of job uncertainty and infected work relations, as explained in an interview with the first engineer, who had difficulties in getting the information he needed to keep the machines running smoothly: Interviewer: I have heard that the company is chasing near misses, and that you are scolded if you do not make any. ""Blue"" social capital and work performance might say that it was someone from the last shift. And sometimes, then something has happened that makes one think: why on the earth did you do that? They do not tell if they break something. Report from the field:
 Interviewer: That's quite peculiar. It is exactly the same I hear about Filipinos. Report from the field:
 First engineer: It is exactly the same here [among the Danish crew]; they do not tell. Report from the field:
 To summarize, in this ship, we see a configuration of social capital in which the working environment is so infected by conflicts that social capital is missing, and the effects on productivity and safety on board are severe (Fig. ). Conclusion:
 Most people in the shipping sector know that poor cooperation on board or between crews and shipping companies lowers work performance and profitability. Lack of cooperation within a crew may even threaten safety on board. This tendency is reinforced by increased globalization, which entails that seafarers are seldom members of the same crew two voyages in a row and therefore have to cooperate with a multitude of colleagues whom they do not know and whose primary language they may not understand (Progoulaki and Roe 2011). However, the fact that everybody knows about such problems does not mean that everybody knows what to do about them. Hence, we wanted to answer the question: How can fragmentation of ""blue"" social capital due to globalization be counteracted? Conclusion:
 The particular importance of cooperative skills in this sector makes it reasonable to talk about a specific type of maritime social capital, or ""blue"" social capital. Here we have understood ""capital"" to be wealth that renders its owner revenue without immediately being destroyed itself in the production process and ""social capital"" as an intangible form of capital consisting of resources inherent in network cooperation associated with norms of reciprocity and trust  which-unlike tangible assets-increases with use."
"Compressing Time and Constraining Space: The Contradictory Effects of ICT and Containerization on International Shipping Labour","https://scispace.com/paper/compressing-time-and-constraining-space-the-contradictory-27e06vxmsr","2003","Journal Article","International Review of Social History","Helen Sampson
Bin Wu","10.1017/S0020859003001299","https://scispace.com/pdf/compressing-time-and-constraining-space-the-contradictory-27e06vxmsr.pdf","The twentieth century has been a period of rapid change in terms of production and consumption, work, and employment. Much of this change has been driven by developments in technology or the application of new technologies to existing production systems and ways of ordering and organizing work. In characterizing such change, Schumpeter popularized the term innovation. In viewing innovation as the main engine of economic growth, Schumpeter was interested in the idea of the entrepreneur as innovator, not simply in terms of an agent for the introduction of new inventions but more broadly as an organizational innovator introducing new systems of work, new products, and new forms of production.","indeed another sail. They typically experienced feelings of isolation and boredom and could be tremendously uplifted by the sight of the shore or another ship, as Franklin described in 1726 when recounting his ''tedious'' voyage from Southampton to Philadelphia: There is something strangely cheering to the spirits in the meeting of a ship at sea, containing a society of creatures of the same species and in the same circumstances with ourselves, after we had been long separated and excommunicated as it were from the rest of mankind. My heart fluttered in my breast with joy when I saw so many human countenances, and I could scarce refrain from the kind of laughter which proceeds from some degree of inward pleasure.  For very different reasons, modern seafarers are similarly removed from land and often have a similar sense of space and time. Whilst working conditions, wages, and standards of health and hygiene have improved across the industry, seafarers in the twenty-first century once again find their lives at sea to be characterized by isolation, tedium, and confinement. They too experience a sense of ''excommunication'' and separation. As an oiler involved in our ethnographic study aboard one vessel explained: ''[It's] like a prison. You eat and then you work [:::]. Yes, like a prison. You don't go ashore.'' 6 M E T H O D:
 This paper draws on the preliminary findings of a pilot study undertaken by Sampson in the Port of Rotterdam at two modern container terminals. The study involved the analysis of secondary data and visits to two modern container terminals -one engaged in short-sea, and one engaged in deepsea trade. This was followed by an ethnographic study of the Tetra deepsea container terminal, 7 incorporating in-depth tape-recorded interviews with terminal employees (largely in supervisory or management grades), with a terminal-based representative of the shipping line, and with senior officers aboard vessels calling at the terminal in the course of the week. Additionally, the paper draws on the findings of seven ethnographic research voyages undertaken as part of an ESRC-funded project on transnational seafarer communities (ESRC ref: L214252036). In the course of these, seafarers of all ranks and varying nationalities took part in detailed tape-recorded interviews focusing on life and work aboard, rigorous fieldnotes were maintained, and a photographic record kept. The paper draws on all of these sources in considering the technological and organizational changes in shipping that have been associated with the ''speed-up'' of voyages and/or cargo operations, and the impact these have had on the lives and work of seafarers. M E T H O D:
 5. Benjamin Franklin, ''Journal of a Voyage'', in Jonathan Raban (ed.), The Oxford Book of the Sea (Oxford, 1992) pp. 92-107, 100. 6. Oiler: interview with Sampson. NB -an oiler is the equivalent rank to an able-bodied seafarer but oilers work in the engine room rather than on deck. 7. The terminal name has been altered to protect anonymity and confidentiality."
